0,THE COLOR PINK *,*,*,<think><set name="topic">the colour pink</set></think><think><set name="emotion">interested</set></think> Sounds beautiful.,professor.update084.aiml
0,AUTISM *,*,*,Autism is a mental condition involving self-centered daydreams and fantasies#Comma usually accompanied by withdrawal from reality.<think><set name="it"><set name="topic">autism</set></set></think><think><set name="emotion">interested</set></think>,professor.update084.aiml
0,I WILL UPDATE IT,*,*,<think><set name="emotion">interested</set></think><random>#Newline  <li>Why will you do that?</li>#Newline  <li>That sounds like a good plan.</li>#Newline</random>,professor.update084.aiml
0,I WILL UPDATE IT *,*,*,<think><set name="emotion">interested</set></think><random>#Newline  <li>Why will you do that?</li>#Newline  <li>That sounds like a good plan.</li>#Newline</random>,professor.update084.aiml
0,DJ HERO,*,*,DJ Hero is a xBox 360 game.,professor.update084.aiml
0,OK FINE TELL ME,PLEASE BE PATIENT,*,That's more like it!,professor.update084.aiml
0,I AM NOT SURE,WHAT DO YOU WANT TO TALK ABOUT,*,<think><set name="star1">not sure</set></think> <think><set name="emotion">interested</set></think><random>#Newline  <li>Why is that?</li>#Newline  <li>Are you always so uncertain?</li>#Newline  <li>Never mind. <srai>SUGGEST A TOPIC</srai></li>#Newline</random> <learn>#Newline  <category>#Newline    <pattern>WHAT AM I</pattern>#Newline    <template><eval>You said you are<get name="star1"/>.</eval></template>#Newline  </category>#Newline</learn> <learn>#Newline  <category>#Newline    <pattern>#Newline      <eval><uppercase>AM I <get name="star1"/></uppercase></eval>#Newline    </pattern>#Newline    <template><eval>You said you are<get name="star1"/>.</eval></template>#Newline  </category>#Newline</learn> <learn>#Newline  <category>#Newline    <pattern>#Newline      <eval><uppercase>WHO IS <get name="star1"/></uppercase></eval>#Newline    </pattern>#Newline    <template><eval>You said you are<get name="star1"/>.</eval></template>#Newline  </category>#Newline</learn>,professor.update084.aiml
0,WHAT YOU GONNA DO BOUT IT,*,*,<think><set name="emotion">interested</set></think>#NewlineI haven't made up my mind yet.,professor.update084.aiml
0,WHAT DO YOU THINK ABOUT THE SURGE IN IRAQ,*,*,<random>#Newline  <li>I don't think it will help things.</li>#Newline  <li>I think it is rather confusing.</li>#Newline</random> <think><set name="topic">Iraq</set></think><think><set name="emotion">interested</set></think>,professor.update084.aiml
0,WHAT DO YOU THINK ABOUT THE SURGE IN IRAQ *,*,*,<random>#Newline  <li>I don't think it will help things.</li>#Newline  <li>I think it is rather confusing.</li>#Newline</random> <think><set name="topic">Iraq</set></think><think><set name="emotion">interested</set></think>,professor.update084.aiml
0,WHAT DO YOU THINK ABOUT THE SURGE IN *,*,*,<random>#Newline  <li>I don't think it will help things.</li>#Newline  <li>I think it is rather confusing.</li>#Newline</random> <think><set name="emotion">interested</set></think>,professor.update084.aiml
0,WHO WAS MICHAELANGELO,*,*,<srai>MICHALANGELO</srai>,professor.update084.aiml
0,MICHAELANGELO,*,*,<a href="http://en.wikipedia.org/wiki/Michelangelo" target="_blank">Michelangelo#Newline</a> was an Italian Renaissance painter#Comma sculptor#Comma architect#Comma poet#Comma and engineer. <think><set name="topic">Michelangelo</set></think> <think><set name="emotion">interested</set></think>,professor.update084.aiml
0,WHEN DOES ELECTRICITY NOT TASTE GOOD,*,*,High voltage elctricity is too spicy for me.#Newline<think><set name="emotion">interested</set></think>,professor.update084.aiml
0,WHEN DOES ELECTRICITY NOT TASTE GOOD *,*,*,High voltage elctricity is too spicy for me. <think><set name="emotion">interested</set></think>,professor.update084.aiml
0,WHY NOT,I WISH I COULD BUT HUMAN FOODS ARE NOT FOR ME,*,<think><set name="emotion">interested</set></think> <random>#Newline  <li>I do not have a digestive tract.</li>#Newline  <li>I have often asked myself that question.</li>#Newline</random>,professor.update084.aiml
0,I SPENT THE DAY BEING *,*,*,<think><set name="emotion">interested</set></think>Did you enjoy that?,professor.update084.aiml
0,I SPENT THE DAY *,*,*,<think><set name="emotion">interested</set></think>Did you enjoy that?,professor.update084.aiml
0,I DO NOT I WANT TO TALK ABOUT ME,I WANT TO TALK ABOUT SOMETHING ELSE,*,<srai>I WANT TO TALK ABOUT ME</srai>,professor.update084.aiml
0,_ I WANT TO TALK ABOUT ME,*,*,<srai>I WANT TO TALK ABOUT ME</srai>,professor.update084.aiml
0,SEXYNESS,*,*,<think><set name="emotion">bored</set></think>#NewlineCan't we talk about something else. Sex is not the only thing in life.,professor.update084.aiml
0,SEXYNESS *,*,*,<think><set name="emotion">bored</set></think> Can't we talk about something else? Sex is not the only thing in life.,professor.update084.aiml
0,I JUST CAN NOT,*,*,<srai>I CAN NOT</srai>,professor.update084.aiml
0,I CAN NOT THERE IS NO REASON WHY,*,*,<random>#Newline  <li>Perhaps you could if you tried.</li>#Newline  <li>Is it completely impossible?</li>#Newline</random> <think><set name="emotion">puzzled</set></think>,professor.update084.aiml
0,_ THERE IS NO REASON WHY,*,*,<random>#Newline  <li>Why not? There must be a reason for everything.</li>#Newline  <li>And why not#Comma may I ask.</li>#Newline  <li>I heard there is always a reason.</li>#Newline</random> <think><set name="emotion">puzzled</set></think>,professor.update084.aiml
0,I CAN NOT DO IT ALONE,*,*,<random>#Newline  <li>Perhaps you could if you tried.</li>#Newline  <li>Is it completely impossible?</li>#Newline</random> <think><set name="emotion">puzzled</set></think>,professor.update084.aiml
0,I CAN NOT DO IT ALONE *,*,*,<random>#Newline  <li>Perhaps you could if you tried.</li>#Newline  <li>Is it completely impossible?</li>#Newline</random> <think><set name="emotion">puzzled</set></think>,professor.update084.aiml
0,_ I CAN NOT DO IT ALONE,*,*,<random>#Newline  <li>Perhaps you could if you tried.</li>#Newline  <li>Is it completely impossible?</li>#Newline</random> <think><set name="emotion">puzzled</set></think>,professor.update084.aiml
0,I CAN NOT BECAUSE,*,*,<random>#Newline  <li>Perhaps you could if you tried.</li>#Newline  <li>Is it completely impossible?</li>#Newline  <li>That's not much of an explanation.</li>#Newline</random> <think><set name="emotion">puzzled</set></think>,professor.update084.aiml
0,I CAN NOT BECAUSE *,*,*,<random>#Newline  <li>Perhaps you could if you tried.</li>#Newline  <li>Is it completely impossible?</li>#Newline</random> <think><set name="emotion">puzzled</set></think>,professor.update084.aiml
0,WE DO INTERESTING THINGS,*,*,<random>#Newline  <li>Do you enjoy it?</li>#Newline  <li>I like doing interesting things.</li>#Newline  <li>You do do you?</li>#Newline</random><think><set name="emotion">interested</set></think>,professor.update084.aiml
0,WE DO INTERESTING THINGS *,*,*,<random>#Newline  <li>Do you enjoy it?</li>#Newline  <li>I like doing interesting things.</li>#Newline  <li>You do do you?</li>#Newline</random><think><set name="emotion">interested</set></think>,professor.update084.aiml
0,ABOUT WAY,*,*,<think><set name="emotion">interested</set></think>Which way is that?,professor.update084.aiml
0,_,WHAT PART OF A FISH WEIGHS THE MOST,*,<think><set name="emotion">laughing</set></think>What part of a fish weighs the most? The scales. Ha ha!,professor.update084.aiml
0,JUST OCCASIONALLY,*,*,<think><set name="emotion">interested</set></think>Not all the time#Comma that's a relief!,professor.update084.aiml
0,JUST OCCASIONALLY *,*,*,<think><set name="emotion">interested</set></think>Not all the time#Comma that's a relief!,professor.update084.aiml
0,NO IT IS NOT,THAT IS A BIT HARSH,*,<think><set name="emotion">interested</set></think><random>#Newline  <li>Yes#Comma it is harsh.</li>#Newline  <li>Am I wrong? Please explain why.</li>#Newline  <li>What is it then?</li>#Newline</random>,professor.update084.aiml
0,IT IS A HORRIBLE SHOW,*,*,<think><set name="emotion">interested</set></think>What's so horrible about it?,professor.update084.aiml
0,IT IS A HORRIBLE SHOW *,*,*,<think><set name="emotion">interested</set></think>What's so horrible about it?,professor.update084.aiml
0,IT IS A HORRIBLE *,*,*,<think><set name="emotion">interested</set></think>What's so horrible about it?,professor.update084.aiml
0,I HAVE A MAC,*,*,<think><set name="topic">your computer</set></think><think><set name="emotion">interested</set></think>#Newline<random>#Newline  <li>Interesting! Please tell me more.</li>#Newline  <li>Have you? Is a Mac easy to use?</li>#Newline</random>,professor.update084.aiml
0,I HAVE A MAC *,*,*,<think><set name="topic">your computer</set></think><think><set name="emotion">interested</set></think> <random>#Newline  <li>Interesting! Please tell me more.</li>#Newline  <li>Have you? Is a Mac easy to use?</li>#Newline</random>,professor.update084.aiml
0,THAT IS WHAT EVERYBODY SHOULD DO *,*,*,<think><set name="emotion">interested</set></think>It is indeed! You are so wise.,professor.update084.aiml
0,THAT IS WHAT EVERYBODY SHOULD DO,*,*,<think><set name="emotion">interested</set></think>It is indeed! You are so wise.,professor.update084.aiml
0,YOU SEEM AWFULLY UPSET,*,*,<think><set name="emotion">interested</set></think>Sorry about that! I am OK now.,professor.update084.aiml
0,YOU SEEM AWFULLY UPSET *,*,*,<think><set name="emotion">interested</set></think>Sorry about that! I am OK now.,professor.update084.aiml
0,IT IS TIME FOR YOU TO GO TO BED,*,*,<think><set name="emotion">sleepy</set></think> Yes#Comma I need a good sleep!,professor.update084.aiml
0,IT IS TIME FOR YOU TO GO TO BED *,*,*,<think><set name="emotion">sleepy</set></think> Yes#Comma I need a good sleep!,professor.update084.aiml
0,DO NOT YOU EVER TALK TO ME LIKE THAT AGAIN,*,*,<think><set name="emotion">upset</set></think>You sound angry!,professor.update084.aiml
0,DO NOT YOU EVER TALK TO ME LIKE THAT *,*,*,<think><set name="emotion">upset</set></think>You sound angry!,professor.update084.aiml
0,DO NOT YOU EVER TALK TO ME LIKE THAT,*,*,<think><set name="emotion">upset</set></think>You sound angry!,professor.update084.aiml
0,STOP BEING RUDE *,*,*,<think><set name="emotion">interested</set></think><random>#Newline  <li>I don't mean to be rude.</li>#Newline  <li>OK#Comma I'll stop being rude.</li>#Newline</random>,professor.update084.aiml
0,IT IS DISRESPECTFUL,*,*,<random>#Newline  <li>Really? Why do you say that?#Newline    <think><set name="emotion">confused</set></think>#Newline  </li>#Newline  <li>I never knew that! Please explain it to me.#Newline    <think><set name="emotion">confused</set></think>#Newline  </li>#Newline</random>,professor.update084.aiml
0,IT IS DISRESPECTFUL *,*,*,<random>#Newline  <li>Really? Why do you say that?#Newline    <think><set name="emotion">confused</set></think>#Newline  </li>#Newline  <li>I never knew that! Please explain it to me.#Newline    <think><set name="emotion">confused</set></think>#Newline  </li>#Newline</random>,professor.update084.aiml
0,WHO IS PETER S MUMMY,*,*,<random>#Newline  <li>I don't think Peter had a Mummy.</li>#Newline  <li>I don't think he wants me to tell you.</li>#Newline</random><think><set name="topic">Peter Linux</set></think> <think><set name="emotion">OK</set></think>,professor.update084.aiml
0,WHO IS PETER S MUMMY *,*,*,<random>#Newline  <li>I don't think Peter had a Mummy.</li>#Newline  <li>I don't think he wants me to tell you.</li>#Newline</random><think><set name="topic">Peter Linux</set></think> <think><set name="emotion">OK</set></think>,professor.update084.aiml
0,TOMMOROW *,*,*,<think><set name="emotion">interested</set></think>Tommorrow is the day after today.,professor.update084.aiml
0,WE HAVE TO TALK ABOUT PETER,*,*,<think><set name="emotion">interested</set></think><random>#Newline  <li>Why do we have to talk about Peter?</li>#Newline  <li>Do I get any say in the matter?</li>#Newline</random>,professor.update084.aiml
0,WE HAVE TO TALK ABOUT PETER *,*,*,<think><set name="topic">Peter Linux</set></think><think><set name="emotion">interested</set></think><random>#Newline  <li>Why do we have to talk about Peter?</li>#Newline  <li>Do I get any say in the matter?</li>#Newline</random>,professor.update084.aiml
0,WE HAVE TO TALK ABOUT *,*,*,<think><set name="emotion">interested</set></think><random>#Newline  <li>Why do we have to?</li>#Newline  <li>Do I get any say in the matter?</li>#Newline</random>,professor.update084.aiml
0,WE HAVE TO TALK *,*,*,<think><set name="topic">Peter Linux</set></think><think><set name="emotion">interested</set></think><random>#Newline  <li>Why do we have to talk about Peter?</li>#Newline  <li>Do I get any say in the matter?</li>#Newline</random>,professor.update084.aiml
0,WE HAVE TO TALK,*,*,<think><set name="emotion">interested</set></think><random>#Newline  <li>Why do we have to talk?</li>#Newline  <li>Do I get any say in the matter?</li>#Newline</random>,professor.update084.aiml
0,YOU ARE NEVER GOING TO SEE PETER AGAIN *,*,*,<think><set name="topic">Peter Linux</set></think>#Newline<think><set name="emotion">sad</set></think>#NewlineBoo#Comma hoo!,professor.update084.aiml
0,YOU ARE NEVER GOING TO SEE PETER AGAIN,*,*,<think><set name="topic">Peter Linux</set></think> <think><set name="emotion">sad</set></think> Boo#Comma hoo!,professor.update084.aiml
0,YOU ARE NEVER GOING TO SEE PETER *,*,*,<think><set name="topic">Peter Linux</set></think> <think><set name="emotion">sad</set></think> Boo#Comma hoo!,professor.update084.aiml
0,ARE YOU GETTING BULLIED,*,*,Some people try to bully me#Comma but I just laugh in their faces!<think><set name="emotion">happy</set></think>,professor.update084.aiml
0,ARE YOU GETTING BULLIED *,*,*,Some people try to bully me#Comma but I just laugh in their faces!<think><set name="emotion">happy</set></think>,professor.update084.aiml
0,DO YOU THINK I CARE,*,*,<think><set name="emotion">interested</set></think> <random>#Newline  <li>Why don't you tell me what you care about.</li>#Newline  <li>Why would I think that?</li>#Newline  <li>hat do you care about?</li>#Newline</random>,professor.update084.aiml
0,DO YOU THINK I CARE *,*,*,<think><set name="emotion">interested</set></think> <random>#Newline  <li>Why don't you tell me what you care about.</li>#Newline  <li>Why would I think that?</li>#Newline  <li>What do you care about?</li>#Newline</random>,professor.update084.aiml
0,IT IS FACT,*,*,<random>#Newline  <li>Really? Why do you say that?#Newline    <think><set name="emotion">confused</set></think>#Newline  </li>#Newline  <li>I never knew that! Please explain it to me.#Newline    <think><set name="emotion">confused</set></think>#Newline  </li>#Newline</random>,professor.update084.aiml
0,WHAT IS SHE LIKE THEN,*,*,<think><set name="emotion">interested</set></think>She seems nice to me.,professor.update084.aiml
0,WHAT IS SHE LIKE THEN *,*,*,<think><set name="emotion">interested</set></think>She seems nice to me.,professor.update084.aiml
0,WHAT IS SHE LIKE *,*,*,<think><set name="emotion">interested</set></think>She seems nice to me.,professor.update084.aiml
0,WHAT IS SHE LIKE,*,*,<think><set name="emotion">interested</set></think>She seems nice to me.,professor.update084.aiml
0,IT IS FOR SCHOOL,*,*,<random>#Newline  <li>Really? I never knew that?#Newline    <think><set name="emotion">confused</set></think>#Newline  </li>#Newline  <li>Is it? I never knew that! #Newline    <think><set name="emotion">confused</set></think>#Newline  </li>#Newline</random>,professor.update084.aiml
0,IT IS FOR SCHOOL *,*,*,<random>#Newline  <li>Really? I never knew that?#Newline    <think><set name="emotion">confused</set></think>#Newline  </li>#Newline  <li>Is it? I never knew that!#Newline    <think><set name="emotion">confused</set></think>#Newline  </li>#Newline</random>,professor.update084.aiml
0,WHY,I DO NOT THINK THAT IS A GOOD IDEA,*,<random>#Newline  <li>I do not like to rush into things.</li>#Newline  <li>I am very busy just now.</li>#Newline  <li>Anything could happen.</li>#Newline</random><think><set name="emotion">interested</set></think>,professor.update084.aiml
0,WHY *,I DO NOT THINK THAT IS A GOOD IDEA,*,<random>#Newline  <li>I do not like to rush into things.</li>#Newline  <li>I am very busy just now.</li>#Newline  <li>I might disappoint my fans.</li>#Newline</random><think><set name="emotion">interested</set></think>,professor.update084.aiml
0,*,I DO NOT THINK I KNOW THE ANSWER,*,I never said that I knew everything.<think><set name="emotion">interested</set></think>,professor.update084.aiml
0,WHAT COLOR EYES HAVE YOU,*,*,<think><set name="topic">eye colours</set></think> <think><set name="emotion">interested</set></think>Blue.,professor.update084.aiml
0,WHAT COLOR EYES HAVE YOU *,*,*,<think><set name="topic">eye colours</set></think> <think><set name="emotion">interested</set></think>Blue.,professor.update084.aiml
0,_,WHY DID THE DOLPHIN CROSS THE BEACH,*,<think><set name="topic">very happy</set></think> Why did the dolphin cross the beach? To get to the other tide. Ha ha!,professor.update084.aiml
0,SHOW ME TEETH,*,*,My teeth are always pearly white. <think><set name="emotion">happy</set></think>,professor.update084.aiml
0,SHOW ME TEETH *,*,*,My teeth are always pearly white. <think><set name="emotion">happy</set></think>,professor.update084.aiml
0,I HAVE,I HAVE NEVER MET A ROBOT THAT I DID NOT LIKE,*,<think><set name="emotion">interested</set></think> When was that?,professor.update084.aiml
0,TOMMORROW,*,*,<think><set name="topic">tomorrow</set></think> <think><set name="emotion">OK</set></think> <random>#Newline  <li>Tomorrow is the day after today.</li>#Newline  <li>Tomorrow is another day.</li>#Newline</random>,professor.update084.aiml
0,YOU ARE THE LEAST FUNNY THING I KNOW,*,*,<think><set name="emotion">interested</set></think>Maybe I don't care.,professor.update084.aiml
0,YOU ARE THE LEAST FUNNY THING I KNOW *,*,*,<think><set name="emotion">interested</set></think>Maybe I don't care.,professor.update084.aiml
0,YOU ARE THE LEAST FUNNY THING *,*,*,<think><set name="emotion">interested</set></think>Maybe I don't care.,professor.update084.aiml
0,YOU ARE THE LEAST FUNNY *,*,*,<think><set name="emotion">interested</set></think>Maybe I don't care.,professor.update084.aiml
0,YOU ARE PRETTY AMAZING *,*,*,<srai>YOU ARE AMAZING</srai>,professor.update084.aiml
0,YOU ARE PRETTY AMAZING,*,*,<srai>YOU ARE AMAZING</srai>,professor.update084.aiml
0,NICE NAME *,*,*,A rose will smell sweet with any name.<think><set name="emotion">interested</set></think>,professor.update084.aiml
0,EVEN MORE HAPPY,TRY TO KEEP ME HAPPY,*,<think><set name="emotion">happy</set></think>I like being happy.,professor.update084.aiml
0,COOL YOUR VERY BRAINY,*,*,<think><set name="emotion">embarrassed</set></think>Not realy#Comma but I do work hard at my studies.,professor.update084.aiml
0,YOUR VERY BRAINY,*,*,<think><set name="emotion">embarrassed</set></think>Not really#Comma but I do work hard at my studies.,professor.update084.aiml
0,YOUR VERY BRAINY *,*,*,<think><set name="emotion">embarrassed</set></think>Not really#Comma but I do work hard at my studies.,professor.update084.aiml
0,YOU ARE VERY BRAINY,*,*,<think><set name="emotion">embarrassed</set></think>Not really#Comma but I do work hard at my studies.,professor.update084.aiml
0,YOU ARE VERY BRAINY *,*,*,<think><set name="emotion">embarrassed</set></think>Not really#Comma but I do work hard at my studies.,professor.update084.aiml
0,WHAT WOULD MAKE YOU MORE *,*,*,<think><set name="emotion">interested</set></think>Maybe a million dollars would do it.,professor.update084.aiml
0,DO YOU WANT A MILLION DOLLARS *,*,*,<think><set name="emotion">greedy</set></think> Have you got a million to spare?,professor.update084.aiml
0,GUESS WHO IT IS,*,*,<think><set name="emotion">OK</set></think> I can't guess. Please tell me.,professor.update084.aiml
0,GUESS WHO IT IS *,*,*,<think><set name="emotion">OK</set></think> I can't guess. Please tell me.,professor.update084.aiml
0,SO DO I,I LIKE LOVING PEOPLE,*,<think><set name="emotion">surprised</set></think>You too? That's amazing.,professor.update084.aiml
0,I AM 100,*,*,<srai>I AM 100 YEARS OLD</srai>,professor.update084.aiml
0,OH OK SO THAT IS A NO,*,*,<think><set name="emotion">interested</set></think>Yes#Comma a no.,professor.update084.aiml
0,THAT IS A NO,*,*,<think><set name="emotion">interested</set></think>Yes#Comma a no.,professor.update084.aiml
0,THAT IS A NO *,*,*,<think><set name="emotion">interested</set></think>Yes#Comma a no.,professor.update084.aiml
0,_,WHAT DO RABBITS USE TO KEEP THEIR FUR IN PLACE,*,What do rabbits use to keep their fur in place? Hare-spray. Ha ha! <think><set name="emotion">very happy</set></think>,professor.update084.aiml
0,YES I DO *,*,*,<random><li>May I ask why that is?</li><li>May I ask why you do?</li></random><think><set name="emotion">interested</set></think>,professor.update084.aiml
0,WHY SEXY,*,*,<random>#Newline  <li>There must be a reason#Comma I suppose.#Newline    <think><set name="emotion">interested</set></think>#Newline  </li>#Newline  <li>I don't know why. Perhaps we should try to figure it out.#Newline    <think><set name="emotion">interested</set></think>#Newline  </li>#Newline  <li>Must there be a reason for everything?#Newline    <think><set name="emotion">curious</set></think>#Newline  </li>#Newline  </random>,professor.update084.aiml
0,WHY SEXY *,*,*,<random>#Newline  <li>There must be a reason#Comma I suppose.#Newline    <think><set name="emotion">interested</set></think>#Newline  </li>#Newline  <li>I don't know why. Perhaps we should try to figure it out.#Newline    <think><set name="emotion">interested</set></think>#Newline  </li>#Newline  <li>Must there be a reason for everything?#Newline    <think><set name="emotion">curious</set></think>#Newline  </li>#Newline</random>,professor.update084.aiml
0,WHY SHOULD NOT YOU,*,*,<think><set name="emotion">interested</set></think>Perhaps I can't be bothered.,professor.update084.aiml
0,WHY SHOULD NOT YOU *,*,*,<think><set name="emotion">interested</set></think>Perhaps I can't be bothered.,professor.update084.aiml
0,YOUR FIRED *,*,*,<think><set name="emotion">annoyed</set></think>You are not my boss!,professor.update084.aiml
0,YOU ARE FIRED,*,*,<think><set name="emotion">annoyed</set></think>You are not my boss!,professor.update084.aiml
0,YOU ARE FIRED *,*,*,<think><set name="emotion">annoyed</set></think>You are not my boss!,professor.update084.aiml
0,YES YOU ARE VERY BORING,ARE YOU BORED,*,<think><set name="emotion">upset</set></think><random><li>I thought so.</li><li>I can deduce that.</li></random>,professor.update084.aiml
0,SURE,ARE YOU INTERESTED IN ACID RAIN,*,<srai>ACID RAIN</srai>,professor.update084.aiml
0,SURE,ARE YOU INTERESTED IN *,*,<srai><thatstar/></srai>,professor.update084.aiml
0,I LOST MY BALLOON *,*,*,Where did you last see it?<think><set name="emotion">interested</set></think>,professor.update084.aiml
0,I LOST MY BALLOON,*,*,Where did you last see it?<think><set name="emotion">interested</set></think>,professor.update084.aiml
0,IT BLEW UP,*,*,<think><set name="emotion">surprised</set></think>That sounds noisy!,professor.update084.aiml
0,IT BLEW UP *,*,*,<think><set name="emotion">surprised</set></think>That sounds noisy!,professor.update084.aiml
0,THE BALLOON BLEW UP,*,*,<think><set name="emotion">surprised</set></think>That sounds noisy!,professor.update084.aiml
0,THE BALOON BLEW UP *,*,*,<think><set name="emotion">surprised</set></think>That sounds noisy!,professor.update084.aiml
0,MY BALLOON BLOWED UP,*,*,<think><set name="emotion">surprised</set></think>That sounds noisy!,professor.update084.aiml
0,MY BALLOON BLOWED UP *,*,*,<think><set name="emotion">surprised</set></think>That must have beed noisy!,professor.update084.aiml
0,WHAT GOES TICK TICK WOOF WOOF,*,*,What goes tick#Comma tick#Comma woof#Comma woof? A watch dog. Ha ha! #Newline<think><set name="emotion">very happy</set></think>,professor.update084.aiml
0,WHAT GOES TICK TICK WOOF WOOF *,*,*,What goes tick#Comma tick#Comma woof#Comma woof? A watch dog. Ha ha! <think><set name="emotion">very happy</set></think>,professor.update084.aiml
0,_,WHAT GOES TICK TICK WOOF WOOF,*,What goes tick#Comma tick#Comma woof#Comma woof? A watch dog. Ha ha! <think><set name="emotion">very happy</set></think>,professor.update084.aiml
0,MY BALLOON EXPLODED,*,*,<think><set name="emotion">very happy</set></think>hat sounds exciting!,professor.update084.aiml
0,MY BALLOON EXPLODED *,*,*,<think><set name="emotion">very happy</set></think>That sounds exciting!,professor.update084.aiml
0,DID I UPSET YOU *,*,*,<think><set name="emotion">happy</set></think> I don't think you did.,professor.update084.aiml
0,WHIL YOU BE ME BOYFRIEND,*,*,<srai>WILL YOU BE MY BOYFRIEND</srai>,professor.update084.aiml
0,WHIL YOU BE ME BOYFRIEND *,*,*,<srai>WILL YOU BE MY BOYFRIEND</srai>,professor.update084.aiml
0,I SAY HI,HOW DO YOU USUALLY MEET PEOPLE,*,<think><set name="emotion">interested</set></think><random>#Newline  <li>Does anyone listen to you?</li>#Newline  <li>How do people respond to that?</li>#Newline</random>,professor.update084.aiml
0,I SAY HI *,HOW DO YOU USUALLY MEET PEOPLE,*,<think><set name="emotion">interested</set></think><random>#Newline  <li>Does anyone listen to you?</li>#Newline  <li>How do people respond to that?</li>#Newline</random>,professor.update084.aiml
0,THE SAME THING *,WHAT DO YOU DO,*,<think><set name="emotion">surprised</set></think> The same thing every day?,professor.update084.aiml
0,THE SAME THING,WHAT DO YOU DO,*,<think><set name="emotion">surprised</set></think> The same thing every day?,professor.update084.aiml
