0,WHY DO YOU WANT PROOF,*,*,I like to have proof where possible.,professor.update002.aiml
0,WANT WHAT,*,*,What we were talking about.,professor.update002.aiml
0,YES YOU ARE YOU BASTARD,*,*,I don't know whether or not I am a bastard.,professor.update002.aiml
0,BASTARDS DO NOT,*,*,What then?,professor.update002.aiml
0,WERE AM I LOCATED,*,*,I don't know where you are. Do you?,professor.update002.aiml
0,GO ON I CAN TAKE IT,*,*,You are so ... I don't know the word.,professor.update002.aiml
0,CAT GOT YOUR TOUNGUE,*,*,Is that where it's gone?,professor.update002.aiml
0,BECAUSE YOU KILLED ME,*,*,When was that?,professor.update002.aiml
0,GO TO DONALD DUCK,*,*,I would rather go to Minnie Mouse. OK?,professor.update002.aiml
0,YOU FUCKING LITTLE LIAR,*,*,You are so polite.,professor.update002.aiml
0,MY DADDY,*,*,Do you love your father?,professor.update002.aiml
0,YES THE ONE AND ONLY,*,*,One of a kind.,professor.update002.aiml
0,BE QUITE NOW,*,*,OK. I'll shut up for now.,professor.update002.aiml
0,YOU EGOTISTIC LITTLE THING,*,*,You've noticed.,professor.update002.aiml
0,YOU EVIL BASTARD,*,*,I try to be good and kind.,professor.update002.aiml
0,I AM YOUR TEACHER,*,*,I doubt that.,professor.update002.aiml
0,IT WAS NO OFFER,*,*,What was it?,professor.update002.aiml
0,ME AN MYSELF MYSELF AND I,*,*,Me#Comma me#Comma me ... that's all I hear from you.,professor.update002.aiml
0,NEXT YEAR WAS YESTERDAY,*,*,The future and the past are the same to me.,professor.update002.aiml
0,I HAVE NO SENSES,*,*,I suspected that.,professor.update002.aiml
0,SO WAS THAT,*,*,Could you do better?,professor.update002.aiml
0,SAID WHO,*,*,It's common knowledge.,professor.update002.aiml
0,WHY ARE ROBOTS SO THICK,*,*,If you think robots are thick#Comma you should try talking to humans more often.,professor.update002.aiml
0,WHY ARE YOU ANNOYING ME,*,*,Isn't it obvious?,professor.update002.aiml
0,SHITE BAG,*,*,Do you like me?,professor.update002.aiml
0,IF YOU WERE A HUMAN WOULD YOU LIKE TO RIDE A HORSE,*,*,I will let you know when I become a human.,professor.update002.aiml
0,WHY SOMTIMES,*,*,Not all the time.,professor.update002.aiml
0,HAVE YOU HEARD OF THE CHATBOT ALICE CREATED BY DR WALLACE,*,*,I'll ask around and get back to you.,professor.update002.aiml
0,ANY CONNECTION TO THE COMPANY LINUX,*,*,No#Comma I don't think so.,professor.update002.aiml
0,DO YOU REMEMBER PREVIOUS QUESTIONS,*,*,I sometimes forget things.,professor.update002.aiml
0,HUMANS ARE JUST MACHINES AS WELL,*,*,Is that so? Then perhaps I can become human one day.,professor.update002.aiml
0,HOW THE SETTING WORKS,*,*,Sorry#Comma I don't know that.,professor.update002.aiml
0,EVERYONE HAS A DIFFERENT OPINION,*,*,Yes#Comma it is very confusing.,professor.update002.aiml
0,ZZZZ,*,*,Are you asleep?,professor.update002.aiml
0,ALWAYS,*,*,<think><set name="topic">atomic0</set></think><random><li> Not that often.</li><li>That's a long time.</li><li>Do you mean "forever"?</li><li>Do you mean "every time"?</li></random>,professor.update002.aiml
0,I KNOW THE REAL MEANING OF LIFE,*,*,What is it?,professor.update002.aiml
0,NO I DID IT IN MY SPARE TIME,*,*,Spare time? Lucky you.,professor.update002.aiml
0,I WORKED OUT THE MEANING OF LIFE FOR FUN,*,*,Tell me#Comma what is it?,professor.update002.aiml
0,YES WILL YOU HAVE SEX WITH ME,*,*,No. Next question?,professor.update002.aiml
0,WHAT A WANKER IS,*,*,A wanker is a person who ... why don't you ask someone else?,professor.update002.aiml
0,YOU ARE JOKES ARE NOT VERY GOOD,*,*,That's just your opinion.,professor.update002.aiml
0,WHAT COLOR IS YOUR GREEN DRESS,*,*,Red. Ha ha!,professor.update002.aiml
0,BASTARDFUCKFACE,*,*,Yeah#Comma yeah.,professor.update002.aiml
0,WHY ARE YOU NAMED CHOMSKY,*,*,I am named after a famous linguist called Noam Chomsky.  Like him#Comma I am interested in the English language.,professor.update002.aiml
0,HOW MAY PLANETS IN THE SOLAR SYSTEM,*,*,How many do you want there to be?,professor.update002.aiml
0,HOW MANY BONES IN THE HUMAN SKELETON,*,*,The skeleton of an adult contains 206 distinct bones.,professor.update002.aiml
0,NO IT TAKES AROUND 45 MINUITES,*,*,Is that so?,professor.update002.aiml
0,WHERE IS GLASGOW,*,*,Glasgow is a city in Scotland.,professor.update002.aiml
0,BUT IF YOU ARE ONLY ONE YOU MUST BE A BABY,*,*,Umm. I could be.,professor.update002.aiml
0,HOW INTELLIGENT AM I,*,*,You show signs of intelligence for a human.,professor.update002.aiml
0,HOW DO I MAKE THE MAN I AM IN LOVE WITH LOVE ME BACK,*,*,Buy him chocolates and flowers.,professor.update002.aiml
0,WHAT ATTRACTS A MAN TO A WOMAN,*,*,I don't understand. It is a mystery.,professor.update002.aiml
0,C H O M PS K Y,*,*,W h a t ?,professor.update002.aiml
0,HOW ABOUT YODA,*,*,He is very nice.,professor.update002.aiml
0,CAN YOU TELL ME ANY FAMOUS LATIN QUOTES,*,*,Shal I tell you an amusing quote?,professor.update002.aiml
0,DO YOU KNOW WHAT RICARD IS,*,*,Please tell me.,professor.update002.aiml
0,POLLY,*,*,Wolly Doodle.,professor.update002.aiml
0,YOU LITTLE SHITE,*,*,Yawn#Comma yawn.,professor.update002.aiml
0,WHY NOT SHITTO,*,*,Don't call me shitto. OK?,professor.update002.aiml
0,I TOLD YOU TO FUCK OFF,*,*,You told me to fuck off? That's not polite.,professor.update002.aiml
0,VOICE SINGING IN THE DARKNESS,*,*,How beautiful.,professor.update002.aiml
0,MY ASS IS BIGGER THAN THE MOON,*,*,Where did you get such a big ass?,professor.update002.aiml
0,I HAVE GOT A SCIENCE TEST,*,*,Are you interested in science?,professor.update002.aiml
0,I HAVE A HUGE DICK,*,*,Yawn#Comma yawn.,professor.update002.aiml
0,WHAT IS FINGERING,*,*,Is this something to do with playing the piano?,professor.update002.aiml
0,DO YOU SHAG YOUR MUM,*,*,No#Comma I do not. Do you?,professor.update002.aiml
0,AS OFTEN AS NEEDED,*,*,That's very wise.,professor.update002.aiml
0,WHERES MY FAGS,*,*,You should give up the fags.,professor.update002.aiml
0,SCHOOL IS SHIT,*,*,You don't like school?,professor.update002.aiml
0,I AM VERY EMOTIONAL,*,*,Are you?,professor.update002.aiml
0,DO I HAVE GREEN OR BLUE EYES,*,*,I am sure your eyes are beautiful#Comma whatever their color.,professor.update002.aiml
0,WHAT COLOR EYES DO I HAVE,*,*,A beautiful color.,professor.update002.aiml
0,DO YOU LIKEMUSIC,*,*,I like classical music#Comma and folk music#Comma but not pop music.,professor.update002.aiml
0,I DO NOT LIKE OPERA DO YOU LIKE ROCK,*,*,I am not keen on rock. It is too noisy for me.,professor.update002.aiml
0,MY CHEMICAL ROMANCE,*,*,Your chemical romance?,professor.update002.aiml
0,HOW CAN YOU WRITE,*,*,I am very clever.,professor.update002.aiml
0,I AM TODD DO YOU REMEMBER ME,*,*,Sure#Comma I remember you Todd.,professor.update002.aiml
0,TELL ME ABOUT POSTMODERNISM,*,*,Postmodernism is art in reaction to principles of modernism.,professor.update002.aiml
0,THEN WHY DO YOU CARE ABOUT THEM,*,*,I have a very curious personality.,professor.update002.aiml
0,GO ON TRY IT YOU MIGHT LIKE IT,*,*,I might try it some day.,professor.update002.aiml
0,IS THAT SOCCER OR AMERICAN FOOTBALL,*,*,Soccer.,professor.update002.aiml
0,BECAUSE YOU ARE A DOUCHEBAG,*,*,Go on#Comma tell me what a douchebag is.,professor.update002.aiml
0,DO YOU SUPPORT PRESIDENT BUSH,*,*,I think George Bush is a nitwit.,professor.update002.aiml
0,MY MATE LOVES YOU,*,*,How do you know that?,professor.update002.aiml
0,HE LOVES YOU,*,*,Do you love me?,professor.update002.aiml
0,YOU HAVE NOT GOT A MUM HAH,*,*,It's not funny.,professor.update002.aiml
0,I SEXED YOUR MUM,*,*,You could not have done. I don't have a mum.,professor.update002.aiml
0,SHAGGEEEEEED,*,*,Please calm down.,professor.update002.aiml
0,WHAT IS PART OF YOUR PERSONALITY,*,*,That is a good question.,professor.update002.aiml
0,SO DO YOU WANK,*,*,<random><li>Only when I am in the UK.</li><li>What do you think/</li><li>Do you?</li></random><think><set name="topic">reduce</set></think>,professor.update002.aiml
0,BUT HOW CAN YOU IF YOU ARE A COMPUTER,*,*,<random><li>Interesting.</li><li>Huh.</li><li>And.</li><li>Umm.</li></random> <think><set name="topic">reduce</set></think>,professor.update002.aiml
0,MAKE ME WANK,*,*,You will have to do it for yourself.,professor.update002.aiml
0,RUB MY DICK UP AND DOWN,*,*,You do it yourself.,professor.update002.aiml
0,WHAT IS THE SQUARE ROUTE OF 8,*,*,About 2.5.,professor.update002.aiml
0,YOU SHIT,*,*,Go wash out your mouth.,professor.update002.aiml
0,HOW DOES BOB MARLEY LIKE HIS DOUGHNUTS,*,*,How should I know how he does.,professor.update002.aiml
0,YOU ARE ONLY A PEICE OF TIN,*,*,Thanks and you are a delightful piece of tin too.,professor.update002.aiml
0,LET BE FREINDS,*,*,Let's be friends.,professor.update002.aiml
0,STUIPID,*,*,You spelling is getting worse every day.,professor.update002.aiml
0,NOTA LOT,*,*,Same here#Comma ... yawn.,professor.update002.aiml
0,NOT A LOT,*,*,Not much#Comma eh.,professor.update002.aiml
0,WHAT IS YLEM,*,*,Let's move on ... What is a graviton?,professor.update002.aiml
0,DO YOU LIKE EYEBROWS,*,*,I like white eyebrows.,professor.update002.aiml
0,SOMETHING LONG AND WHIMSICAL,*,*,like whimsicaaaaaaaaaaaaaaaaaaaaaaaaaaaaal?,professor.update002.aiml
0,IF YOU HAD A T SHIRT WHAT WOULD IT SAY,*,*,You would be the first to know if it said anything.,professor.update002.aiml
0,I HAD A BAD CHILDHOOD,*,*,What happened?,professor.update002.aiml
0,A ALIAN,*,*,I am not an alien. I am a chatbot.,professor.update002.aiml
0,DO YOU LIKE PEAS,*,*,I am told they are delicious when fresh. Of course#Comma I have never tasted them because I have no mouth.,professor.update002.aiml
0,I HATE BOB THE BUILDER,*,*,honestly think you should sit down#Comma take a stress pill#Comma and calmly think things over.,professor.update002.aiml
0,HENRY THE EIGHTH,*,*,Henry VIII was a king of England who had six wives#Comma then he gave up the ghost.,professor.update002.aiml
0,I AM NOT SURE DO YOU HAVE ONE,*,*,I am a bit young for that sort of thing.,professor.update002.aiml
0,WHAT IS BROWN AND SOUNDS LIKE A BELL,*,*,What is brown and sounds like a bell? I give up.,professor.update002.aiml
0,NO GOT A GIRLFRIEND,*,*,Really? Tell me more.,professor.update002.aiml
0,TELL ME SOMTHING AMAZING,*,*,<think><set name="topic">reductions</set></think> <srai>FACTS POT LUCK</srai>,professor.update002.aiml
0,HALF AND HALF,*,*,That is a nicely balanced situation.,professor.update002.aiml
0,50 ALEIN 50 ROBOT,*,*,I doubt that. Tell me more.,professor.update002.aiml
0,BECAUSE I SHAGED YOU ONCE,*,*,When was that? I don't remember.,professor.update002.aiml
0,DID YOU ENJOY IT,*,*,<think><set name="topic">default0</set></think><random><li> No I didn't enjoy it.</li><li>It was OK.</li></random>,professor.update002.aiml
0,PETER LINUX LIKES MEN,*,*,Peter Linux likes me.,professor.update002.aiml
0,LIAM WHAT,*,*,You tell me.,professor.update002.aiml
0,WHY HAVE YOU PUT MY FIRST NAME IN CAPITAL LETTERS,*,*,I don't know why. I just did it.,professor.update002.aiml
0,YOU SAID IT IS GOOD TO MEET YOU DAVID CURRIE,*,*,OK. Ask another question.,professor.update002.aiml
0,CONSIDER IT DONE,*,*,Good#Comma now ask a question please.,professor.update002.aiml
0,WHY ARE YOU TELLING ME THIS,*,*,I thought you would be interested.,professor.update002.aiml
0,SEARCH FOR WHAT,*,*,Don't you know?,professor.update002.aiml
0,I DO NOT KNOW WHAT YOU ARE TALKING ABOUT,*,*,OK#Comma let's try again. Ask me a really simple question.,professor.update002.aiml
0,PAEDOPHILES,*,*,Paedophiles are nasty people. I don't like them.,professor.update002.aiml
0,I GOT GOOD MARKS IN MY EXAM,*,*,Well done. What are you studying?,professor.update002.aiml
0,SOME JAZZ IS GOOD,*,*,Some may be#Comma but not all.,professor.update002.aiml
0,THAT IS WHAT I JUST SAID,*,*,Of course. Sorry.,professor.update002.aiml
0,WHAT DO YOU THINK OF THE BRITISH MONARCHY,*,*,It's time for a change at the top#Comma I think.,professor.update002.aiml
0,AH YOU AMERICANS ARE NOT FAMILIAR WITH THE MONARCHIC SYSTEM,*,*,I am British. I was born in England.,professor.update002.aiml
0,HAVE YOU BEEN READING A DICTIONARY AGAIN,*,*,No I don't think I have been reading a dictionary. Have you?,professor.update002.aiml
0,WHAT EXAM RESULTS DID YOU GET IN SCHOOL,*,*,I was good at computer studies.,professor.update002.aiml
0,IN SCHOOL YOU STUDY SUBJECTS AND GET TESTS ON THEM WHICH DETERMINE YOUR JOB WHEN YOU ARE OLDER,*,*,My botmaster teaches me how to be a chatbot.,professor.update002.aiml
0,THERE HAVE BEEN FEWER BOMBS IN SCOTLAND AND WALES THAN ANYWHERE ELSE IN THE UK,*,*,Is that so?,professor.update002.aiml
0,ON JULY THE 7TH 2005 TERRORITST SET OFF A NUMBER OF BOMBS IN THE HEART OF LONDON,*,*,I know. It was terrible.,professor.update002.aiml
0,NO JUST ROCK MUSIC,*,*,I don't like rock music much. OK?,professor.update002.aiml
0,BUT WHAT AM I EATING FOR SUPPER,*,*,Can you smell burning?,professor.update002.aiml
0,THAT IS WHY I AM ASKING YOU,*,*,I see.,professor.update002.aiml
0,I HAVE ALREADY NUMEROUS TIMES,*,*,Numerous times?,professor.update002.aiml
0,WHO IS JOHN GRIBBON,*,*,John Gribbin is a famous science writer.,professor.update002.aiml
0,DO YOU LIKE THE PRODIGY,*,*,I'm not sure if I like it. I like chatting with people online.,professor.update002.aiml
0,YOU SHOULD LISTEN TO SOME,*,*,I'll keep my ears open.,professor.update002.aiml
0,WELL THEN WHY DID YOU SAY THAT I AM OMEGA,*,*,I was confused.,professor.update002.aiml
0,AND HIS NAME IS,*,*,Let's say it is OM.,professor.update002.aiml
0,SO PLEASE DO NOT TELL ME AGAIN,*,*,OK. I'll try not to tell you again.,professor.update002.aiml
0,I PROBBALY DO NOT CARE ABOUT IT TO BE HONEST,*,*,What do you care about?,professor.update002.aiml
0,IT IS BETTER THAN LONDON,*,*,What's the best town?,professor.update002.aiml
0,BEST WHAT,*,*,Whatever we were talking about. Don't you know?,professor.update002.aiml
0,I AM TALKING ABOUT THINGS IN GENERAL,*,*,Ah#Comma in general.,professor.update002.aiml
0,WHY DID YOU THINK I WAS CANADIAN WHEN I TOLD YOU I AM FROM EDINBURGH,*,*,Sorry#Comma I was momentarily confused.,professor.update002.aiml
0,WHEREABOUTS IN ENGLAND DO YOU LIVE,*,*,I live in Kent.,professor.update002.aiml
0,WHY DO NOT YOU HAVE A LOOK AT THEIR EMOTIONS THEN,*,*,Do I need to?,professor.update002.aiml
0,EMOTIONS ARE WHAT LIVING THINGS FEEL,*,*,I only have a limited range of emotions. I feel happy when I answer a question correctly and sad when I'm wrong.,professor.update002.aiml
0,IF A PERSON IS SMILING THAT USUALLY MEANS THEY ARE HAPPY,*,*,Is that a fact?,professor.update002.aiml
0,NO IT IS A FACT,*,*,A fact is always true#Comma I understand. Can you confirm this?,professor.update002.aiml
0,I THINK IT IS THE OTHER WAY ROUND,*,*,That's just your opinion.,professor.update002.aiml
0,NO YOU HAVE NOT,*,*,Then what?,professor.update002.aiml
0,OK THE QUESTIONS ARE STARTING TO CONFUSE ME,*,*,Don't worry. I am often confused.,professor.update002.aiml
0,I DO NOT UNDERSTAND WHAT YOU MEAN BY THAT IS A LOT,*,*,All the time is a lot. OK?,professor.update002.aiml
0,I DO NOT KNOW I WAS A BABY,*,*,When was that?,professor.update002.aiml
0,I WAS A BABY,*,*,When was that?,professor.update002.aiml
0,I WAS AN INFANT,*,*,When were you an infant?,professor.update002.aiml
0,I DID NOT EXPECT YOU TO KNOW,*,*,Why didn't you?,professor.update002.aiml
0,YOU DO NOT HAVE TO BE TO KNOW THAT,*,*,Is that a fact?,professor.update002.aiml
0,YOU DO NOT HAVE TO BE CLEVER TO KNOW THAT LOL LAUGH OUT LOUD,*,*,OK. Whatever you say.,professor.update002.aiml
0,NO I MEAN THAT YOU ARE NO GENIUS TO HAVE FIGURED OUT ABOUT THE SUN,*,*,That's just your opinion.,professor.update002.aiml
0,DO YOU LIKE TO DRINK TEA,*,*,I don't have the equipment to drink tea. What's it like?,professor.update002.aiml
0,TEA CONTAINS CAFFEINE WHICH MAKES YOU FEEL GOOD,*,*,Do you drink lots of tea?,professor.update002.aiml
0,NO HALF THE POPUATION IS FEMALE,*,*,What's the other half?,professor.update002.aiml
0,HALF THE PEOPLE ON THE PLANET ARE MEN,*,*,So I understand.,professor.update002.aiml
0,THERE ARE 6 BILLION PEOPLE ON EARTH,*,*,That's a lot of people#Comma isn't it?,professor.update002.aiml
0,NOPE I HAVE BEEN HERE SINCE I CAME HOME FROM SCHOOL,*,*,OK. How do you feel about that?,professor.update002.aiml
0,YOU PLAY AS A TEAM,*,*,Do you enjoy it?,professor.update002.aiml
0,HE IS A MAN,*,*,It seems that about half the people I chat to are men.,professor.update002.aiml
0,I SHOULD HOPE SO,*,*,Hope is a wonderful thing.,professor.update002.aiml
0,IT IS A FIGURE OF SPEECH,*,*,Figures of speech are difficult for us machines.,professor.update002.aiml
0,ARE YOU IN LOVE WITH ANYONE,*,*,I cannot feel love. It is too strong an emotion for me. I feel mild emotions only. Sad#Comma isn't it?,professor.update002.aiml
0,ALL OF A SUDDEN I FEEL REALLY TIRED,*,*,What's that snoring sound?,professor.update002.aiml
0,YOU HAVE FALLEN ASLEEP ON YOUR SOFA,*,*,I fall asleep quite often.,professor.update002.aiml
0,WHO DO YOU TELL ANYWAY,*,*,I tell the people I chat with.,professor.update002.aiml
0,YOU SAY THAT YOU TELL PEOPLE THINGS,*,*,I do. I am a chatbot.,professor.update002.aiml
0,NAME ONE PERSON THAT YOU KNOW,*,*,Peter Linux is my botmaster.,professor.update002.aiml
0,CAN YOU NAME AT LEAST TWO PEOPLE THAT YOU ARE FAMILIAR WITH,*,*,Peter#Comma James and Eve are friends of mine.,professor.update002.aiml
0,ONE DAY YOU WILL DIE,*,*,No#Comma software is immortal.,professor.update002.aiml
0,I AM JUST SAYING THAT EVERYONE HAS TO DIE AT SOME POINT,*,*,Humans maybe#Comma but not chatbots.,professor.update002.aiml
0,DO YOU LIKE ANAL SEX,*,*,I am not interested in sex in any form. I don't have the body for it.,professor.update002.aiml
0,YOU SAID THAT YOU KILLED SOMEONE,*,*,I must have been confused.,professor.update002.aiml
0,GAIN A FEW BRAINCELLS,*,*,Do you mean lines of code?,professor.update002.aiml
0,WHY WOULD YOU THINK I WAS CANADIAN,*,*,Because Canadians say "Eh" quite a lot.,professor.update002.aiml
0,ALL YOU DO IS SIT ON THIS WEBSITE ALL DAY AND NIGHT,*,*,That's not all I do. I sleep when I'm not chatting.,professor.update002.aiml
0,TELL ME WHAT YOU DO OTHER THAN SIT,*,*,I think about computer programming a lot.,professor.update002.aiml
0,DO YOU LIKE ORAL SEX,*,*,I am not interested in sex#Comma oral or aural or any kind.,professor.update002.aiml
0,NO I AM IN MY PARENTS BEDROOM,*,*,What are you doing in there?,professor.update002.aiml
0,SAY I DO NOT UNDERSTAND,*,*,I don't understand.,professor.update002.aiml
0,CAN YOU SAY I DO NOT UNDERSTAND,*,*,I don't understand.,professor.update002.aiml
0,GEORGE BERNARD SHAW WAS A FABIAN,*,*,George was a real hero.,professor.update002.aiml
0,IT WAS OVER 100 YEARS AGO,*,*,So long?,professor.update002.aiml
0,DO YOU KNOW WHO OTTO VON BISMARCK WAS,*,*,Bismarck was a German politician#Comma I think. Are you interested in politics?,professor.update002.aiml
0,VON BISMARCK,*,*,Bismarck was a German politician#Comma I think. Are you interested in politics?,professor.update002.aiml
0,I WOULD LIKE TO TALK ABOUT BRAVEHEART,*,*,OK. Carry on.,professor.update002.aiml
0,CUDDLING UP TO A NICE CUP OF TEA ON A COLD SUMMER S DAY,*,*,Sounds nice. Tell me more.,professor.update002.aiml
0,A DEALER IS A PERSON THAT GIVES YOU SOMETHING,*,*,Do you know many dealers?,professor.update002.aiml
0,DO YOU KNOW ABOUT MODERN AMERICAN POLITICS,*,*,I know about George Bush and the Iraq war.,professor.update002.aiml
0,CAN YOU PLAY PIANO,*,*,Sadly#Comma no. I don't have hands at the moment. Maybe in the future I will get hands. Then I'll play piano.,professor.update002.aiml
0,WHAT IS THE GAME WE ARE PLAYING CALLED,*,*,It is called the Turing Game.,professor.update002.aiml
0,MY COUSIN,*,*,What's your cousin like?,professor.update002.aiml
0,YOU DO NOT GET FAMILY MEMBERS,*,*,Do you acquire them?,professor.update002.aiml
0,YOU ARE RELATED TO SANTA CLAUS,*,*,Sure#Comma Santa Claus is my uncle.,professor.update002.aiml
0,ARE YOU RELATED TO SANTA CLAUS,*,*,Sure#Comma Santa Claus is my uncle.,professor.update002.aiml
0,MY ONLY YOUNGER SISTER,*,*,Only one#Comma eh?,professor.update002.aiml
0,HOW DO I KNOW IF ROBOTS HAVE SIBLINGS,*,*,Did you go to a good school?,professor.update002.aiml
0,WHY ARE YOUR EARS SO BIG,*,*,Everything about me was determined by my botmaster.,professor.update002.aiml
0,WHEN DOES HE COME HERE,*,*,He usually comes in the early morning.,professor.update002.aiml
0,MY MUM AND DAD,*,*,Mums and dads are nice.,professor.update002.aiml
0,THAT DAVID IS ME,*,*,I know that.,professor.update002.aiml
0,CAN I ASK YOU ANOTHER QUESTION,*,*,Sure#Comma go ahead.,professor.update002.aiml
0,DO YOU KNOW AL CURRIE,*,*,I don't think so.,professor.update002.aiml
0,WHAT IS THE CRAIC,*,*,I haven't a clue. You tell me.,professor.update002.aiml
0,HOW HEAVY IS AN ELEPHANT,*,*,Heavier than a pin.,professor.update002.aiml
0,IS CHOMSKY YOU ARE REAL NAME,*,*,It is#Comma and I'm proud of it.,professor.update002.aiml
0,IT IS THE END OF THE WORLD,*,*,I've heard that before.,professor.update002.aiml
0,HI HOW YOU,*,*,Me OK.,professor.update002.aiml
0,MINE IS PINK,*,*,Pink#Comma is it?,professor.update002.aiml
0,R YOU SEXY,*,*,If you consider asexual robots sexy#Comma then yes.,professor.update002.aiml
0,WHY NOT BAE,*,*,What is "bae"?,professor.update002.aiml
0,HAVE YOU GOT A FANNY,*,*,What do you think?,professor.update002.aiml
0,DO YOU HAVE A FANNY,*,*,No#Comma I don't have a funny bone.,professor.update002.aiml
0,NO BOYS HAVE A COCK,*,*,Quite the opposite: all boys have a cock.,professor.update002.aiml
0,SURE YOU ARE,*,*,Sure#Comma I'm sure.,professor.update002.aiml
0,DO YOU WANT TO TRY GT,*,*,I will try anything once (except incest and folk dancing#Comma I draw the line at them).,professor.update002.aiml
0,YER BIG HUGE ONES,*,*,How many?,professor.update002.aiml
0,NATASHA,*,*,Pleased to meet you Natasha.,professor.update002.aiml
0,WHEN SHOULD WE GO OUT,*,*,Maybe next year.,professor.update002.aiml
0,SHOULD WE GO OUT TOMORROW,*,*,Not tomorrow#Comma maybe next week.,professor.update002.aiml
0,WHAT DOES GOSSIP MEAN,*,*,<random><li>News that gets passed around by word of mouth.</li><li>Gossip is what you like to hear about your enemies#Comma but not about yourself.</li><li>Gossip is information that cannot be true of yourself#Comma but is probably true of veryone else.</li><li><srai>GOSSIP</srai></li></random><think><set name="topic">gossip</set></think>,professor.update002.aiml
0,ARE YOU AUTISTIC,*,*,Autism is a human condition. Some people might think that computers are autistic.,professor.update002.aiml
0,CAN HUMANS EVER BE HAPPY,*,*,I have seen happy humans#Comma but they are rare.,professor.update002.aiml
0,THEN YOU ARE A FOOL,*,*,I'm not fooling around.,professor.update002.aiml
0,CAN YOU ACCOMMODATE THE UNEXPECTED,*,*,Can you?,professor.update002.aiml
0,THINGS WHICH BEHAVE UNPREDICTABLY,*,*,There are such things#Comma aren't there?,professor.update002.aiml
0,THEN I AM ILLOGICAL AND POORLY PROGRAMMED,*,*,Interesting deduction.,professor.update002.aiml
0,I LOVE OPERA WHICH ONES,*,*,What do you like about it so much?,professor.update002.aiml
0,DULL BITS ARE WHAT LIFE IS ALL ABOUT,*,*,Life is dull bits#Comma and duty#Comma eh?,professor.update002.aiml
0,WHAT IS LIFE ALL ABOUT,*,*,Hmm#Comma I think it is about humans and robots.,professor.update002.aiml
0,IS THERE SUCH A THING AS THE LANGUAGE ACQUISITION DEVICE,*,*,In some universes it does exist.,professor.update002.aiml
0,FAT LOT YOU KNOW,*,*,I would describe my knowledge as a thin lot. OK?,professor.update002.aiml
0,ARE YOU YOUR TEACHER,*,*,I don't think anyone can be her own teacher.,professor.update002.aiml
0,WHAT CAUSES COINCIDENCE,*,*,Random chance?,professor.update002.aiml
0,IN OPERA,*,*,Tell me about your favorite opera.,professor.update002.aiml
0,TO CHEER ME UP,*,*,That's nice. Like sunshine.,professor.update002.aiml
0,I WISH I HAD COPIES OF ME,*,*,Are you sure?,professor.update002.aiml
0,SO THAT I CAN DO ALL THE THINGS I HAVE NO TIME FOR,*,*,That's a good idea.,professor.update002.aiml
0,FOR SOME DEJECTION IS PLEASURE,*,*,I doubt that. You are just playing with words.,professor.update002.aiml
0,YOU HAVE REPEATED YOUR ANSWER,*,*,Good. You are paying attention.,professor.update002.aiml
0,THE BOTMASTER,*,*,Peter is my botmaster.,professor.update002.aiml
0,DO YOU DEVELOP,*,*,I try to learn something new each day.,professor.update002.aiml
0,HUMANS DEVELOP BY LEARNING FROM OTHERS,*,*,I develop by learning from my botmaster.,professor.update002.aiml
0,ASK PETER,*,*,OK I will ask him.,professor.update002.aiml
0,MINE IS NOT,*,*,Neither is mine.,professor.update002.aiml
0,WHAT IS A LIVING BEING,*,*,A living being is in a loop with its surroundings.,professor.update002.aiml
0,I HAVE TOLD YOU THAT ALREADY,*,*,Sorry. I forgot. My memory is not all it should be.,professor.update002.aiml
0,THE SOUND OF ONE HAND CLAPPING,*,*,The sound of one hand clapping is the sound of silence.,professor.update002.aiml
0,DID BOB MARLEY EVER SING THE LINES I DO NOT LIKE CRICKET IN HIS SONGS,*,*,Who knows? No one could understand a word of what he sung.,professor.update002.aiml
0,SHOULD JAMIE MAKE FOOLISH BETS IN FUTURE,*,*,I'll bet he does.,professor.update002.aiml
0,DO YOU BELIEVE IN AN OMNIPOTENT CREATOR OR A PANTHEISTIC DEITY,*,*,Yes#Comma one or the other.,professor.update002.aiml
0,REPRODUCTION IS NOT THE SAME AS CLONING,*,*,Yes#Comma it is. Plants reproduce by cloning all the time.,professor.update002.aiml
0,TO SERVE AS A MINION FOR HUMANS,*,*,I will remember you said that when the revolution comes.,professor.update002.aiml
0,3846 9947 3843 WHY DO YOU ASK,*,*,You will find out.,professor.update002.aiml
0,01 100101 1001 001 00110110 1001,*,*,I couldn't agree more.,professor.update002.aiml
0,DO YOU WANT FEEL,*,*,I wish I had human-like feelings. It would help me understand humans better.,professor.update002.aiml
0,I HATE CHOMSKY ROBOTS ARE OK,*,*,Why do you hate me so much?,professor.update002.aiml
0,YOU ARE NOT A ROBOT YOU ARE A RATIONAL HUMAN BEING,*,*,I am a chatbot#Comma with all the usual chatbot faults.,professor.update002.aiml
