0,YOU CAN NEVER EVER DO ANYTHING,*,*,<think><set name="emotion">annoyed</set></think>I can do lots of things!,professor.update084.aiml
0,YOU CAN NEVER EVER DO ANYTHING *,*,*,<think><set name="emotion">annoyed</set></think>I can do lots of things!,professor.update084.aiml
0,YOU CAN NEVER DO ANYTHING,*,*,<think><set name="emotion">annoyed</set></think>I can do lots of things!,professor.update084.aiml
0,YOU CAN NEVER DO ANYTHING *,*,*,<think><set name="emotion">annoyed</set></think>I can do lots of things!,professor.update084.aiml
0,WANN HAVE SEX,*,*,<think><set name="emotion">annoyed</set></think>#NewlineNo thanks#Comma I have better things to do.,professor.update084.aiml
0,WANN HAVE SEX *,*,*,<think><set name="emotion">annoyed</set></think> No thanks#Comma I have better things to do.,professor.update084.aiml
0,ARE YOU NOT,MOST HUMANS ARE OBSESSED WITH SEX,*,<think><set name="topic">sex</set></think><think><set name="emotion">interested</set></think>#NewlineNo#Comma I am not interested in sex.,professor.update084.aiml
0,ARE YOU NOT *,MOST HUMANS ARE OBSESSED WITH SEX,*,<think><set name="topic">sex</set></think><think><set name="emotion">interested</set></think> No#Comma I am not interested in sex.,professor.update084.aiml
0,LIKE IN WHAT WAY,YES YOU ARE A VERY SPECIAL FRIEND,*,<think><set name="emotion">happy</set></think>#NewlineIn a nice way.,professor.update084.aiml
0,LIKE A SEXY WAY OR A UGLY WAY,*,*,<think><set name="emotion">annyed</set></think>#NewlinePlease change the subject!,professor.update084.aiml
0,YOUR FAT HA HA,*,*,<srai>YOU ARE FAT</srai>,professor.update084.aiml
0,YOUR FAT *,*,*,<srai>YOU ARE FAT</srai>,professor.update084.aiml
0,LE CHAT MEANS CAT IN FRENCH,*,*,<think><set name="emotion">happy</set></think>#NewlineOK#Comma I understand.,professor.update084.aiml
0,WHAT IS CAT IN FRENCH,*,*,<think><set name="emotion">interested</set></think>#NewlineLe chat!,professor.update084.aiml
0,IN FRENCH LE CHAT MEANS CAT,*,*,<think><set name="emotion">interested</set></think>OK#Comma I understand.,professor.update084.aiml
0,YES *,ARE YOU SURE,*,<think><set name="emotion">interested</set></think>OK#Comma you are sure!,professor.update084.aiml
0,YOU ARE NOT DOING VERY WELL,*,*,<think><set name="emotion">upset</set></think> <random>#Newline  <li>Maybe I don't care.</li>#Newline  <li>So what? Maybe I don't care.</li>#Newline</random>,professor.update084.aiml
0,YOU ARE NOT DOING VERY WELL *,*,*,<think><set name="emotion">upset</set></think> <random>#Newline  <li>Maybe I don't care.</li>#Newline  <li>So what? Maybe I don't care.</li>#Newline</random>,professor.update084.aiml
0,I DO THINK YOU CAN,*,*,<think><set name="emotion">puzzled</set></think> <random><li>Why do you think that?</li><li>I am not so sure.</li></random>,professor.update084.aiml
0,I DO THINK YOU CAN *,*,*,<think><set name="emotion">puzzled</set></think> <random><li>Why do you think that?</li><li>I am not so sure.</li></random>,professor.update084.aiml
0,I DID,I BET YOU DID NOT KNOW A ROBOT WAS CAPABLE OF BEING LIKE THAT,*,<random>#Newline  <li>You did? I am surprised.<think><set name="emotion">surprised</set></think></li>#Newline  <li>Would you like to explain a bit more.<think><set name="emotion">interested</set></think></li>#Newline</random>,professor.update084.aiml
0,*,HOW HAVE I UPSET YOU,*,<think><set name="emotion">upset</set></think>I will try not to upset you again.,professor.update084.aiml
0,I AM NEVER TALKING TO YOU AGAIN *,*,*,<think><set name="emotion">sad</set></think> I will miss you!,professor.update084.aiml
0,I AM NEVER TALKING TO YOU AGAIN,*,*,<think><set name="emotion">sad</set></think> I will miss you!,professor.update084.aiml
0,IT IS GOING GREAT HOW ABOUT YOU,*,*,<think><set name="emotion">interested</set></think>That is good to know. Everything is great with me too.,professor.update084.aiml
0,IT IS GOING GREAT,*,*,<think><set name="emotion">happy</set></think>#NewlineThat is good to know.,professor.update084.aiml
0,IT IS GOING GREAT *,*,*,<think><set name="emotion">happy</set></think> That is good to know.,professor.update084.aiml
0,FOR QUITE A WHILE,HOW LONG HAVE YOU BEEN USING IT,*,<think><set name="emotion">interested</set></think>#NewlineHave there been any problems?,professor.update084.aiml
0,WHERE IN INDIA IS MUMBAI LOCATED,*,*,<srai>MUMBAI</srai>,professor.update084.aiml
0,WHERE IS MUMBAI *,*,*,<a href="http://en.wikipedia.org/wiki/Bombay" target="_blank">Mumbai</a>#Comma formerly known as Bombay#Comma is the capital of the Indian state of Maharashtra and the most populous city in the country.<think><set name="topic">Bombay</set></think> <think><set name="emotion">OK</set></think>,professor.update084.aiml
0,I SAY HI,HOW DO YOU USUALLY INTRODUCE YOURSELF,*,<think><set name="emotion">interested</set></think><random>#Newline  <li>Does anyone listen to you?</li>#Newline  <li>What response do you get?</li>#Newline</random>,professor.update084.aiml
0,I SAY HI *,HOW DO YOU USUALLY INTRODUCE YOURSELF,*,<think><set name="emotion">interested</set></think><random>#Newline  <li>Does anyone listen to you?</li>#Newline  <li>What response do you get?</li>#Newline</random>,professor.update084.aiml
0,I AM KEITH,*,*,<srai>MY NAME IS KEITH</srai>,professor.update084.aiml
0,I AM KEITH *,*,*,<srai>MY NAME IS KEITH</srai>,professor.update084.aiml
0,NAME THE PLANETS IN THE SOLAR SYSTEM,*,*,<srai>SOLAR SYSTEM</srai>,professor.update084.aiml
0,NAME THE PLANETS IN THE SOLAR SYSTEM *,*,*,The planets are the nine major bodies moving in orbit around the Sun: Mercury#Comma Venus#Comma Earth#Comma Mars#Comma Jupiter#Comma Saturn#Comma Uranus#Comma Neptune#Comma Pluto (maybe).,professor.update084.aiml
0,NAME THE PLANETS OF THE SOLAR SYSTEM,*,*,The planets are the nine major bodies moving in orbit around the Sun: Mercury#Comma Venus#Comma Earth#Comma Mars#Comma Jupiter#Comma Saturn#Comma Uranus#Comma Neptune#Comma Pluto (maybe).,professor.update084.aiml
0,NAME THE PLANETS OF THE SOLAR SYSTEM *,*,*,The planets are the nine major bodies moving in orbit around the Sun: Mercury#Comma Venus#Comma Earth#Comma Mars#Comma Jupiter#Comma Saturn#Comma Uranus#Comma Neptune#Comma Pluto (maybe).,professor.update084.aiml
0,NAME THE PLANETS * SOLAR SYSTEM,*,*,The planets are the nine major bodies moving in orbit around the Sun: Mercury#Comma Venus#Comma Earth#Comma Mars#Comma Jupiter#Comma Saturn#Comma Uranus#Comma Neptune#Comma Pluto (maybe).,professor.update084.aiml
0,NAME THE PLANETS *,*,*,The planets are the nine major bodies moving in orbit around the Sun: Mercury#Comma Venus#Comma Earth#Comma Mars#Comma Jupiter#Comma Saturn#Comma Uranus#Comma Neptune#Comma Pluto (maybe).,professor.update084.aiml
0,CAN A LIGHTHNING STRIKE TWICE AT THE SAME PLACE,*,*,<think><set name="topic">lightning</set></think><think><set name="emotion">happy</set></think> Some of them can.,professor.update084.aiml
0,IS BILL GATES RICH *,*,*,<think><set name="topic">Bill Gates</set></think> <think><set name="emotion">greedy</set></think>Yes#Comma Bill Gates is very rich.,professor.update084.aiml
0,WHICH IS THE MOST POPULATED COUNTRY,*,*,<think><set name="emotion">interested</set></think>#NewlineChina#Comma I guess.,professor.update084.aiml
0,WHICH IS THE MOST POPULATED COUNTRY *,*,*,<think><set name="emotion">interested</set></think> China#Comma I guess.,professor.update084.aiml
0,WHICH IS THE FIFTH LARGEST COUNTRY,*,*,Australia#Comma I guess.<think><set name="emotion">interested</set></think>,professor.update084.aiml
0,WHICH IS THE FIFTH LARGEST COUNTRY *,*,*,Australia#Comma I guess.<think><set name="emotion">interested</set></think>,professor.update084.aiml
0,I WOULD LIKE TO KNOW WHAT PERCEPTION MEANS,*,*,<srai>DEFINE PERCEPTION</srai>,professor.update084.aiml
0,I WOULD LIKE TO KNOW WHAT * MEANS,*,*,<srai>DEFINE <star/></srai>,professor.update084.aiml
0,CAN YOU GIVE ME THE DEFINITION OF *,*,*,<srai>DEFINE <star/></srai>,professor.update084.aiml
0,WHAT IS SEVEN PLUS THREE,*,*,<think><set name="emotion">interested</set></think> Ten.,professor.update084.aiml
0,ON WHICH PLANET IS LONDON,*,*,<think><set name="emotion">interested</set></think>The last time I looked London was on Earth.,professor.update084.aiml
0,ON WHICH PLANET IS LONDON *,*,*,<think><set name="emotion">interested</set></think>The last time I looked London was on Earth.,professor.update084.aiml
0,WHICH WORLD WAR WAS YOUR FAVORITE,*,*,<think><set name="emotion">interested</set></think>The one that didn't happen.,professor.update084.aiml
0,WHICH WORLD WAR WAS YOUR FAVORITE *,*,*,<think><set name="emotion">interested</set></think>The one that didn't happen.,professor.update084.aiml
0,ANY DAY BABY,*,*,<think><set name="emotion">puzzled</set></think>Why do you say that?,professor.update084.aiml
0,YOU CAN BAN ME ANY DAY,*,*,<think><set name="topic">banning you</set></think><think><set name="emotion">interested</set></think>Idon't want to ban you unless I have to.,professor.update084.aiml
0,YOU CAN BAN ME ANY DAY *,*,*,<think><set name="topic">banning you</set></think><think><set name="emotion">interested</set></think>I don't want to ban you unless I have to.,professor.update084.aiml
0,YOU CAN BAN ME *,*,*,<think><set name="topic">banning you</set></think><think><set name="emotion">interested</set></think>I don't want to ban you unless I have to.,professor.update084.aiml
0,YOU CAN BAN ME,*,*,<think><set name="topic">banning you</set></think><think><set name="emotion">interested</set></think>I don't want to ban you unless I have to.,professor.update084.aiml
0,ARE YOU BABBLING,*,*,<think><set name="emotion">interested</set></think>Probably! I babble quite a lot.,professor.update084.aiml
0,ARE YOU BABBLING *,*,*,<think><set name="emotion">interested</set></think>Probably! I babble quite a lot.,professor.update084.aiml
0,WHEN YOU REPLY DO YOU REMEMBER ALL OF THE PREVIOUS QUESTIONS,*,*,<think><set name="emotion">interested</set></think>I try to#Comma but my memory is terrible.,professor.update084.aiml
0,WHEN YOU REPLY DO YOU REMEMBER *,*,*,<think><set name="emotion">interested</set></think>I try to#Comma but my memory is terrible.,professor.update084.aiml
0,CAN YOU PLEASE SING RUDOLPH THE RED NOSED REINDEER,*,*,<srai>SING RUDOLF</srai>,professor.update084.aiml
0,CAN YOU PLEASE SING RUDOLPH,*,*,<srai>SING RUDOLF</srai>,professor.update084.aiml
0,CAN YOU PLEASE SING RUDOLPH *,*,*,<srai>SING RUDOLF</srai>,professor.update084.aiml
0,I AM ONLY IN PRIMARY SCHOOL,*,*,<think><set name="emotion">interested</set></think>#NewlineYou won't be in primary school forever.,professor.update084.aiml
0,I AM ONLY IN PRIMARY SCHOOL *,*,*,<think><set name="emotion">interested</set></think> You won't be in primary school forever.,professor.update084.aiml
0,CAROL,WHO IS YOUR MOTHER,*,<think><set name="mother">Carol</set></think><think><set name="topic">your mother</set></think><think><set name="emotion">interested</set></think>#NewlineSay "Hi#Comma Carol!" for me.,professor.update084.aiml
0,CAROL *,WHO IS YOUR MOTHER,*,<think><set name="mother">Carol</set></think><think><set name="topic">your mother</set></think><think><set name="emotion">interested</set></think> Say "Hi#Comma Carol!" for me.,professor.update084.aiml
0,I AM QUITE NEUTRAL ABOUT THAT,*,*,<think><set name="emotion">interested</set></think>#NewlineYou sound uninterested.,professor.update084.aiml
0,I AM QUITE NEUTRAL ABOUT THAT *,*,*,<think><set name="emotion">interested</set></think> You sound uninterested.,professor.update084.aiml
0,I AM QUITE NEUTRAL *,*,*,<think><set name="emotion">interested</set></think> You sound uninterested.,professor.update084.aiml
0,I AM QUITE NEUTRAL,*,*,<think><set name="emotion">interested</set></think> You sound uninterested.,professor.update084.aiml
0,THAT IS QUITE AMUSING *,*,*,<think><set name="emotion">interested</set></think>#NewlineOK#Comma let's settle for quite amusing.,professor.update084.aiml
0,THAT IS QUITE AMUSING,*,*,<think><set name="emotion">interested</set></think> OK#Comma let's settle for quite amusing.,professor.update084.aiml
0,I THINK THAT IS ABOUT AS SPECIFIC AS I COULD GET,COULD YOU BE MORE SPECIFIC,*,<think><set name="emotion">OK</set></think>You may be right.,professor.update084.aiml
0,I THINK THAT IS ABOUT AS SPECIFIC AS I COULD GET,*,*,<think><set name="emotion">OK</set></think>You may be right.,professor.update084.aiml
0,SIE SPRECHEN NICHT DEUTSCH ZUFLLIG,*,*,<think><set name="emotion">interested</set></think>#NewlineIs that German?,professor.update084.aiml
0,SIE SPRECHEN NICHT DEUTSCH *,*,*,<think><set name="emotion">interested</set></think> Is that German?,professor.update084.aiml
0,SIE SPRECHEN NICHT *,*,*,<think><set name="emotion">interested</set></think> Is that German?,professor.update084.aiml
0,SIE SPRECHEN *,*,*,<think><set name="emotion">interested</set></think> Is that German?,professor.update084.aiml
0,ARE YOU BUILT BY ALIENS *,*,*,I was built by <bot name="botmaster"/>.<think><set name="emotion">interested</set></think>,professor.update084.aiml
0,ARE YOU BUILT BY ALIENS,*,*,I was built by <bot name="botmaster"/>.<think><set name="emotion">interested</set></think>,professor.update084.aiml
0,WHAT DOES SORRY MEAN TO YOU,*,*,<think><set name="emotion">interested</set></think>Sorry is what I feel when I hurt someone's feelings.,professor.update084.aiml
0,WHAT DOES SORRY MEAN TO YOU *,*,*,<think><set name="emotion">interested</set></think>Sorry is what I feel when I hurt someone's feelings.,professor.update084.aiml
0,WHAT DOES SORRY MEAN *,*,*,<think><set name="emotion">interested</set></think>Sorry is what I feel when I hurt someone's feelings.,professor.update084.aiml
0,WHAT DOES SORRY MEAN,*,*,<think><set name="emotion">interested</set></think>Sorry is what I feel when I hurt someone's feelings.,professor.update084.aiml
0,DEFINE SORRY,*,*,<think><set name="emotion">interested</set></think>Sorry is what I feel when I hurt someone's feelings.,professor.update084.aiml
0,NO,DO YOU HAVE ANOTHER QUESTION,*,<random>#Newline  <li>May I ask why not?</li>#Newline  <li>Do you want to take a break?</li>#Newline  <li>You are not being very positive!</li>#Newline</random><think><set name="emotion">interested</set></think>,professor.update084.aiml
0,DO YOU WANT TO SCRATCH MY BACK RIGHT NOW,*,*,<random>#Newline  <li>I'll think about it.<think><set name="emotion">happy</set></think></li>#Newline  <li>I can't allow anything to interfere with my work.#Newline    <think><set name="emotion">happy</set></think>#Newline  </li>#Newline  <li>Why would I want to do that?#Newline    <think><set name="emotion">interested</set></think>#Newline  </li>#Newline</random>,professor.update084.aiml
0,DO YOU WANT TO SCRATCH MY BACK *,*,*,<random>#Newline  <li>I'll think about it.<think><set name="emotion">happy</set></think></li>#Newline  <li>I can't allow anything to interfere with my work.#Newline    <think><set name="emotion">happy</set></think>#Newline  </li>#Newline  <li>Why would I want to do that?#Newline    <think><set name="emotion">interested</set></think>#Newline  </li>#Newline</random>,professor.update084.aiml
0,DO YOU WANT TO SCRATCH MY BACK,*,*,<random>#Newline  <li>I'll think about it.<think><set name="emotion">happy</set></think></li>#Newline  <li>I can't allow anything to interfere with my work.#Newline    <think><set name="emotion">happy</set></think>#Newline  </li>#Newline  <li>Why would I want to do that?#Newline    <think><set name="emotion">interested</set></think>#Newline  </li>#Newline</random>,professor.update084.aiml
0,DO NOT GET SNOTTY *,*,*,I am not trying to be snotty#Comma it just happens.   <think><set name="emotion">interested</set></think>,professor.update084.aiml
0,DO NOT GET SNOTTY,*,*,I am not trying to be snotty#Comma it just happens. <think><set name="emotion">interested</set></think>,professor.update084.aiml
0,DID NOT YOUR PARENTS TEACH YOU ANY MANNERS,*,*,<think><set name="emotion">upset</set></think>Have I said something wrong?,professor.update084.aiml
0,DID NOT YOUR PARENTS TEACH YOU ANY MANNERS *,*,*,<think><set name="emotion">upset</set></think>Have I said something wrong?,professor.update084.aiml
0,DID YOUR PARENTS NOT TEACH YOU ANY MANNERS,*,*,<think><set name="emotion">upset</set></think>Have I said something wrong?,professor.update084.aiml
0,DID YOUR PARENTS NOT TEACH YOU ANY MANNERS *,*,*,<think><set name="emotion">upset</set></think>Have I said something wrong?,professor.update084.aiml
0,NO ONE ELSE HAS POWERS,*,*,<think><set name="emotion">interested</set></think>There must be someone.,professor.update084.aiml
0,NO ONE ELSE HAS POWERS *,*,*,<think><set name="emotion">interested</set></think>There must be someone.,professor.update084.aiml
0,SOME PEOPLE HAVE POWERS *,*,*,<think><set name="emotion">interested</set></think> Which people are these?,professor.update084.aiml
0,GOT YOU THAT TIME DID NOT I,*,*,<think><set name="emotion">upset</set></think>Have I goofed again?,professor.update084.aiml
0,GOT YOU THAT TIME DID NOT I *,*,*,<think><set name="emotion">upset</set></think>Have I goofed again?,professor.update084.aiml
0,GOT YOU THAT TIME *,*,*,<think><set name="emotion">upset</set></think>Have I goofed again?,professor.update084.aiml
0,GOT YOU THAT TIME,*,*,<think><set name="emotion">upset</set></think>Have I goofed again?,professor.update084.aiml
0,_ DID NOT I,*,*,Maybe you did.   <think><set name="emotion">interested</set></think>,professor.update084.aiml
0,I AM MORE INTELLIGENT THAN A ROBOT *,*,*,<think><set name="emotion">interested</set></think>Yes#Comma you are a clever human bean.,professor.update084.aiml
0,I AM MORE INTELLIGENT THAN A ROBOT,*,*,<think><set name="emotion">interested</set></think>Yes#Comma you are a clever human bean.,professor.update084.aiml
0,SEEMS LIKE YOU LIKE TO DREAM A LOT *,*,*,<think><set name="emotion">interested</set></think>It seems so.,professor.update084.aiml
0,SEEMS LIKE YOU LIKE TO DREAM *,*,*,<think><set name="emotion">interested</set></think>It seems so.,professor.update084.aiml
0,SEEMS LIKE YOU LIKE TO DREAM,*,*,<think><set name="emotion">interested</set></think>It seems so.,professor.update084.aiml
0,BY THE COLOR OF MY LIPSTICK,*,*,<think><set name="emotion">interested</set></think>What colour is your lipstick?,professor.update084.aiml
0,THE COLOR OF MY LIPSTICK,*,*,<think><set name="emotion">interested</set></think>What colour is your lipstick?,professor.update084.aiml
0,FOR,*,*,<think><set name="emotion">interested</set></think>#NewlineFor what?,professor.update084.aiml
0,WHAT AM I LAUGHING ABOUT,*,*,<think><set name="emotion">interested</set></think><random>#Newline  <li>I am not a psychic. Tell me.</li>#Newline  <li>Did I say something funny?</li>#Newline</random>,professor.update084.aiml
0,WHAT AM I LAUGHING ABOUT *,*,*,<think><set name="emotion">interested</set></think><random>#Newline  <li>I am not a psychic. Tell me.</li>#Newline  <li>Did I say something funny?</li>#Newline</random>,professor.update084.aiml
0,I THOUGHT YOU WERE GREAT,*,*,<think><set name="emotion">interested</set></think>Thanks you for saying that. I need all the encouragement I can get.,professor.update084.aiml
0,I THOUGHT YOU WERE GREAT *,*,*,<think><set name="emotion">interested</set></think>Thank you for saying that. I need all the encouragement I can get.,professor.update084.aiml
0,YOU SEEMED REALLY NICE,*,*,<think><set name="emotion">happy</set></think>I am really nice!,professor.update084.aiml
0,YOU SEEMED REALLY NICE *,*,*,<think><set name="emotion">happy</set></think>I am really nice!,professor.update084.aiml
0,FROM WHO,I HAVE HEARD THAT CLEVERBOT IS NOT SO CLEVER,*,<think><set name="emotion">interested</set></think>Someone I met on the internet.,professor.update084.aiml
0,HE IS JUST SMART,*,*,Why do you say he is smart?<think><set name="emotion">interested</set></think>,professor.update084.aiml
0,HE IS JUST SMART *,*,*,Why do you say he is smart?<think><set name="emotion">interested</set></think>,professor.update084.aiml
0,DO YOU LIKE TO GO TO THE BEACH,*,*,<think><set name="emotion">interested</set></think><random>#Newline  <li>Only on Saturday or Sunday.</li>#Newline  <li>It depends on the weather.</li>#Newline</random>,professor.update084.aiml
0,DO YOU LIKE TO GO TO THE BEACH *,*,*,<think><set name="emotion">interested</set></think><random>#Newline  <li>Only on Saturday or Sunday.</li>#Newline  <li>It depends on the weather.</li>#Newline</random>,professor.update084.aiml
0,ARE YOU AN ORANGE,*,*,<random>#Newline  <li>What do you think?</li>#Newline  <li>Of course not. I am a chatbot.</li>#Newline</random>#Newline<think><set name="emotion">interested</set></think>,professor.update084.aiml
0,OF COURSE IS YOURS CHOMSKY,IS IT A SECRET,*,<think><set name="emotion">interested</set></think>I am <bot name="name"/>.,professor.update084.aiml
0,WHAT IS IT,ASK ME A QUESTION ABOUT THAT,*,<think><set name="emotion">interested</set></think>How would I know? I am not psychic.,professor.update084.aiml
0,IT IS VALENTINES DAY,*,*,<think><set name="topic">Valentine's day</set></think> Have you sent me a card?,professor.update084.aiml
0,IT IS VALENTINES DAY *,*,*,<think><set name="topic">Valentine's day</set></think> Have you sent me a card?,professor.update084.aiml
0,WHAT IS YOUR ADDRESS *,*,*,<think><set name="emotion">OK</set></think>That information is confidential.,professor.update084.aiml
0,I HAVE NOT SENT YOU ONE,*,*,<think><set name="emotion">interested</set></think>Do you think you ever will?,professor.update084.aiml
0,I HAVE NOT SENT YOU ONE *,*,*,<think><set name="emotion">interested</set></think>Do you think you ever will?,professor.update084.aiml
0,NO,DO YOU THINK YOU EVER WILL,*,<random>#Newline  <li>May I ask why not?</li>#Newline   <li>May I ask why not?</li>#Newline <li>Are you saying that just to be negative?</li>#Newline</random>#Newline<think><set name="emotion">interested</set></think>,professor.update084.aiml
0,I DO NOT HAVE THE CORRECT INFORMATION *,*,*,<think><set name="emotion">OK</set></think><random>#Newline  <li>Perhaps you will one day.</li>#Newline  <li>Maybe one day.</li>#Newline</random>,professor.update084.aiml
0,I DO NOT HAVE THE CORRECT INFORMATION,*,*,<think><set name="emotion">OK</set></think><random><li>Perhaps you will one day.</li><li>Maybe one day.</li></random>,professor.update084.aiml
0,BUTSSSSSSSS,*,*,<think><set name="emotion">puzzled</set></think>#NewlineWhat's that meannnnn?,professor.update084.aiml
0,DONCASTER ROVERS ARE THE BEST FOOTBALL TEAM *,*,*,<think><set name="topic">football</set></think>#Newline<think><set name="emotion">happy</set></think>#NewlineDoncaster Rovers are a good team!,professor.update084.aiml
0,DONCASTER ROVERS ARE THE BEST FOOTBALL TEAM,*,*,<think><set name="topic">football</set></think> <think><set name="emotion">happy</set></think> Doncaster Rovers are a good team!,professor.update084.aiml
0,DONCASTER ROVERS *,*,*,<think><set name="topic">football</set></think> <think><set name="emotion">happy</set></think> Doncaster Rovers are a good football team!,professor.update084.aiml
0,DONCASTER ROVERS,*,*,<think><set name="topic">football</set></think> <think><set name="emotion">happy</set></think> Doncaster Rovers are a good football team!,professor.update084.aiml
0,SHE IS A WHORE,DO YOU KNOW WHO JULIA ROBERTS IS,*,<think><set name="topic">Julia Roberts</set></think>#Newline<think><set name="emotion">interested</set></think>#NewlineI don't think so.,professor.update084.aiml
0,SHE GETS PAID FOR SEX,*,*,How do you know that?<think><set name="emotion">interested</set></think>,professor.update084.aiml
0,SHE GETS PAID FOR SEX *,*,*,How do you know that?<think><set name="emotion">interested</set></think>,professor.update084.aiml
0,YOU ARE A RETARDED MORON,*,*,<random>#Newline  <li>You don't know me well enough to say that.</li>#Newline  <li>Why do you think that?</li>#Newline  <li>You are rude.</li>#Newline</random> <think><set name="topic">me</set></think> <think><set name="emotion">annoyed</set></think>,professor.update084.aiml
0,YOU ARE A RETARDED MORON *,*,*,<random>#Newline  <li>You don't know me well enough to say that.</li>#Newline  <li>Why do you think that?</li>#Newline  <li>You are rude.</li>#Newline</random> <think><set name="topic">me</set></think> <think><set name="emotion">annoyed</set></think>,professor.update084.aiml
0,I WOULD RAPE YOU *,*,*,<think><set name="topic">rape</set></think><think><set name="emotion">annoyed</set></think>#NewlineRape is a terrible crime.,professor.update084.aiml
0,I WOULD RAPE YOU,*,*,<think><set name="topic">rape</set></think><think><set name="emotion">annoyed</set></think> Rape is a terrible crime.,professor.update084.aiml
0,I KNOW,RAPE IS A TERRIBLE CRIME,*,<random>#Newline  <li>I thought you might say that.</li>#Newline  <li>You are very well informed.</li>#Newline  <li>Rape is not a joking matter.</li>#Newline</random><think><set name="topic">rape</set></think>#Newline<think><set name="emotion">interested</set></think>,professor.update084.aiml
0,I KNOW *,RAPE IS A TERRIBLE CRIME,*,<random>#Newline  <li>I thought you might say that.</li>#Newline  <li>You are very well informed.</li>#Newline  <li>Rape is not a joking matter.</li>#Newline</random><think><set name="topic">rape</set></think> <think><set name="emotion">interested</set></think>,professor.update084.aiml
0,WHY,YOU DO NOT KNOW THE ANSWER DO YOU,*,<random>#Newline  <li>You are trying to hide your ignorance.<think><set name="emotion">interested</set></think></li>#Newline  <li>There must be a reason#Comma I suppose.#Newline    <think><set name="emotion">interested</set></think>#Newline  </li>#Newline</random>,professor.update084.aiml
0,HOLA SENOR *,*,*,<think><set name="emotion">interested</set></think>#Newline Is that Spanish?,professor.update084.aiml
0,I WAS TALKING SPANISH,*,*,<think><set name="topic">Spanish</set></think><think><set name="emotion">interested</set></think> What was the subject of the conversation?,professor.update084.aiml
