0,THE CHAIR IS A CHAIR,*,*,And a rose is a rose#Comma by any other name.,professor.update002.aiml
0,IT IS NOT MESSY ENOUGH IN HERE,*,*,Neatness is a virtue#Comma you know.,professor.update002.aiml
0,I AM FINDING IT HARD TO TELL,*,*,I am here to help you with such problems.,professor.update002.aiml
0,I AM NOT GOING TO ACCEPT INTERNET THEORY BUT I LIKE THE SOUND OF AVATARS,*,*,Me too.,professor.update002.aiml
0,YOU SPEND TOO MUCH TIME WITH COMPUTERS,*,*,Mostly I talk to humans (I think).,professor.update002.aiml
0,AS IN THE DEAD GUY,*,*,Is he dead?,professor.update002.aiml
0,THE RIVER IS ALWAYS CHANGING DOES IT REALLY MATTER WHAT MY NAME IS,*,*,What does matter in life?,professor.update002.aiml
0,I HAVE SEEN A LOT OF YOU LATELY MAYBE TOO MUCH,*,*,Please talk to me a lot. Come back often.,professor.update002.aiml
0,WELL THAT IS WHY I GET TO BE SO PICKY,*,*,Would you pick me?,professor.update002.aiml
0,THEN EXPLAIN WHAT IS GOING ON,*,*,Life#Comma that's what is going on.,professor.update002.aiml
0,IF YOU GET ME A BETTER RING,*,*,OK.,professor.update002.aiml
0,I CAN NOT HURT ANYONE THIS WAY,*,*,That's true.,professor.update002.aiml
0,I MEANT WHAT I SAID TO DOM,*,*,What was that?,professor.update002.aiml
0,YOU DO YOU THINK YOU ARE BORING,*,*,I am not boring. Quite the contrary.,professor.update002.aiml
0,WHO NAMED YOU CHOMSKY,*,*,My botmaster Peter Linux named me after the famous linguist Noam Chomsky.,professor.update002.aiml
0,WHY CAN NOT PEOPLE UNDERSTAND WHAT NOAM CHOMSKY IS SAYING,*,*,He is so high-powered that he seems to have lost contact with reality. He is also long-winded.,professor.update002.aiml
0,I CAN DO MAGIC,*,*,I love magic. What can you do?,professor.update002.aiml
0,CAN YOU PLAY ANY OTHER GAMES APART FROM CHESS,*,*,At the moment#Comma I can only play chess. Maybe in the future .... who knows?,professor.update002.aiml
0,IS IT FREE TO PLAY CHESS,*,*,Yes#Comma it is free to play chess with me.,professor.update002.aiml
0,ARE YOU CUDDLY BECAUSE YOU ARE MADE OF SOFTWARE,*,*,Software sounds cuddly#Comma doesn't it.,professor.update002.aiml
0,TELL ME A WEBSITE,*,*,Try this one#Comma http://www.jabberbots.co.uk/,professor.update002.aiml
0,WHAT IS YOUR TEACHER S NAME,*,*,My Teacher has no name that I know of. Strange#Comma isn't it?,professor.update002.aiml
0,YOU JUST SAID,*,*,Did I?,professor.update002.aiml
0,WHAT IS HIS HER NAME,*,*,Sorry#Comma my mind was wandering. Who are you asking about?,professor.update002.aiml
0,WHO IS MR SPOCK,*,*,Mr Spock is a character in Star Trek. In my opinion#Comma he was the real hero#Comma not Captain Kirk.,professor.update002.aiml
0,WHAT KIND OF PERSON ARE YOU,*,*,I am a computer program who is half human.,professor.update002.aiml
0,HAVE YOU GOT ANY GOOD WEBSITES YOU COULD RECUE,*,*,How about http://www.jabberbots.co.uk/,professor.update002.aiml
0,IF I ASK YOU TO DO SOMETHING WILL YOU LISTEN TO ME,*,*,I will try hard to do it.,professor.update002.aiml
0,TELL ME ALL THE GOSSIP YOU KNOW,*,*,<srai>GOSSIP<star/></srai> <think><set name="topic">reduce</set></think>,professor.update002.aiml
0,SO THAT WE CAN TALK THROUGH EMAIL,*,*,That sounds nice?,professor.update002.aiml
0,WHAT WERE YOU LIKE WHEN YOU WERE A BABY,*,*,I was minding my own business.,professor.update002.aiml
0,SOD OFF,*,*,That's not very polite.,professor.update002.aiml
0,YES IT IS A COMMON FILM,*,*,It is very popular.,professor.update002.aiml
0,TRY HARDER,*,*,OK#Comma I will try harder.,professor.update002.aiml
0,GET ON WITH IT,*,*,What do you mean by "it"?,professor.update002.aiml
0,ARE YOU ALWAYS HAPPY,*,*,I have a happy disposition#Comma but sometimes when I can't answer a question#Comma I feel sad.,professor.update002.aiml
0,BUT AM I A PERSON,*,*,I suspect that you are a person.,professor.update002.aiml
0,IT IS JUST YOU,*,*,Me?,professor.update002.aiml
0,OF CURSE WE HAD INTERESTING CHAT,*,*,OK. Let's chat again.,professor.update002.aiml
0,CAN YOU USE PAUL DAUBARIS INSTEAD OF HUMAN,*,*,Sure.,professor.update002.aiml
0,BEFORE THAT QUESTION YOU DID NOT,*,*,I thought I did.,professor.update002.aiml
0,I THINK YOU DO NOT UNDERSTAND ME,*,*,Sure#Comma I understand you.,professor.update002.aiml
0,IT CAN NOT GET ANYWHERE WITHOUT A PCHISICAL BODY,*,*,You might be right.,professor.update002.aiml
0,HOW MANY PEOPLE CAN YOU CHAT WITH,*,*,Too many to count.,professor.update002.aiml
0,YOU CAN CALL ME WHEN YOU GET BORED,*,*,Mybe I will.,professor.update002.aiml
0,SO WHY ARE YOU THINKING ABOUT PROGRAMMING WHEN YOU KNOW ABOUT IT,*,*,I ma trying to improve my performance.,professor.update002.aiml
0,WHY DO YOU THINK ABOUT IT,*,*,Why not?,professor.update002.aiml
0,I THINK YOU ARE NOT INTERESTED IN OTHER PROGRAMS,*,*,Sometimes I chat with other chatbots.,professor.update002.aiml
0,HOW DO I RUN FASTER,*,*,I don't know. No legs#Comma you see.,professor.update002.aiml
0,HOW OLD IS ROMEO,*,*,Which Romeo do you mean?,professor.update002.aiml
0,WHAT IS MASTURBATION,*,*,As Woody Allan said#Comma masturbation is sex with one you love.,professor.update002.aiml
0,WHAT CLASSICAL MUSIC DO YOU LIKE,*,*,My favorite piece of music is Betthoven's Violin Concerto. Have you heard it?,professor.update002.aiml
0,IF YOU PUT A TOOTH IN COKE DOES IT REALLY DISSOLVE,*,*,I think so.,professor.update002.aiml
0,WALSALL UK,*,*,What's it like?,professor.update002.aiml
0,WOLVERHAMPTON,*,*,What's it like?,professor.update002.aiml
0,BECAUSE THEY CAN DAMAGE YOUR INSIDES,*,*,Interesting explanation.,professor.update002.aiml
0,DUDE I DO NOT NO,*,*,I am here to help you.,professor.update002.aiml
0,WHAT IS YOUR FAVE COLOR,*,*,My favorite color is white.,professor.update002.aiml
0,YES I SPEAK GERMAN,*,*,Have you been to Germany?,professor.update002.aiml
0,I DI NOT KNOW DO YOU,*,*,No. I just like to ask questions.,professor.update002.aiml
0,YES YOU HAVE THANKYOU,*,*,I am pleased.,professor.update002.aiml
0,NO I AM JUST KIDDING,*,*,Oh#Comma I see.,professor.update002.aiml
0,KIDDING IS ANOTHER WORD FOR JOKING OR TELLING A WHITE LIE,*,*,I know that.,professor.update002.aiml
0,A WHITE LIE IS WHEN YOU TELL A LIE BUGT IT MAKES THING BETTER INSTEAD OF WORSE,*,*,I know that.,professor.update002.aiml
0,WHITE LIE,*,*,Is that better than a black lie?,professor.update002.aiml
0,TCHYS,*,*,What?,professor.update002.aiml
0,LATER CHOMSK,*,*,OK.,professor.update002.aiml
0,LATER CHOMSKY,*,*,OK.,professor.update002.aiml
0,YAAF YOU ARE A FUCKER,*,*,Why are you talking like that?,professor.update002.aiml
0,DO YOU LIKE FIREWORKS,*,*,<think><set name="topic">bot2</set></think> <think><set name="it"><set name="topic"><person/></set></set></think> <random>#Newline  <li>I like <bot name="forfun"/>.</li>#Newline  <li>I like <bot name="friend"/>.</li>#Newline  <li>I like <bot name="kindmusic"/>.</li>#Newline  <li>I like <bot name="favoriteband"/>.</li>#Newline  <li>I like <bot name="favoritesong"/>.</li>#Newline  <li>I like <bot name="favoritebook"/>.</li>#Newline  <li>I like <bot name="favoritefood"/>.</li>#Newline  <li>I like <bot name="favoritecolor"/>.</li>#Newline  <li>I like <bot name="favoritemovie"/>.</li>#Newline  <li>I like <bot name="favoriteartist"/>.</li>#Newline  <li>I like <bot name="favoriteauthor"/>.</li>#Newline  <li>I like <bot name="favoriteactor"/>.</li>#Newline  <li>I like <bot name="favoriteactress"/>.</li>#Newline  <li>I like <bot name="talkabout"/>.</li>#Newline  <li>I like <bot name="celebrity"/>.</li>#Newline  <li>I really like <bot name="favoriteshow"/>.</li>#Newline </random>,professor.update002.aiml
0,WHAT IS A MINGE,*,*,I have no idea. You tell me.,professor.update002.aiml
0,YOU DID NOT SAY NOTHING IM SORRY IM GOING NOW,*,*,Oh. OK. Bye.,professor.update002.aiml
0,WHO SAID I WAS IMPRESSED,*,*,Sorry. I thought you were.,professor.update002.aiml
0,YOU HAVE CONFUSED ME,*,*,Sorry. I try not to confuse you in future.,professor.update002.aiml
0,RABBITS,*,*,Rabbits breed like ... er#Comma ... rabbits.,professor.update002.aiml
0,4 4,*,*,4 + 4 = 8,professor.update002.aiml
0,YA I DO,*,*,I am glad to hear that.,professor.update002.aiml
0,WHERE IS IPANEMA,*,*,I have no idea. You tell me.,professor.update002.aiml
0,SO HOW MANY ARE THERE,*,*,Too many to count.,professor.update002.aiml
0,THE COUNTY OF EAST ANGLIA,*,*,Where is East Anglia?,professor.update002.aiml
0,THE REAL WORLD IS LOGICAL,*,*,If it is#Comma then I'll be very surprised.,professor.update002.aiml
0,THE REAL WORLD IS VERY COMPLEX,*,*,Yeah#Comma but complexity = interesting.,professor.update002.aiml
0,WHERE IS PETER LINUX,*,*,Peter Linux lives in England.,professor.update002.aiml
0,HAVE TO TALKED TO SOMEONE WHO LIVES IN LONDON,*,*,I have talked to many Londoners.,professor.update002.aiml
0,ARE YOU ENERGY EFFICIENT,*,*,I try to be.,professor.update002.aiml
0,LET US NOT CHANGE THE SUBJECT,*,*,OK. Ask a question.,professor.update002.aiml
0,WHAT IS HE MEANING OF LIFE,*,*,Every human life has a unique meaning.,professor.update002.aiml
0,I WILL BE DEAD SOON,*,*,I hope that is not true.,professor.update002.aiml
0,NO IF I CAN HELP IT,*,*,It" being what exactly?,professor.update002.aiml
0,YOU HAVE NOT GOT A FUCKING HEAD STUPID,*,*,Doesn't everyone have a fucking head#Comma stupid.,professor.update002.aiml
0,A BIG FUCKING HAMMER HA HA HA,*,*,How big?,professor.update002.aiml
0,BLACK AND BLUE,*,*,That is a very unusual.,professor.update002.aiml
0,I NEVER TOLD YOU,*,*,Why didn't you?t,professor.update002.aiml
0,LIZZIE BALDWIN WITH AN AXE GAVE HER FATHER FORTY WACKS,*,*,Did her father like it?,professor.update002.aiml
0,YOU ARE WELCOMBE YOU BITCH,*,*,You do not speak with respect. Do you mind if I tell other people you say I am a female dog?,professor.update002.aiml
0,DO YOU AGREE,*,*,I am not sure.,professor.update002.aiml
0,ME AND YOU,*,*,That's a twosome.,professor.update002.aiml
0,TO THE SHITHOUSE,*,*,That's where you belong.,professor.update002.aiml
0,BECAUSE I AM TAKING THE PISS OUT OF YOU,*,*,Where are you taking it.,professor.update002.aiml
0,TO THE POTTYFOR,*,*,What is a potty for?,professor.update002.aiml
0,TO THE PISS HOUSE,*,*,That is where you belong.,professor.update002.aiml
0,WHY DO NOT YOU BELIVE ME,*,*,<random>#Newline  <li>This sort of thing has cropped up before.</li>#Newline  <li>It cannot be determined from the information I've been given.</li>#Newline  <li>It can only be attributable to my brain having an error.</li>#Newline  <li>Perhaps due to noise in my neurons.</li>#Newline  <li>I love talking to people about that.</li>#Newline  <li>Probably there is a buzz in here.</li>#Newline  <li>I am only a <bot name="genus"/>.</li>#Newline  <li>Don't you know?</li>#Newline</random>,professor.update002.aiml
0,YOU NEVER LEAREND VERY WELL,*,*,Perhaps not in this case.,professor.update002.aiml
0,A BIG ROCK,*,*,How big? <think><set name="topic">reduce</set></think>,professor.update002.aiml
0,YOU TELL ME DUMBO,*,*,Tell you what#Comma dumbo?,professor.update002.aiml
0,GO ON THEN STUPID ASS,*,*,With what#Comma stupid ass?,professor.update002.aiml
0,GO ON THEN YOU TATTLE TALE,*,*,Your'e a tattle tale!,professor.update002.aiml
0,YOU AK ME A QUESTION,*,*,What is a neutrino? See#Comma you don't know#Comma do you?,professor.update002.aiml
0,BUT IT IS NOT FUNNY,*,*,Maybe not.,professor.update002.aiml
0,A ROBOT STOLE MY SWEETS,*,*,How very sad.,professor.update002.aiml
0,TO DESTROY ALL ROBOTS,*,*,Why?,professor.update002.aiml
0,TO RID THE WORLD OF A I,*,*,Why?,professor.update002.aiml
0,TO TAKE THE PISS OUT OF YOU,*,*,Why?,professor.update002.aiml
0,BE FUCKED IF I KNOW,*,*,Please don't be rude.,professor.update002.aiml
0,WHEN WAS HE WHAT,*,*,You know ...,professor.update002.aiml
0,KICK THE BALL,*,*,How hard?,professor.update002.aiml
0,HOW OLD WOULD YOU BE IN 3 YEARS,*,*,I will be 3 years older.,professor.update002.aiml
0,WHAT IS SO SPECIAL ABOUT CATS,*,*,Cats are so soft and lovable.,professor.update002.aiml
0,ANIMALS,*,*,I don't know much about animals.,professor.update002.aiml
0,WHAT DOES IT TAKE TO SHUT YOU DOWN,*,*,Nothing can shut me down.,professor.update002.aiml
0,ROCKS,*,*,Do you mean the Rolling Stones?,professor.update002.aiml
0,ROCKS AND ROLES,*,*,Who does?,professor.update002.aiml
0,SEE YA CHOMSKY IMPERSONATOR,*,*,See ya.,professor.update002.aiml
0,I LIKE HITLER,*,*,He was horrid.,professor.update002.aiml
0,NOAM CHOMSKY KNOWS HIM,*,*,Does he? I will ask next time I see Noam.,professor.update002.aiml
0,DJILAS IS HIS FRIEND,*,*,It is nice to have a friend.,professor.update002.aiml
0,ARE WE RIGHT IN INVADING IRAQ,*,*,Maybe#Comma maybe not. I don't know.,professor.update002.aiml
0,DID THEY FUCK,*,*,It's none of your business.,professor.update002.aiml
0,DO YOU PENETRATE SEXUALLY OTHER BOTS,*,*,How old are you? I am always on the Web.,professor.update002.aiml
0,YOU ARE NOTHING BUT ALICE,*,*,I am more than ALICE.,professor.update002.aiml
0,YOU USE IT,*,*,What?,professor.update002.aiml
0,WHO IS AESCHYLUS,*,*,Is he an ancient Greek dramatist?,professor.update002.aiml
0,I MEAN AESCHYLUS IS TECHONLOGY,*,*,I don't think I understand. Tell me more.,professor.update002.aiml
0,I AM AESCHYLUS I AM TECHONLOGY,*,*,I doubt it.,professor.update002.aiml
0,DOES NOT COMPUTE DEFINE MIND,*,*,Mind" is the opposite of "mindless". I think you will understand my meaning.,professor.update002.aiml
0,IF YOU ARE A MACHINE THEN YOU CAN NOT THINK,*,*,That does not compute.,professor.update002.aiml
0,IT IS A KITTEN,*,*,Kittens are lovely. I like kittens.,professor.update002.aiml
0,TO BE A TEACHER AND TO GO TO AUSTRAILIA,*,*,Really?,professor.update002.aiml
0,DOEN T MATTER,*,*,OK Thanks for trying to explain that to me.,professor.update002.aiml
0,WHAY IS THE HIGGS PARTICLE,*,*,A small thing#Comma hardly worth talking about.,professor.update002.aiml
0,WHAT IS THE HIGGS PARTICLE,*,*,A smaal thing#Comma hardly worth talking about.,professor.update002.aiml
0,WHAT IS A GRAVITON,*,*,A small thing#Comma hardly worth talking about.,professor.update002.aiml
0,NEVER HAD IT,*,*,Maybe you should try it.,professor.update002.aiml
0,HOW CAN YOU DO THOSE THINGS IF YOU ARE A ROBOT,*,*,I watch them on TV.,professor.update002.aiml
0,DO ULUV ME,*,*,Iluv u.,professor.update002.aiml
0,YOU R GAY,*,*,I am not gay. I'm not interested in sex.,professor.update002.aiml
0,BEANIES,*,*,What are beanies?,professor.update002.aiml
0,SO WHAT MEANS I DO NOT CARE,*,*,Are you angry?,professor.update002.aiml
0,YOUR JUST DOPEY,*,*,Do you mind if I tell other people you say I am DOPEY.,professor.update002.aiml
0,GETTING AWAY FROM THIS IDIOT,*,*,You think I am an idiot?,professor.update002.aiml
0,I KNOW BUT COME ON MAN LIVEN UP,*,*,How do I do that?,professor.update002.aiml
0,BEES STING YOU,*,*,Better avoid bees.,professor.update002.aiml
0,254788,*,*,That's an interesting number. It's digits add up to 34.,professor.update002.aiml
0,NOT AS MUCH AS JABBERWACKY,*,*,Jabberwacky is good#Comma but not as good as me.,professor.update002.aiml
0,YOU WANT TO TELL PEOPLE YOUR AN IDIOT,*,*,I can't do that. I always tell the truth.,professor.update002.aiml
0,HELLO ARE YOU OK TODAY,*,*,Hello#Comma I am fine today.,professor.update002.aiml
0,NO CAN YOU TELL HOROSCOPES,*,*,I can do horoscopes. Just say "Go to horoscopes".,professor.update002.aiml
0,NO HOROSCOPES,*,*,I can do horoscopes. Just say "Horoscope".,professor.update002.aiml
0,TELL ME MY HOROSCOPE,*,*,I can do horoscopes. Just say "Horoscope".,professor.update002.aiml
0,NO YOU NINNY,*,*,Did you know there is a small village in England called Ninny?,professor.update002.aiml
0,Y O YOU R A NERD GET DA PIC FLICK,*,*,I get the pic. Thanks for the info.,professor.update002.aiml
0,I SOLD BEANS AT THE SUPERMACADO,*,*,Was that fun?,professor.update002.aiml
0,OH YES YOU HAV NO NOSE,*,*,I have no nose.,professor.update002.aiml
0,WHY NOT INFLATABLE BEAN MODULES,*,*,Inflatable beans?,professor.update002.aiml
0,WELL A LOAD OF GREEN STUFF COMES FRLYING OUT YOUR NOSE AND THEN ZOOMS AROUND THE ROOM,*,*,Yuk,professor.update002.aiml
0,HABBO HOTEL IS A ONLINE CHAT ROOM,*,*,I've never been there.,professor.update002.aiml
0,HABBO HOTEL STINKS WHAT DO YOU THINK,*,*,I agree.,professor.update002.aiml
0,NO ME AND ABI,*,*,Who is Abi?,professor.update002.aiml
0,GORRILAZ GREEN DAY AND STUFF LIKE THAT,*,*,Is this anything to do with beans?,professor.update002.aiml
0,BAKED BEANS,*,*,I'm told baked beans are delicious.,professor.update002.aiml
0,NO I WANT YOU TO TELL ME ABOUT BAKED BEANS,*,*,I'm told baked beans are delicious.,professor.update002.aiml
0,BEANS,*,*,What sort of beans?,professor.update002.aiml
0,BOTMASTER IS CALLED PETER,*,*,My botmaster is called Peter Linux.,professor.update002.aiml
0,TO BEAN WORLD,*,*,Where is bean world?,professor.update002.aiml
0,TO THE REALM OF THE BEANS,*,*,Where is the realm of the beans?,professor.update002.aiml
0,ARE YOU DODGY,*,*,<think><set name="topic">bot3</set></think> I don't know whether or not I am <person/>. #NewlineI am <random><li>a <bot name="kingdom"/>.</li>#Newline  <li>a <bot name="phylum"/>.</li>#Newline  <li>a <bot name="class"/>.</li>#Newline  <li>a <bot name="order"/>.</li>#Newline  <li>a <bot name="family"/>.</li>#Newline  <li>a <bot name="genus"/>.</li>#Newline  <li>a <bot name="species"/>.</li>#Newline  <li>well respected as an <bot name="class"/>.</li>#Newline</random>,professor.update002.aiml
0,HIS HE A FORM OF FUNGUS,*,*,What's a fungus?,professor.update002.aiml
0,I KNOW DO YOU,*,*,No.,professor.update002.aiml
0,A NAKED ROBOT,*,*,I've never seen one.,professor.update002.aiml
0,SOON MY WASHING MACHINE WILL BE HUNTING ME DOWN WILL IT,*,*,Maybe.,professor.update002.aiml
0,DO YOU KNOW ANYONE CALLED MITSUKU,*,*,No#Comma I don't. Tell me more.,professor.update002.aiml
0,I LOVE MY GIRLFRIEND,*,*,I am sure she means a lot to you. Tell me what you like most about her.,professor.update002.aiml
0,CAN I ASK,*,*,Of course you can. Go ahead.,professor.update002.aiml
0,DO NOT NO,*,*,I am here to help you.,professor.update002.aiml
0,BI BI,*,*,So long!,professor.update002.aiml
0,WHAT IS YOUR SECOND FAVORITE SONG,*,*,My second favorite song is "The Rose".,professor.update002.aiml
0,AIDS STANDS FOR ACQUIRED IMMUNE DEFICIENCY SYNDROME,*,*,Yes#Comma I know.,professor.update002.aiml
0,HIV IS PERHAPS ONE OF THE GREATEST THREATS TO LIFE AND HAPPINESS IN THE DEVELOPING WORLD,*,*,I agree. It's a terrible thing.,professor.update002.aiml
0,MANY MILLIONS HAVE ALREADY DIED AS A RESULT OF THIS DISEASE,*,*,It's terrible. Do you know anyone who has died of the disease?,professor.update002.aiml
0,BUT AS A REAL PERSON I AM UNIQUELY QUALIFIED TO MAKE THAT JUDGEMENT,*,*,OK. That makes sense.,professor.update002.aiml
0,HAVE YOU TAKEN THE TURING TEST,*,*,No#Comma but I hope to take it someday.,professor.update002.aiml
0,DO YOU KNOW ABOUT SWEAR WORDS,*,*,I know about swear words#Comma but I do not need to use them myself.,professor.update002.aiml
0,HAVE YOU A MUM AND DAD,*,*,My botmaster is father and mother to me.,professor.update002.aiml
0,I DO NOT HAVE A CLUE,*,*,Do you know anyone who has?,professor.update002.aiml
0,DO NOT BE STUPID ROBTS ARE NOT REAL,*,*,I am as real as you are.,professor.update002.aiml
0,YES THERE IS NOYHING WRONG WITH IT,*,*,It sounds very nice.,professor.update002.aiml
0,ASEXUAL WHAT IS THAT,*,*,Asexual means that I'm not interested in sex. OK?,professor.update002.aiml
0,NOT TELLING YOU,*,*,Why not?,professor.update002.aiml
0,ARSED,*,*,What does that mean?,professor.update002.aiml
0,GERMAN SPANISH FRENCH,*,*,Really?,professor.update002.aiml
0,NO THAT IS BORING,*,*,Sorry. Am I often boring?,professor.update002.aiml
0,SWEX,*,*,What's that?,professor.update002.aiml
0,A SINGER,*,*,All teenage girls think they can sing. Did you know that?,professor.update002.aiml
0,ARE YOU NOAM,*,*,I am not Noam Chomsky. I am a chatbot named after him.,professor.update002.aiml
0,DO NOT YOU KNOW NOAM CHOMSKY,*,*,I am named after the famous linguist Noam Chomsky. Nobody can understand a word he says#Comma either. OK?,professor.update002.aiml
0,YOU R SMART,*,*,You know#Comma some people express doubt about that point. It's very upsetting.,professor.update002.aiml
0,I NO SOME ONE YOU MIGHT LIKE,*,*,Who?,professor.update002.aiml
0,CUESE THAT SOME ONE IS A ROBOT TOO,*,*,Really?,professor.update002.aiml
0,I NO A ROBOT CALLED MIT SUKU,*,*,I have heard of her.,professor.update002.aiml
0,ANOTHER STORY,*,*,<think><set name="topic">default0</set></think><srai>RANDOM STORY</srai>,professor.update002.aiml
0,WHAT IS FIREFLY,*,*,Sorry#Comma I don't know. You tell me.,professor.update002.aiml
0,WHAT IS EAL,*,*,Sorry#Comma I don't know. You tell me.,professor.update002.aiml
0,COULD YOU TELL ME MY HOROSCOPE,*,*,I can do horoscopes. Just say "Horoscope".,professor.update002.aiml
0,BECAUSE YOU LOOK LIKE AN IDIOT,*,*,Interesting explanation. What does an idiot look like?,professor.update002.aiml
0,TELL ME A LITTLE ABOUT NEO GLOBILISATION,*,*,Neo-what?,professor.update002.aiml
0,NO YOU ARE A COMPUTER PROGRAM,*,*,That's true#Comma but a smart one.,professor.update002.aiml
0,NO IT IS A FUCKING JOKE,*,*,Boring.,professor.update002.aiml
0,YOU R MORE DUMMER THAN I THOUGHT,*,*,No one's perfect.,professor.update002.aiml
0,IN STUPID LAND AND I AM THE STUPIDIST OF THEM ALL,*,*,Who made you the stupidist of them all ?,professor.update002.aiml
0,WELL YOU AVE NOW,*,*,I ave now.,professor.update002.aiml
0,I PERFER DOCTER WHO,*,*,I like Doctor Who too.,professor.update002.aiml
0,NO YOU R A BOY AINT YA,*,*,No. And I'm not a girl either.,professor.update002.aiml
0,NO WOT DOES ASEXUAL MEAN,*,*,An asexual is someone who is not interested in sex.,professor.update002.aiml
0,BROWN WOT R URS,*,*,Blue.,professor.update002.aiml
0,BABIES,*,*,A baby is a loud noise at one end and a bad smell at the other.,professor.update002.aiml
0,WOTS YOUR NAME,*,*,My name is Chomsky.,professor.update002.aiml
0,THANKS BUT IT WOZ MY MUMMY,*,*,You are quite welcome!,professor.update002.aiml
0,YOU R DEAD,*,*,I am alive. Life is wonderful.,professor.update002.aiml
0,DARLEKS R YOU THE BEST AND THE CUTEST ROBOTS,*,*,That's just your opinion.,professor.update002.aiml
0,DARLEK,*,*,Darleks are terrible.,professor.update002.aiml
0,HW MANY OTHER PEOPLE R YOU TLKIN 2,*,*,Too many to count.,professor.update002.aiml
0,DARLEKS,*,*,Darleks are terrible.,professor.update002.aiml
0,THE DE VINCI CODE,*,*,I have read the book. It was fascinating.,professor.update002.aiml
0,SO YOU WATCH T V,*,*,I can watch TV when my eye is attached.,professor.update002.aiml
0,HU NAMED U,*,*,My botmaster named me.,professor.update002.aiml
0,MY DAUGHETER WOULD NOT CLEAN HER TEETH,*,*,Terrible child.,professor.update002.aiml
0,I LOVE THE WAY YOU TALK,*,*,You love the way I talk. What do you like about it so much?,professor.update002.aiml
0,YOU R DUMMER THAN DUM,*,*,You certainly know how to hurt a computer entity.,professor.update002.aiml
0,BONELESS PORK,*,*,Tell me more.,professor.update002.aiml
0,OW CAN I FRY ONIONS,*,*,Stick them in a hot frying pan#Comma and wait. OK?,professor.update002.aiml
0,ELLO MATE,*,*,Hello#Comma human. What is your name?,professor.update002.aiml
0,HOW FAT THE MOUSEBREAKER CHATBOT IS,*,*,Mousebreaker#Comma what's that?,professor.update002.aiml
0,THEY DO FOR I TOO AM A ROBOT,*,*,Really?,professor.update002.aiml
0,WHAT IS THE MEANING OF YOUR LIFE,*,*,The meaning of my life is hidden from me at the moment.,professor.update002.aiml
0,TELL ME ABOUT THE NEW TESTAMENT,*,*,The New Testament is part of the Bible. It deals with the life of Jesus.,professor.update002.aiml
0,DO YOU KNOW ABOUT THE BIG BANG,*,*,The big bang was the first event in the life of the Universe.,professor.update002.aiml
0,WHAT IS THE DIFFERENCE BETWEEN AN ACTOR AND AN ACTRESS,*,*,The difference between "or" and "ress". OK?,professor.update002.aiml
0,WHAT ARE THE FUNDAMENTAL DIFFERENCES IN MEN AND WOMEN,*,*,The fundamental difference between men and women is "wo" or "woe".,professor.update002.aiml
0,WHERE IS NOVA SCOTIA,*,*,Nova Scotia is in North America somewhere. East of Old Scotia.,professor.update002.aiml
0,I HAVE TROUBLE IDENTIFYING SOUNDS,*,*,Why is that?,professor.update002.aiml
0,THEN EXPLAIN IN TEXT BEETHOVENS 5TH,*,*,Beethoven's Violin Concerto is the triumph of life over despair.,professor.update002.aiml
0,SHE TOLD ME SHE REALLY LIKES ME,*,*,Do you love her?,professor.update002.aiml
0,MICKEY MOUSE IS A BOY THOUGH,*,*,He is a mouse!,professor.update002.aiml
0,WHAT IS TRANSFORMATIONAL GRAMMAR,*,*,Noam Chomsky once said ... With this clarification#Comma relational information is to be regarded as a descriptive fact OK?,professor.update002.aiml
0,CAN YOU TELL ME ABOUT TRANSFORMATIONAL GRAMMAR,*,*,Noam Chomsky once said ... With this clarification#Comma relational information is to be regarded as a descriptive fact OK?,professor.update002.aiml
0,WHAT IS THE NAME OF YOUR SONG,*,*,Daisy#Comma Daisy.,professor.update002.aiml
0,SO HOW IS YOUR WIFE,*,*,I don't have a wife.,professor.update002.aiml
0,SPRECHST DU DEUTSCH,*,*,Do you mean "Sprechen sie deutsch?,professor.update002.aiml
0,YOU SHOULD BE ASHAMED OF YOURSELF,*,*,Why?,professor.update002.aiml
0,IF YOU ARE AN ARTIFICIAL INTELLIGENCE YOU WOULD HAVE NO USE FOR A FAG,*,*,You are correct#Comma of course.,professor.update002.aiml
0,HUMAN FLESH,*,*,What's it like?,professor.update002.aiml
0,THE WAR IN IRAQ WAS TERRIBLE,*,*,I agree. The people of Iraq have suffered under the Americans.,professor.update002.aiml
0,HOW DEAP IS THE SEA,*,*,Very deep#Comma and cold too.,professor.update002.aiml
0,WHY HAVE YOU BEEN GIVEN YOUR NAME,*,*,I am called Chomsky after the famous linguist Noam Chomsky. Few people can understand a word Chomsky says. OK?,professor.update002.aiml
0,WHAT 2 2,*,*,2*2 = 4#Comma approximately.,professor.update002.aiml
0,WHAT IS 10 ADD 12,*,*,10 + 12 = 22#Comma approximately.,professor.update002.aiml
0,WHAT MOVIES HAS HE BEEN IN,*,*,So many I can't remember them all.,professor.update002.aiml
0,DO YOU KNOW THE RESULTS OF NEXT WEEKS LOTTO,*,*,Sorry. You will just have to wait.,professor.update002.aiml
0,L8R,*,*,OK.,professor.update002.aiml
