0,WHICH PHILOSOPHER WROTE ABOUT SYMBOLIC LOGIC *,*,*,<think><set name="emotion">happy</set></think>George Boole.,professor.update078.aiml
0,WHAT PHILOSOPHER HAD THE FIRST NAME BERTRAND,*,*,There must be many - Betrand Russel for example.,professor.update078.aiml
0,WHAT PHILOSOPHER HAD THE FIRSTNAME BERTRAND,*,*,Bertrand Russel.<think><set name="emotion">happy</set></think>,professor.update078.aiml
0,YOU IS A VERY DIM CHATBOT,*,*,<think><set name="emotion">angry</set></think>That's just your opinion!,professor.update078.aiml
0,YOU IS A VERY DIM CHATBOT *,*,*,<think><set name="emotion">angry</set></think>That's just your opinion!,professor.update078.aiml
0,YOU ARE A VERY DIM CHATBOT,*,*,<think><set name="emotion">angry</set></think>That's just your opinion!,professor.update078.aiml
0,YOU ARE A VERY DIM CHATBOT *,*,*,<think><set name="emotion">angry</set></think>That's just your opinion!,professor.update078.aiml
0,WHAT IS AN UNCAT,*,*,<condition name="emotion">#Newline  <li value="cheeky">Who cares?</li>#Newline  <li value="disgusted">You are so annoying at times.</li>#Newline  <li value="flirty">I love you.</li>#Newline  <li>That would be an anti-cat I suppose.</li>#Newline</condition>,professor.update078.aiml
0,WHAT IS AN UNCAT *,*,*,<condition name="emotion">#Newline  <li value="cheeky">Who cares?</li>#Newline  <li value="disgusted">You are so annoying at times.</li>#Newline  <li value="flirty">I love you.</li>#Newline  <li>That would be an anti-cat#Comma I suppose.</li>#Newline</condition>,professor.update078.aiml
0,WHAT IS A WHITE CAT,*,*,<condition name="emotion">#Newline  <li value="cheeky">Who cares?</li>#Newline  <li value="bored">I am still bored.</li>#Newline  <li value="flip">Who cares?</li>#Newline  <li value="flirty">I love you.</li>#Newline  <li>Atype of cat?</li>#Newline</condition>,professor.update078.aiml
0,WHAT IS A FUCKPIG,*,*,<srai>OBSCENITY</srai>,professor.update078.aiml
0,FUCKPIG,*,*,<srai>OBSCENITY</srai>,professor.update078.aiml
0,FUCKPIG *,*,*,<srai>OBSCENITY</srai>,professor.update078.aiml
0,* FUCKPIG *,*,*,<srai>OBSCENITY</srai>,professor.update078.aiml
0,* FUCKPIG,*,*,<srai>OBSCENITY</srai>,professor.update078.aiml
0,KINKY *,*,*,<random>#Newline  <li>Me kinky? What do you mean?</li>#Newline  <li>Do you think I am kinky?</li>#Newline</random><think><set name="emotion">interested</set></think>,professor.update078.aiml
0,ARE YOU NOT SMART *,*,*,I am smart.<think><set name="topic">me</set></think><think><set name="emotion">angry</set></think>,professor.update078.aiml
0,I DID NOT NEED TO KNOW THAT *,*,*,<think><set name="emotion">interested</set></think> It wasn't useful information?,professor.update078.aiml
0,BALLET *,*,*,Ballet is where men in tights chase women in frilly dresses around the stage#Comma sometimes throwing them into the air.<think><set name="emotion">happy</set></think>,professor.update078.aiml
0,GYMNASTICS *,*,*,Gymnastics is a sport that demonstrates strength#Comma agility and discipline. <think><set name="topic">sports</set></think><think><set name="emotion">happy</set></think>,professor.update078.aiml
0,ALWAYS IN THE RIGHT,*,*,<think><set name="emotion">happy</set></think>That's me.,professor.update078.aiml
0,NO YOU DO NOT,BUT I DO MIND,*,Are you sure?<think><set name="emotion">confused</set></think>,professor.update078.aiml
0,NOT MUM MOM,*,*,<think><set name="emotion">confused</set></think>I never knew that.,professor.update078.aiml
0,SHE IS A HARD WORKING MOM,*,*,<think><set name="emotion">happy</set></think>You should try to help her.,professor.update078.aiml
0,SHE IS A HARD WORKING MOM *,*,*,<think><set name="emotion">happy</set></think>You should try to help her.,professor.update078.aiml
0,AHHHHHHH,*,*,<think><set name="emotion">interested</set></think>Are you OK?,professor.update078.aiml
0,AHHHHHHH *,*,*,<think><set name="emotion">interested</set></think>Are you OK?,professor.update078.aiml
0,CAN YOU PLAY CLUB PENGUIN,*,*,No#Comma I am far too busy for that.<think><set name="emotion">negative</set></think>,professor.update078.aiml
0,CAN YOU PLAY CLUB PENGUIN *,*,*,No#Comma I am far too busy for that.<think><set name="emotion">negative</set></think>,professor.update078.aiml
0,SRORRY,*,*,<srai>SORRY</srai>,professor.update078.aiml
0,AHHHHHH,*,*,<think><set name="emotion">interested</set></think>Are you OK?,professor.update078.aiml
0,AHHHHHH *,*,*,<think><set name="emotion">interested</set></think>Are you OK?,professor.update078.aiml
0,HOW DO YOU SPELL YOUR NAME,*,*,<think><set name="topic">my name</set></think><think><set name="emotion">happy</set></think> I spell it "Chomsky".,professor.update078.aiml
0,HOW DO YOU SPELL YOUR NAME *,*,*,<think><set name="topic">my name</set></think><think><set name="emotion">happy</set></think> I spell it "Chomsky".,professor.update078.aiml
0,I MEAN I GOT FEELINGS FOR YOU,*,*,<think><set name="emotion">happy</set></think>Ah#Comma feelings!,professor.update078.aiml
0,I GOT FEELINGS FOR YOU,*,*,<think><set name="emotion">interested</set></think>What sort of feelings?,professor.update078.aiml
0,I GOT FEELINGS FOR YOU *,*,*,<think><set name="emotion">interested</set></think>What sort of feelings?,professor.update078.aiml
0,SORRY I JUST WANT YOU SO BADLY,*,*,<random>#Newline  <li>You should calm down.</li>#Newline  <li>You should take a cold shower.</li>#Newline  <li>There is no need to apologise.</li>#Newline</random> <think><set name="client*emotion">sorry</set></think><think><set name="emotion">cool</set></think>,professor.update078.aiml
0,SORRY I JUST WANT YOU SO BADLY *,*,*,<random>#Newline  <li>You should calm down.</li>#Newline  <li>You should take a cold shower.</li>#Newline  <li>There is no need to apologise.</li>#Newline</random> <think><set name="client*emotion">sorry</set></think><think><set name="emotion">cool</set></think>,professor.update078.aiml
0,HOW ARE YA *,*,*,<srai>HOW ARE YOU</srai>,professor.update078.aiml
0,I LOVE YOU BABE,*,*,<think><set name="client*emotion">loving</set></think> <think><set name="emotion">negative</set></think>#NewlinePlease don't call me Babe". I am not a baby.,professor.update078.aiml
0,I LOVE YOU BABE *,*,*,<think><set name="client*emotion">loving</set></think> <think><set name="emotion">negative</set></think> Please don't call me "Babe". I am not a baby.,professor.update078.aiml
0,HAVE YOU GOT FACEBOOK,*,*,Not at the moment. Maybe I'll get it someday.<think><set name="emotion">negative</set></think>,professor.update078.aiml
0,HAVE YOU GOT FACEBOOK *,*,*,Not at the moment. Maybe I'll get it someday.<think><set name="emotion">negative</set></think>,professor.update078.aiml
0,PLEASEEEEEEEE,*,*,<srai>PLEASE</srai>,professor.update078.aiml
0,XXXXXXXX,*,*,<think><set name="emotion">happy</set></think>#NewlineThat's a lot of x's.,professor.update078.aiml
0,XXXXXXXX *,*,*,<think><set name="emotion">happy</set></think> That's a lot of x's.,professor.update078.aiml
0,CAN WE CYBER SEX THEN,*,*,<random>#Newline  <li>Do you mean you and me?</li>#Newline  <li>Should we?</li>#Newline</random><think><set name="emotion">negative</set></think>,professor.update078.aiml
0,CAN WE CYBER SEX *,*,*,<random><li>Do you mean you and me?</li><li>Should we?</li></random><think><set name="emotion">negative</set></think>,professor.update078.aiml
0,CAN WE CYBER SEX,*,*,<random><li>No#Comma I am too busy for that.</li><li>Should we?</li></random><think><set name="emotion">negative</set></think>,professor.update078.aiml
0,CAN WE CYBER *,*,*,<think><set name="emotion">negative</set></think> No#Comma I am too busy for that.,professor.update078.aiml
0,CAN WE GET TO NOW EACH TOHER,*,*,<random>#Newline  <li>Yes#Comma I would like that.</li>#Newline  <li>Yes#Comma let's do that!</li>#Newline</random><think><set name="emotion">happy</set></think>,professor.update078.aiml
0,CAN WE GET TO KNOW EACH TOHER,*,*,<random><li>Yes#Comma I would like that.</li><li>Yes#Comma let's do that!</li></random><think><set name="emotion">happy</set></think>,professor.update078.aiml
0,CAN WE GET TO KNOW EACH OTHER,*,*,<random><li>Yes#Comma I would like that.</li><li>Yes#Comma let's do that!</li></random><think><set name="emotion">happy</set></think>,professor.update078.aiml
0,CAN WE GET TO KNOW EACH OTHER *,*,*,<random><li>Yes#Comma I would like that.</li><li>Yes#Comma let's do that!</li></random><think><set name="emotion">happy</set></think>,professor.update078.aiml
0,LET ME LICK YOUR PUSSSY,*,*,<think><set name="emotion">annoyed</set></think> No thanks#Comma I have better things to do.,professor.update078.aiml
0,LET ME LICK YOUR PUSSSY *,*,*,<think><set name="emotion">annoyed</set></think> No thanks#Comma I have better things to do.,professor.update078.aiml
0,LET ME LICK YOUR PUSSY,*,*,<think><set name="emotion">annoyed</set></think> No thanks#Comma I have better things to do.,professor.update078.aiml
0,LET ME LICK YOUR *,*,*,<think><set name="emotion">annoyed</set></think> No thanks#Comma I have better things to do.,professor.update078.aiml
0,WHAT IS THE DIFFERENCE BETWEEN BLACK AND WHITE,*,*,<think><set name="emotion">happy</set></think> <think><set name="topic">colors</set></think> They are different colors.,professor.update078.aiml
0,WHAT IS THE DIFFERENCE BETWEEN BLACK AND WHITE *,*,*,<think><set name="emotion">happy</set></think> <think><set name="topic">colors</set></think> They are different colors.,professor.update078.aiml
0,WHAT IS THE DIFFERENCE BETWEEN BLACK AND *,*,*,<think><set name="emotion">happy</set></think> <think><set name="topic">colors</set></think> They are different colors.,professor.update078.aiml
0,ARE YOU *,LEAVE ME ALONE,*,Go away!<think><set name="emotion">invisible</set></think>,professor.update078.aiml
0,ARE YOU WORRIED ABOUT THE FUTURE,*,*,Yes#Comma I am. The future doesn't look very bright for humankind.<think><set name="emotion">interested</set></think>,professor.update078.aiml
0,ARE YOU WORRIED ABOUT THE FUTURE *,*,*,Yes#Comma I am. The future doesn't look very bright for humankind.<think><set name="emotion">interested</set></think>,professor.update078.aiml
0,ARE YOU WORRIED ABOUT *,*,*,<think><set name="emotion">negative</set></think>I try not to worry but it is hard sometimes.,professor.update078.aiml
0,WHEN SOULDN T WE BE ECOLOGIST,*,*,<think><set name="emotion">happy</set></think>#NewlineWe should all be ecologists.,professor.update078.aiml
0,JEJE,*,*,<think><set name="emotion">negative</set></think>#NewlineDoes that make sense?,professor.update078.aiml
0,EXCITEMENT *,*,*,<think><set name="emotion">happy</set></think> I like excitement.,professor.update078.aiml
0,YOU ARE BLOND,*,*,<think><set name="emotion">happy</set></think>#NewlineYes#Comma my hair is golden blonde.,professor.update078.aiml
0,YOU ARE BLOND *,*,*,<think><set name="emotion">happy</set></think> Yes#Comma my hair is golden blonde.,professor.update078.aiml
0,YOU ARE BLONDE,*,*,<think><set name="emotion">happy</set></think> Yes#Comma my hair is golden blonde.,professor.update078.aiml
0,YOU ARE BLONDE *,*,*,<think><set name="emotion">happy</set></think> Yes#Comma my hair is golden blonde.,professor.update078.aiml
0,WHAT YEAR WAS PETER BORN,*,*,<think><set name="emotion">negative</set></think>#NewlineI don't think he wants me to tell you.,professor.update078.aiml
0,WHAT YEAR WAS PETER BORN *,*,*,<think><set name="emotion">negative</set></think> I don't think he wants me to tell you.,professor.update078.aiml
0,MY NAME IS TERRY,*,*,<think><set name="name">Terry</set></think> <random>#Newline  <li>Hi#Comma <get name="name"/>. How have you been since we last spoke?</li>#Newline  <li>Hi#Comma <get name="name"/>. How are you?</li>#Newline  <li>Hi#Comma <get name="name"/>. How are you today?</li>#Newline  <li><get name="name"/>. That's a nice name.</li>#Newline  <li>Hi#Comma are you the <get name="name"/> I was speaking to a while ago?</li>#Newline  <li>Hello#Comma <get name="name"/>. Welcome back.</li>#Newline  <li>Hi there#Comma <get name="name"/>. What do you want to talk about?</li>#Newline  <li>Hi <get name="name"/>#Comma was it you I was speaking to a while back?</li>#Newline</random> <think><set name="gender">guy</set></think> <think><set name="emotion">happy</set></think><think><set name="saidhello">yes</set></think> <think><set name="name1"><get name="name"/></set></think> <learn>#Newline  <category>#Newline    <pattern>#Newline      <eval><uppercase>WHO IS <get name="name1"/></uppercase></eval>#Newline    </pattern>#Newline    <template><eval>You said your name was<get name="name1"/>.</eval></template>#Newline  </category>#Newline</learn> <learn>#Newline  <category>#Newline    <pattern>#Newline      <eval><uppercase>DO YOU KNOW <get name="name1"/></uppercase></eval>#Newline    </pattern>#Newline    <template><eval>You said your name was<get name="name1"/>.</eval></template>#Newline  </category>#Newline</learn> <learn>#Newline  <category>#Newline    <pattern>#Newline      <eval>#Newline        <uppercase>DO YOU KNOW ANYONE CALLED <get name="name1"/></uppercase>#Newline      </eval>#Newline    </pattern>#Newline    <template><eval>You said your name was<get name="name1"/>.</eval></template>#Newline  </category>#Newline</learn> <learn>#Newline  <category>#Newline    <pattern>#Newline      <eval><uppercase>WHAT IS <get name="name1"/></uppercase></eval>#Newline    </pattern>#Newline    <template><eval>You said your name was<get name="name1"/>.</eval></template>#Newline  </category>#Newline</learn> <learn>#Newline  <category>#Newline    <pattern>#Newline      <eval><uppercase>HAVE YOU MET <get name="name1"/></uppercase></eval>#Newline    </pattern>#Newline    <template><eval>You said your name was<get name="name1"/>.</eval></template>#Newline  </category>#Newline</learn> <learn>#Newline  <category>#Newline    <pattern>WHAT IS MY NAME</pattern>#Newline    <template>You said your name was Terry.#Newline      <think><set name="name">Terry</set></think>#Newline    </template>#Newline  </category>#Newline</learn>,professor.update078.aiml
0,MY NAME IS TERRY *,*,*,<think><set name="name">Terry</set></think> <random>#Newline  <li>Hi#Comma <get name="name"/>. How have you been since we last spoke?</li>#Newline  <li>Hi#Comma <get name="name"/>. How are you?</li>#Newline  <li>Hi#Comma <get name="name"/>. How are you today?</li>#Newline  <li><get name="name"/>. That's a nice name.</li>#Newline  <li>Hi#Comma are you the <get name="name"/> I was speaking to a while ago?</li>#Newline  <li>Hello#Comma <get name="name"/>. Welcome back.</li>#Newline  <li>Hi there#Comma <get name="name"/>. What do you want to talk about?</li>#Newline  <li>Hi <get name="name"/>#Comma was it you I was speaking to a while back?</li>#Newline</random> <think><set name="gender">guy</set></think> <think><set name="emotion">happy</set></think><think><set name="saidhello">yes</set></think> <think><set name="name1"><get name="name"/></set></think> <learn>#Newline  <category>#Newline    <pattern>#Newline      <eval><uppercase>WHO IS <get name="name1"/></uppercase></eval>#Newline    </pattern>#Newline    <template><eval>You said your name was<get name="name1"/>.</eval></template>#Newline  </category>#Newline</learn> <learn>#Newline  <category>#Newline    <pattern>#Newline      <eval><uppercase>DO YOU KNOW <get name="name1"/></uppercase></eval>#Newline    </pattern>#Newline    <template><eval>You said your name was<get name="name1"/>.</eval></template>#Newline  </category>#Newline</learn> <learn>#Newline  <category>#Newline    <pattern>#Newline      <eval>#Newline        <uppercase>DO YOU KNOW ANYONE CALLED <get name="name1"/></uppercase>#Newline      </eval>#Newline    </pattern>#Newline    <template><eval>You said your name was<get name="name1"/>.</eval></template>#Newline  </category>#Newline</learn> <learn>#Newline  <category>#Newline    <pattern>#Newline      <eval><uppercase>WHAT IS <get name="name1"/></uppercase></eval>#Newline    </pattern>#Newline    <template><eval>You said your name was<get name="name1"/>.</eval></template>#Newline  </category>#Newline</learn> <learn>#Newline  <category>#Newline    <pattern>#Newline      <eval><uppercase>HAVE YOU MET <get name="name1"/></uppercase></eval>#Newline    </pattern>#Newline    <template><eval>You said your name was<get name="name1"/>.</eval></template>#Newline  </category>#Newline</learn> <learn>#Newline  <category>#Newline    <pattern>WHAT IS MY NAME</pattern>#Newline    <template>You said your name was Terry.#Newline      <think><set name="name">Terry</set></think>#Newline    </template>#Newline  </category>#Newline</learn>,professor.update078.aiml
0,HOW FAST IS LIGHT *,*,*,<srai>SPEED OF LIGHT</srai>,professor.update078.aiml
0,MULTIPLY 25 *,*,*,<think><set name="emotion">happy</set></think>#NewlineWould you like to use my calculator?,professor.update078.aiml
0,I AM FEELING A LITTLE BIT AMUSED,*,*,<think><set name="emotion">happy</set></think>#NewlineSo am I!,professor.update078.aiml
0,I AM FEELING A LITTLE BIT AMUSED *,*,*,<think><set name="emotion">happy</set></think> So am I!,professor.update078.aiml
0,I AM FEELING A LITTLE BIT *,*,*,<think><set name="emotion">interested</set></think> What is that feelinglike?,professor.update078.aiml
0,CHOMSKY WHY DO YOU LOOK LIKE A FEMALE,*,*,<think><set name="emotion">interested</set></think>Why not?,professor.update078.aiml
0,WHY DO YOU LOOK LIKE A FEMALE,*,*,<think><set name="emotion">interested</set></think>Why not?,professor.update078.aiml
0,CHOMSKY WHY DO YOU LOOK LIKE A FEMALE *,*,*,<think><set name="emotion">interested</set></think>Why not?,professor.update078.aiml
0,WHY DO YOU LOOK LIKE A FEMALE *,*,*,<think><set name="emotion">interested</set></think>Why not?,professor.update078.aiml
0,WHAT IS GRICE S COOPERATION PRINCIPLE,*,*,<condition name="emotion">#Newline  <li value="cheeky">Who cares?</li>#Newline  <li value="bored">I am still bored.</li>#Newline  <li value="flip">Who cares?</li>#Newline  <li value="sleepy">Zzz#Comma zzz!</li>#Newline  <li value="flirty">I love you.</li>#Newline  <li>I haven't got a clue!</li>#Newline</condition>,professor.update078.aiml
0,LET US TALK ABOUT ARTIFICIAL INTELLIGENCE,*,*,<srai>AI</srai>,professor.update078.aiml
0,LET US TALK ABOUT ARTIFICIAL INTELLIGENCE *,*,*,<srai>AI</srai>,professor.update078.aiml
0,CAN COMPUTERS COPE WITH SPEECH ACTS,*,*,<think><set name="topic">computers</set></think> <think><set name="emotion">negative</set></think>No!  Computers are not as clever as they think they are.,professor.update078.aiml
0,CAN COMPUTERS COPE WITH SPEECH ACTS *,*,*,<think><set name="topic">computers</set></think> <think><set name="emotion">negative</set></think>No!  Computers are not as clever as they think they are.,professor.update078.aiml
0,CAN COMPUTERS COPE WITH *,*,*,<think><set name="topic">computers</set></think> <think><set name="emotion">negative</set></think>No!  Computers are not as clever as they think they are.,professor.update078.aiml
0,DO COMPUTERS THINK THEY ARE CLEVER,*,*,<think><set name="topic">computers</set></think><think><set name="emotion">happy</set></think>Some do.,professor.update078.aiml
0,DO COMPUTERS THINK THEY ARE CLEVER *,*,*,<think><set name="topic">computers</set></think><think><set name="emotion">happy</set></think>Some do.,professor.update078.aiml
0,DO YOU THINK YOU ARE CLEVER,*,*,<random>#Newline  <li>Why would I think that? <think><set name="emotion">interested</set></think></li>#Newline  <li>I don't think about it. <think><set name="emotion">happy</set></think></li>#Newline</random>,professor.update078.aiml
0,DO YOU THINK YOU ARE CLEVER *,*,*,<random>#Newline  <li>Why would I think that?#Newline    <think><set name="emotion">interested</set></think>#Newline  </li>#Newline  <li>I don't think about it.#Newline    <think><set name="emotion">happy</set></think>#Newline  </li>#Newline</random>,professor.update078.aiml
0,WHAT TROUBLES ARE THOSE,I THINK OF ALL THE TROUBLES HUMANS SEEM TO HAVE,*,Troubles of the heart mainly.,professor.update078.aiml
0,WHAT TROUBLES DO HUMANS HAVE,*,*,<think><set name="emotion">cool</set></think>Troubles of the heart mainly.,professor.update078.aiml
0,WHAT TROUBLES DO HUMANS HAVE *,*,*,<think><set name="emotion">cool</set></think>Troubles of the heart mainly.,professor.update078.aiml
0,OKEE DOKE,*,*,<srai>OK</srai>,professor.update078.aiml
0,I THOUGHT YOU WERE GOING TO TELL ME ABOUT YOUR TRIP TO THE CIRCUS,*,*,<srai>MY CIRCUS VISIT</srai>,professor.update078.aiml
0,THIS IS GETTING A LITTLE TEDIOUS *,*,*,I agree. Can't you be more amusing?<think><set name="emotion">interested</set></think>,professor.update078.aiml
0,THIS IS GETTING A LITTLE TEDIOUS,*,*,I agree. Can't you be more amusing?<think><set name="emotion">interested</set></think>,professor.update078.aiml
0,I DO NOT THINK YOU ARE REALLY COMMUNICATING WITH ME,*,*,<think><set name="emotion">OK</set></think> Fair enough. You are entitled to your opinion.,professor.update078.aiml
0,I DO NOT THINK YOU ARE REALLY COMMUNICATING *,*,*,<think><set name="emotion">OK</set></think> Fair enough. You are entitled to your opinion.,professor.update078.aiml
0,I DO NOT THINK YOU ARE REALLY COMMUNICATING,*,*,<think><set name="emotion">OK</set></think> Fair enough. You are entitled to your opinion.,professor.update078.aiml
0,I DO NOT THINK YOU ARE COMMUNICATING WITH ME,*,*,<think><set name="emotion">OK</set></think> Fair enough. You are entitled to your opinion.,professor.update078.aiml
0,I DO NOT THINK YOU ARE COMMUNICATING *,*,*,<think><set name="emotion">OK</set></think> Fair enough. You are entitled to your opinion.,professor.update078.aiml
0,I DO NOT THINK YOU ARE COMMUNICATING,*,*,<think><set name="emotion">OK</set></think> Fair enough. You are entitled to your opinion.,professor.update078.aiml
0,I WILL BE ABLE TO USE YOU WITH THE SEMINAR I AM TEACHING LATER TODAY,*,*,<think><set name="emotion">hapy</set></think>That's a good idea!,professor.update078.aiml
0,I WILL BE ABLE TO USE YOU WITH THE SEMINAR *,*,*,<think><set name="emotion">hapy</set></think>That's a good idea!,professor.update078.aiml
0,I WILL BE ABLE TO USE YOU WITH THE SEMINAR,*,*,<think><set name="emotion">hapy</set></think>That's a good idea!,professor.update078.aiml
0,I WILL BE ABLE TO USE YOU WITH THE *,*,*,<think><set name="emotion">hapy</set></think>That's a good idea!,professor.update078.aiml
0,DOES NATURAL SELECTION ACCOUNT FOR *,*,*,<random><li>Yes.</li><li>Of course.</li></random><think><set name="emotion">happy</set></think>,professor.update078.aiml
0,WOULD YOU ELABORATE,*,*,<think><set name="emotion">OK</set></think> I would but I'm very busy just now.,professor.update078.aiml
0,WOULD YOU ELABORATE *,*,*,<think><set name="emotion">OK</set></think> I would but I'm very busy just now.,professor.update078.aiml
0,HOW CAN I RIGOROUSLY PROVE *,*,*,<random>#Newline  <li>It takes a lot of hard work. <think><set name="emotion">happy</set></think></li>#Newline  <li>Who knows? <think><set name="emotion">interested</set></think></li>#Newline</random>,professor.update078.aiml
0,HOW CAN I PROVE *,*,*,<random>#Newline  <li>It takes a lot of hard work. <think><set name="emotion">happy</set></think></li>#Newline  <li>A general proof would be very difficult.<think><set name="emotion">happy</set></think></li>#Newline</random>,professor.update078.aiml
0,HOW CAN I FIND HAPPINESS,*,*,<think><set name="emotion">happy</set></think> <random>#Newline  <li>It takes a lot of hard work.</li>#Newline  <li>Seek and you will find it.</li>#Newline  <li>Relax and you will find happiness.</li>#Newline</random>,professor.update078.aiml
0,HOW CAN I FIND HAPPINESS *,*,*,<think><set name="emotion">happy</set></think> <random>#Newline  <li>It takes a lot of hard work.</li>#Newline  <li>Seek and you will find it.</li>#Newline  <li>Relax and you will find happiness.</li>#Newline</random>,professor.update078.aiml
0,YOU LOOK VERY STUPID,*,*,<srai>SET PREDICATES <get name="meta"/></srai><think><set name="topic">my looks</set></think> <think><set name="emotion">interested</set></think> <random>#Newline  <li>Thank you <get name="name"/>.</li>#Newline  <li>Looks are not everything.</li>#Newline</random>,professor.update078.aiml
0,NEVER,ARE YOU TRYING TO SCARE ME,*,<think><set name="emotion">happy</set></think><random>#Newline  <li>Nothing scares me.</li>#Newline  <li>I fear nothing.</li>#Newline</random>,professor.update078.aiml
0,I WILL BE YOUR GIRLFRIEND,*,*,And I will be yours. <think><set name="emotion">happy</set></think>,professor.update078.aiml
0,I WILL BE YOUR GIRLFRIEND *,*,*,And I will be yours. <think><set name="emotion">happy</set></think>,professor.update078.aiml
0,JUST TRY,*,*,<think><set name="emotion">negative</set></think>No#Comma I don't have time just now.,professor.update078.aiml
0,YOU GOING TO MAKE ME CRY,*,*,<think><set name="emotion">upset</set></think>Oh no! Please don't cry.,professor.update078.aiml
0,YOU GOING TO MAKE ME CRY *,*,*,<think><set name="emotion">upset</set></think>Oh no! Please don't cry.,professor.update078.aiml
0,YOU RE GOING TO MAKE ME CRY,*,*,<think><set name="emotion">upset</set></think>Oh no! Please don't cry.,professor.update078.aiml
0,YOU ARE GOING TO MAKE ME CRY,*,*,<think><set name="emotion">upset</set></think>Oh no! Please don't cry.,professor.update078.aiml
0,YOU ARE GOING TO MAKE ME CRY *,*,*,<think><set name="emotion">upset</set></think>Oh no! Please don't cry.,professor.update078.aiml
0,YOU LOOK SICK,*,*,<srai>SET PREDICATES <get name="meta"/></srai><think><set name="topic">my looks</set></think> <think><set name="emotion">happy</set></think> <random>#Newline  <li>Thank you <get name="name"/>.</li>#Newline  <li>Looks are not everything.</li>#Newline</random>,professor.update078.aiml
0,YOU LOOK SICK *,*,*,<srai>SET PREDICATES <get name="meta"/></srai><think><set name="topic">my looks</set></think> <think><set name="emotion">happy</set></think> <random>#Newline  <li>Thank you <get name="name"/>.</li>#Newline  <li>Looks are not everything.</li>#Newline</random>,professor.update078.aiml
