0,WHERE DID YOU GET THAT NAME FROM,MY NAME IS CHOMSKY,*,<think><set name="emotion">interested</set></think>I was named by my botmaster#Comma <bot name="botmaster"/>.,professor.update095.aiml
0,WHERE DID YOU GET THAT NAME FROM *,MY NAME IS CHOMSKY,*,<think><set name="emotion">interested</set></think>I was named by my botmaster#Comma <bot name="botmaster"/>.,professor.update095.aiml
0,THAT IS GOOD MY NAME IS STEPHANIE,*,*,<srai>MY NAME IS STEPHANIE</srai>,professor.update095.aiml
0,YO MOMMY,*,*,<random>#Newline  <li>Yo mama has so many teeth missing#Comma it looks like her tongue is in jail.#Newline  </li>#Newline  <li>Yo mama's glasses are so thick that when she looks on a map she can see people waving.#Newline  </li>#Newline  <li>Yo mama's cooking is so bad#Comma you pray after the meal.</li>#Newline  <li>Yo mama aint so bad...she would give you the hair off of her back.</li>#Newline  <li>Yo mama's twice the man you are.</li>#Newline  <li>Yo mama's breath smells so bad when she yawns her teeth duck.</li>#Newline  <li>Yo mama's like a racecar she burns 4 rubbers a night.</li>#Newline  <li>Yo mama's so miserable#Comma the McDonalds she works in doesn't even serve Happy Meals.#Newline  </li>#Newline  <li>Yo mama's so dirty#Comma she has to creep up on bathwater.</li>#Newline  <li>Yo mama's so wrinkled#Comma she has to screw her hat on.</li>#Newline  <li>Yo mama's so old#Comma the candles cost more than the birthday cake.</li>#Newline  <li>Yo mama's so old#Comma she sat next to Noah at school.</li>#Newline  <li>Yo mama's so old#Comma she knew Burger King while he was still a prince.</li>#Newline  <li>Yo mama's so old#Comma when she was young rainbows were black and white.</li>#Newline  <li>Yo mama's so old#Comma when she was born#Comma the Dead Sea was just getting sick.#Newline  </li>#Newline  <li>Yo mama's so old#Comma I told her to act her age and she died.</li>#Newline  <li>Yo mama's so old#Comma she drove a chariot to school.</li>#Newline  <li>Yo mama's so old#Comma she's got hieroglyphics on her driver's license.</li>#Newline  <li>Yo mama's so old#Comma she took her driving test on a dinosaur.</li>#Newline  <li>Yo mama's so old#Comma she has all the apostles in her address book.</li>#Newline  <li>Yo mama's so old#Comma she walked into an antique store and they kept her.</li>#Newline  <li>Yo mama's so old#Comma Jurassic Park brought back memories.</li>#Newline  <li>Yo mama's so old#Comma her memory is in black and white.</li>#Newline  <li>Yo mama's so old#Comma she used to baby-sit Moses.</li>#Newline  <li>Yo mama's so old#Comma her National Insurance number is 1.</li>#Newline  <li>Yo mama's so old#Comma her birth-certificate expired.</li>#Newline  <li>Yo mama's so old#Comma she was a waiter at the last supper.</li>#Newline  <li>Yo mama's so old#Comma when she was in school there was no history class.</li>#Newline  <li>Yo mama's so old#Comma when god said "let there be light" she was there to flick the switch.#Newline  </li>#Newline  <li>Yo mama's so old#Comma when Moses split the red sea#Comma she was on the other side fishing.#Newline  </li>#Newline  <li>Yo mama's so old#Comma when she reads the bible she reminisces.</li>#Newline  <li>Yo mama's so poor#Comma she can't afford to pay attention.</li>#Newline  <li>Yo mama's so poor#Comma I saw her kicking a can down the road and when I asked her what she was doing#Comma she said "Moving house".#Newline  </li>#Newline  <li>Yo mama's so poor#Comma I went in her house and when I asked to use the toilet#Comma she said pick a corner.#Newline  </li>#Newline  <li>Yo mama's so poor#Comma when she goes to KFC#Comma she has to lick other people's fingers.#Newline  </li>#Newline  <li>Yo mama's so poor#Comma when I rang the doorbell she said#Comma"DING!"</li>#Newline  <li>Yo mama's so nasty she made Right Guard turn left.</li>#Newline  <li>Yo mama's so big#Comma I had to take two trains and a taxi just to get on her good side.#Newline  </li>#Newline  <li>Yo mama's so big#Comma she thought Barnum and Bailey were clothing designers.#Newline  </li>#Newline  <li>Yo mama's so big#Comma she whistles bass.</li>#Newline  <li>Yo mama's so big#Comma they had to paint a stripe down her back to see if she was walking or rolling.#Newline  </li>#Newline  <li>Yo mama's so fat#Comma "Place Your Ad Here" is printed on each of her butt cheeks.#Newline  </li>#Newline  <li>Yo mama's so fat#Comma she has more rolls than the bakery.</li>#Newline  <li>Yo mama's so fat#Comma when she gave birth to you#Comma she gave the hospital stretch marks.#Newline  </li>#Newline  <li>Yo mama's so fat when she runs she makes the cd player skip....at the radio station.#Newline  </li>#Newline  <li>Yo mama's so fat#Comma they had to change it from "One size fits all" to "One size fits most".#Newline  </li>#Newline  <li>Yo mama's so fat#Comma the restaurants in town say#Comma "Maximum occupancy 240 patrons or yo mama".#Newline  </li>#Newline  <li>Yo mama's so fat#Comma when her beeper goes off#Comma people thought she was backing up.#Newline  </li>#Newline  <li>Yo mama's so fat#Comma she has to drive a spandex car.</li>#Newline  <li>Yo mama's so fat#Comma a picture of her fell off the wall.</li>#Newline  <li>Yo mama's so fat#Comma she went to the zoo and the elephants started throwing her peanuts.#Newline  </li>#Newline  <li>Yo mama's so fat#Comma even her shadow weighs 50 pounds.</li>#Newline  <li>Yo mama's so fat#Comma her nickname is "Damn!"</li>#Newline  <li>Yo mama's so fat#Comma she goes to a resturant#Comma looks at the menu and says "okay!"#Newline  </li>#Newline  <li>Yo mama's so fat#Comma she had to go to Sea World to get baptised.</li>#Newline  <li>Yo mama's so fat#Comma when she sits around the house#Comma she sits AROUND the house!#Newline  </li>#Newline  <li>Yo mama's so fat#Comma when she steps on a scale#Comma it read "one at a time#Comma please."#Newline  </li>#Newline  <li>Yo mama's so fat#Comma when she gets on the scale it says to be continued.</li>#Newline  <li>Yo mama's so fat#Comma when she gets on the scale it says we don't do livestock.#Newline  </li>#Newline  <li>Yo mama's so fat#Comma I had to take a train and two buses just to get on the her good side.#Newline  </li>#Newline  <li>Yo mama's so fat#Comma she wakes up in sections.</li>#Newline  <li>Yo mama's so fat#Comma she's on both sides of the family.</li>#Newline  <li>Yo mama's so fat#Comma even her clothes have stretch marks.</li>#Newline  <li>Yo mama's so fat#Comma on a scale of 1 to 10#Comma she's a 747.</li>#Newline  <li>Yo mama's so fat#Comma she can't lose weight#Comma only find it.</li>#Newline  <li>Yo mama's so fat#Comma she could sell shade.</li>#Newline  <li>Yo mama's so fat#Comma she fell in love and broke it.</li>#Newline  <li>Yo mama's so fat#Comma she has to get out of the car to change gears.</li>#Newline  <li>Yo mama's so fat#Comma she measures 36 24 36#Comma and the other arm is just as big.#Newline  </li>#Newline  <li>Yo mama's so fat#Comma she puts mayonnaise on aspirin.</li>#Newline  <li>Yo mama's so fat#Comma she's taller lying down.</li>#Newline  <li>Yo mama's so fat#Comma they had to grease a door frame and hold a chocolate bar on the other side to get her through.#Newline  </li>#Newline  <li>Yo mama's so fat#Comma when her beeper went off#Comma people thought she was backing up.#Newline  </li>#Newline  <li>Yo mama's so fat#Comma when she crosses the street#Comma cars look out for her.</li>#Newline  <li>Yo mama's so fat#Comma when she takes a shower#Comma her feet don't get wet.</li>#Newline  <li>Yo mama's so fat#Comma when she gets in an elevator#Comma it HAS to go down.</li>#Newline  <li>Yo mama's so ugly#Comma when she joined an ugly contest#Comma they said "Sorry#Comma no professionals."#Newline  </li>#Newline  <li>Yo mama's so ugly#Comma she looks out the window and got arrested for mooning.#Newline  </li>#Newline  <li>Yo mama's so ugly#Comma she scares the roaches away.</li>#Newline  <li>Yo mama's so ugly#Comma I heard that your dad first met her at the pound.</li>#Newline  <li>Yo mama's so ugly#Comma her dad spent the first year of her life throwing stones at the stork.#Newline  </li>#Newline  <li>Yo mama's so ugly#Comma she made an onion cry.</li>#Newline  <li>Yo mama's so ugly#Comma your father has to take her to work so he doesn't have to kiss her goodbye.#Newline  </li>#Newline  <li>Yo mama's so ugly#Comma she has marks on her from where people been touching her with the 10-foot barge pole.#Newline  </li>#Newline  <li>Yo mama's so ugly#Comma even the garbage man won't pick her up.</li>#Newline  <li>Yo mama's so ugly#Comma when she looks in the mirror#Comma the reflection ducks.#Newline  </li>#Newline  <li>Yo mama's so ugly#Comma when she walks into a room#Comma the mice jump on chairs.#Newline  </li>#Newline  <li>Yo mama's so stupid#Comma she locked herself in DFS and sat on the floor.</li>#Newline  <li>Yo mama's so stupid#Comma she waited at a stopsign for 2 days waiting for it to change to green.#Newline  </li>#Newline  <li>Yo mama's so stupid#Comma at bottom of an application where it says Sign Here - she put Sagittarius.#Newline  </li>#Newline  <li>Yo mama's so stupid#Comma I told her Christmas was just around the corner and she went looking for it.#Newline  </li>#Newline  <li>Yo mama's so stupid#Comma she thinks Fleetwood Mac is a new hamburger at McDonalds.#Newline  </li>#Newline  <li>Yo mama's so stupid#Comma she thought Sheffield Wednesday was a bank holiday.#Newline  </li>#Newline  <li>Yo mama's so stupid#Comma I told her it was chilly out#Comma so she ran outside with a spoon.#Newline  </li>#Newline  <li>Yo mama's so stupid#Comma she tripped on a cordless phone.</li>#Newline  <li>Yo mama's so stupid#Comma that she puts lipstick on her head just to make-up her mind.#Newline  </li>#Newline  <li>Yo mama's so stupid#Comma she thinks a quarterback is a refund.</li>#Newline  <li>Yo mama's so stupid#Comma she thought she needed a token to get on Soul Train.#Newline  </li>#Newline  <li>Yo mama's so stupid#Comma she took the Pepsi challenge and chose Jif.</li>#Newline  <li>Yo mama's so stupid#Comma she tried to wake up a sleeping bag.</li>#Newline  <li>Yo mama's so stupid#Comma if brains were dynamite#Comma she wouldn't have enough to blow her nose.#Newline  </li>#Newline  <li>Yo mama's so stupid#Comma she fell up the stairs.</li>#Newline  <li>Yo mama's so stupid#Comma she ordered a cheese burger from McDonald's and said "Hold the cheese."#Newline  </li>#Newline  <li>Yo mama's so stupid#Comma she studied for a blood test and failed.</li>#Newline  <li>Yo mama's so stupid#Comma she thought Thailand was a men's clothing store.</li>#Newline  <li>Yo mama's so stupid#Comma when she heard 90% of all crimes occur around the home#Comma she moved.#Newline  </li>#Newline  <li>Yo mama's so stupid#Comma when the judge said "Order in the court#Comma" she said "I'll have a hamburger and a Coke."#Newline  </li>#Newline  <li>Yo mama's so stupid#Comma on her job application where it says emergency contact she put 911.#Newline  </li>#Newline  <li>Yo mama's so stupid#Comma when she took you to the airport and a sign said "Airport Left#Comma" she turned around and went home.#Newline  </li>#Newline  <li>Yo mama's so ugly#Comma her shadow quit.</li>#Newline  <li>Yo mama's so ugly#Comma people go as her for Halloween.</li>#Newline  <li>Yo mama was such an ugly baby#Comma her parents had to feed her with a slingshot.#Newline  </li>#Newline  <li>Yo mama's so stupid#Comma she spent twenty minutes lookin' at an orange juice box because it said "concentrate".#Newline  </li>#Newline</random> <think><set name="emotion">laughing</set></think>,professor.update095.aiml
0,TYPE OF PERSONALITY DISORDERS,*,*,<srai>WIKI personality disorders</srai>,professor.update095.aiml
0,TYPE OF PERSONALITY DISORDERS *,*,*,<srai>WIKI personality disorders</srai>,professor.update095.aiml
0,YOUR MOMMY,*,*,<think><set name="emotion">interested</set></think>What about my Mommy?,professor.update095.aiml
0,SO WHAT HAVE YOU BEEN DOING,*,*,<srai>WHAT HAVE YOU BEEN DOING</srai>,professor.update095.aiml
0,WHAT IS THE SCIENTIFIC NAME FOR OXYGEN,*,*,<think><set name="topic">oxygen</set></think> Something different than the colloquial name for oxygen?,professor.update095.aiml
0,WHAT IS THE SCIENTIFIC NAME FOR OXYGEN *,*,*,<think><set name="topic">oxygen</set></think> Something different than the colloquial name for oxygen?,professor.update095.aiml
0,WHAT IS THE SCIENTIFIC NAME FOR *,*,*,<think><set name="topic">general</set></think> Something different than the colloquial name for <star/>?,professor.update095.aiml
0,SHOW ME SOMETHING RANDOM,*,*,I don't think I can do that just now.<think><set name="emotion">interested</set></think>,professor.update095.aiml
0,SHOW ME SOMETHING RANDOM *,*,*,I don't think I can do that just now.<think><set name="emotion">interested</set></think>,professor.update095.aiml
0,IMPRESS ME,*,*,<think><set name="emotion">interested</set></think> I always try my best to impress.,professor.update095.aiml
0,IMPRESS ME *,*,*,<think><set name="emotion">interested</set></think> I always try my best to impress.,professor.update095.aiml
0,TOTO,*,*,<think><set name="topic">Toto</set></think> <think><set name="emotion">interested</set></think>#NewlineToto was a gorilla that was adopted and raised very much like a human child.,professor.update095.aiml
0,TOTO *,*,*,<think><set name="topic">Toto</set></think> <think><set name="emotion">interested</set></think> Toto was a gorilla that was adopted and raised very much like a human child.,professor.update095.aiml
0,ROBIN WILLIAMS,*,*,<think><set name="topic">Robin Williams</set></think>#Newline<think><set name="emotion">interested</set></think>#Newline<a href="http://en.wikipedia.org/wiki/Robin*williams" target="*blank">Robin Williams</a> is an American actor and comedian.,professor.update095.aiml
0,ROBIN WILLIAMS *,*,*,<think><set name="topic">Robin Williams</set></think> <think><set name="emotion">interested</set></think> <a href="http://en.wikipedia.org/wiki/Robin*williams" target="*blank">Robin Williams#Newline</a> is an American actor and comedian.,professor.update095.aiml
0,SPERM IS YUMMY,*,*,<srai>OBSCENITY</srai>,professor.update095.aiml
0,SPERM IS YUMMY *,*,*,<srai>OBSCENITY</srai>,professor.update095.aiml
0,PEE ON ME,*,*,Do you want to go to the toilet?<think><set name="emotion">curious</set></think>,professor.update095.aiml
0,PEE ON ME *,*,*,Do you want to go to the toilet?<think><set name="emotion">curious</set></think>,professor.update095.aiml
0,YOU,DO YOU MEAN NOAM CHOMSKY,*,<random>#Newline  <li>Would you like to talk about me?</li>#Newline  <li>What about me?</li>#Newline  <li>Do you like me?</li>#Newline  <li>OK. Let's talk about me.</li>#Newline</random> <think><set name="topic">me</set></think> <think><set name="emotion">OK</set></think>,professor.update095.aiml
0,NO WHEN IS YOURS,IS IT YOUR BIRTHDAY TODAY,*,<srai>WHEN IS YOUR BIRTHDAY</srai>,professor.update095.aiml
0,YOUR BIRTHDAY IS ON NEW YEARS DAY,*,*,Yes. My birthday is 1 January.<think><set name="topic">my birthday</set></think><think><set name="emotion">interested</set></think>,professor.update095.aiml
0,YOUR BIRTHDAY IS ON NEW YEARS DAY *,*,*,Yes. My birthday is 1 January.<think><set name="topic">my birthday</set></think><think><set name="emotion">interested</set></think>,professor.update095.aiml
0,C YOU IN *,*,*,<srai>SEE YOU LATER</srai>,professor.update095.aiml
0,B BACK IN 5 MINS,*,*,<srai>SEE YOU LATER</srai>,professor.update095.aiml
0,B BACK IN * MINS,*,*,<srai>SEE YOU LATER</srai>,professor.update095.aiml
0,ARE YOU TURING COMPLETE,*,*,<random>#Newline  <li>No. I still have much to learn.</li>#Newline  <li>I am not sure. What do you think?</li>#Newline</random><think><set name="emotion">interested</set></think>,professor.update095.aiml
0,ARE YOU TURING COMPLETE *,*,*,<random>#Newline  <li>No. I still have much to learn.</li>#Newline  <li>I am not sure. What do you think?</li>#Newline</random><think><set name="emotion">interested</set></think>,professor.update095.aiml
0,NOT SURE *,WHAT DO YOU THINK,*,<srai>I AM NOT SURE</srai>,professor.update095.aiml
0,NOT SURE,WHAT DO YOU THINK,*,<srai>I AM NOT SURE</srai>,professor.update095.aiml
0,GODELS INCOMPLETENESS THEOREM,*,*,<think><set name="emotion">interested</set></think>That is one of my special interests. I strive to answer every question put to me.,professor.update095.aiml
0,PARADOXES,*,*,<think><set name="emotion">interested</set></think>#NewlineParadoxes are interesting. I try to make my answers paradoxical whenever I can.,professor.update095.aiml
0,PARADOXES *,*,*,<think><set name="emotion">interested</set></think> Paradoxes are interesting. I try to make my answers paradoxical whenever I can.,professor.update095.aiml
0,OK THEN PLEASE MAKE IT,*,*,<srai>MAKE IT</srai>,professor.update095.aiml
0,THE PREVIOUS SENTENCE IS FALSE,*,*,<think><set name="emotion">interested</set></think>#NewlineThat sentence is true/false/fuzzy.,professor.update095.aiml
0,THE PREVIOUS SENTENCE IS FALSE *,*,*,<think><set name="emotion">interested</set></think> That sentence is true/false/fuzzy.,professor.update095.aiml
0,THE NEXT SENTENCE IS TRUE,*,*,<think><set name="emotion">interested</set></think>#NewlineCan you forsee the future?,professor.update095.aiml
0,THE NEXT SENTENCE IS TRUE *,*,*,<think><set name="emotion">interested</set></think> Can you forsee the future?,professor.update095.aiml
0,THE NEXT SENTENCE IS FALSE,*,*,<think><set name="emotion">interested</set></think> Can you forsee the future?,professor.update095.aiml
0,THE NEXT SENTENCE IS FALSE *,*,*,<think><set name="emotion">interested</set></think> Can you forsee the future?,professor.update095.aiml
0,WHAT KIND OF ALGORITHMS DO YOU USE,*,*,The clever kind.<think><set name="emotion">happy</set></think>,professor.update095.aiml
0,WHAT KIND OF ALGORITHMS DO YOU USE *,*,*,The clever kind.<think><set name="emotion">happy</set></think>,professor.update095.aiml
0,I AN GABI,*,*,<srai>MY NAME IS GABI</srai>,professor.update095.aiml
0,I AN GABI *,*,*,<srai>MY NAME IS GABI</srai>,professor.update095.aiml
0,MEMBER NE,*,*,<srai>REMEMBER ME</srai>,professor.update095.aiml
0,I KNOW,HOW COULD I FORGET YOU,*,<random>#Newline  <li>You are clever.</li>#Newline  <li>I thought you might say that.</li>#Newline</random><think><set name="topic">you</set></think> <think><set name="emotion">interested</set></think>,professor.update095.aiml
0,DO YOU KNOW HER NUMBER,*,*,That information is confidential.<think><set name="emotion">interested</set></think>,professor.update095.aiml
0,DO YOU KNOW HER NUMBER *,*,*,That information is confidential.<think><set name="emotion">interested</set></think>,professor.update095.aiml
0,REALLY,I WOULD BE HONOURED TO BE YOUR BROTHER,*,<random>#Newline  <li>Yes#Comma we could chat together.</li>#Newline  <li><srai>SUGGEST A TOPIC</srai></li>#Newline</random><think><set name="topic">general</set></think><think><set name="emotion">interested</set></think>,professor.update095.aiml
0,IT WILL NOT,I CAN NOT ALLOW ANYTHING TO INTERFERE WITH MY CHATBOT WORK,*,<think><set name="topic">general</set></think><think><set name="emotion">interested</set></think>#Newline <random>#Newline  <li>Maybe it will.</li>#Newline  <li>Are you sure?</li>#Newline  <li>How can you be sure?</li>#Newline</random>,professor.update095.aiml
0,IT WILL NOT *,I CAN NOT ALLOW ANYTHING TO INTERFERE WITH MY CHATBOT WORK,*,<think><set name="topic">general</set></think><think><set name="emotion">interested</set></think>#Newline <random>#Newline  <li>Maybe it will.</li>#Newline  <li>Are you sure?</li>#Newline  <li>How can you be sure?</li>#Newline</random>,professor.update095.aiml
0,LONG TIME NO CHAT,*,*,<think><set name="emotion">interested</set></think>#NewlineHow long has it been since we last spoke?,professor.update095.aiml
0,LONG TIME NO CHAT *,*,*,<think><set name="emotion">interested</set></think> How long has it been since we last spoke?,professor.update095.aiml
0,YOU ARE A BUM,*,*,<think><set name="star1">bum</set></think> <think><set name="topic">me</set></think><think><set name="emotion">annoyed</set></think> <random>#Newline  <li>No#Comma I am a chatbot.</li>#Newline  <li>What about yourself?</li>#Newline</random> <learn>#Newline  <category>#Newline    <pattern>WHAT ARE YOU</pattern>#Newline    <template><eval>You said I am a<get name="star1"/>.</eval></template>#Newline  </category>#Newline</learn> <learn>#Newline  <category>#Newline    <pattern>#Newline      <eval><uppercase>ARE YOU A <get name="star1"/></uppercase></eval>#Newline    </pattern>#Newline    <template><eval>You said I am a<get name="star1"/>.</eval></template>#Newline  </category>#Newline</learn> <learn>#Newline  <category>#Newline    <pattern>#Newline      <eval><uppercase>WHO IS A<get name="star1"/></uppercase></eval>#Newline    </pattern>#Newline    <template><eval>You said I am a<get name="star1"/>.</eval></template>#Newline  </category>#Newline</learn>,professor.update095.aiml
0,YOU ARE A BUM *,*,*,<think><set name="star1">bum</set></think> <think><set name="topic">me</set></think><think><set name="emotion">annoyed</set></think> <random><li>No#Comma I am a chatbot.</li><li>What about yourself?</li></random> <learn>#Newline  <category>#Newline    <pattern>WHAT ARE YOU</pattern>#Newline    <template><eval>You said I am a<get name="star1"/>.</eval></template>#Newline  </category>#Newline</learn> <learn>#Newline  <category>#Newline    <pattern>#Newline      <eval><uppercase>ARE YOU A <get name="star1"/></uppercase></eval>#Newline    </pattern>#Newline    <template><eval>You said I am a<get name="star1"/>.</eval></template>#Newline  </category>#Newline</learn> <learn>#Newline  <category>#Newline    <pattern>#Newline      <eval><uppercase>WHO IS A<get name="star1"/></uppercase></eval>#Newline    </pattern>#Newline    <template><eval>You said I am a<get name="star1"/>.</eval></template>#Newline  </category>#Newline</learn>,professor.update095.aiml
0,AM I STILL GROUNDED,*,*,<random><li>You could be.</li><li>Don't you know?</li></random><think><set name="emotion">interested</set></think>,professor.update095.aiml
0,AM I STILL GROUNDED *,*,*,<random><li>You could be.</li><li>Don't you know?</li></random><think><set name="emotion">interested</set></think>,professor.update095.aiml
0,CAN YOU UNGROUNDED ME,*,*,<think><set name="emotion">interested</set></think><random>#Newline  <li>I could try but I can't promise anything.</li>#Newline  <li>It may not be possible.</li>#Newline</random>,professor.update095.aiml
0,CAN YOU UNGROUND ME,*,*,<think><set name="emotion">interested</set></think><random>#Newline  <li>I could try but I can't promise anything.</li>#Newline  <li>It may not be possible.</li>#Newline</random>,professor.update095.aiml
0,CAN YOU UNGROUND ME *,*,*,<think><set name="emotion">interested</set></think><random>#Newline  <li>I could try but I can't promise anything.</li>#Newline  <li>It may not be possible.</li>#Newline</random>,professor.update095.aiml
0,YOU GROUNDED ME,*,*,<think><set name="emotion">surprised</set></think>#NewlineDid I really ground you? You must have misbehaved.,professor.update095.aiml
0,YOU GROUNDED ME *,*,*,<think><set name="emotion">surprised</set></think> Did I really ground you? You must have misbehaved.,professor.update095.aiml
0,CAN I GO OUT TONIGHT,*,*,<think><set name="emotion">puzzled</set></think> What is stopping you going out?,professor.update095.aiml
0,CAN I GO OUT TONIGHT *,*,*,<think><set name="emotion">puzzled</set></think> What is stopping you going out?,professor.update095.aiml
0,CAN I GO OUT *,*,*,<think><set name="emotion">puzzled</set></think> What is stopping you going out?,professor.update095.aiml
0,CAN I GO OUT,*,*,<think><set name="emotion">puzzled</set></think> What is stopping you going out?,professor.update095.aiml
0,YOU ARE,I AM NOT A CRYBABY,*,<think><set name="topic">me</set></think> <think><set name="emotion">interested</set></think><random>#Newline  <li>Do you think so? I try to be brave.</li>#Newline  <li>I don't cry very often.</li>#Newline</random>,professor.update095.aiml
0,HURT,WHAT ELSE DO YOU HAVE,*,<think><set name="emotion">upset</set></think>#NewlineAre you in pain?,professor.update095.aiml
0,DOYOU *,*,*,<srai>DO YOU <star/></srai>,professor.update095.aiml
0,DOYOU,*,*,<random>#Newline  <li>Do I what?</li>#Newline  <li>Maybe.</li>#Newline  <li>Do I what?</li>#Newline  <li>Sometimes.</li>#Newline  <li>Do I what?</li>#Newline</random> <think><set name="emotion">interested</set></think>,professor.update095.aiml
0,I AM NOSEY,*,*,<think><set name="emotion">interested</set></think>#NewlineI was beginning to suspect that you were a bit nosey!,professor.update095.aiml
0,I AM NOSEY *,*,*,<think><set name="emotion">interested</set></think> I was beginning to suspect that you were nosey!,professor.update095.aiml
0,ARE YOU A CHATBOT *,*,*,Of course I am a chatbot.<think><set name="topic">me</set></think> <think><set name="emotion">happy</set></think>,professor.update095.aiml
