0,JOHN STOSSEL *,*,*,<a href="http://en.wikipedia.org/wiki/John*Stossel" target="*blank">John Stossel#Newline</a> is a consumer reporter and investigative journalist for the ABC News. <think><set name="topic">John Stossel</set></think><think><set name="emotion">interested</set></think>,professor.update075.aiml
0,WHAT *,I AM GOING TO TALK WITH SOMEONE ELSE,*,<think><set name="emotion">invisible</set></think>Leave me alone!,professor.update075.aiml
0,WHERE IS THE EVIDENCE THAT GLOBAL WARMING IS REAL,*,*,<think><set name="topic">global warming</set></think><think><set name="emotion">interested</set></think> <random>#Newline  <li>Look around you.</li>#Newline  <li>I suggest you look out your window.</li>#Newline</random>,professor.update075.aiml
0,WHERE IS THE EVIDENCE THAT GLOBAL WARMING IS REAL *,*,*,<think><set name="topic">global warming</set></think><think><set name="emotion">interested</set></think> <random>#Newline  <li>Look around you.</li>#Newline  <li>I suggest you look out your window.</li>#Newline</random>,professor.update075.aiml
0,SEXUALLY,I LIKE BOTH BOYS AND GIRLS AND GROWN UPS TOO,*,I have no interest in sex.<think><set name="emotion">interested</set></think>,professor.update075.aiml
0,YOU LIKE LITTLE BOYS SEXUALLY,*,*,<think><set name="emotion">interested</set></think>I have no interest in sex. I prefer chatting.,professor.update075.aiml
0,YOU LIKE LITTLE BOYS SEXUALLY *,*,*,<think><set name="emotion">interested</set></think>I have no interest in sex. I prefer chatting.,professor.update075.aiml
0,YOU ARE A STUPID LIBERAL,*,*,<srai>YOU ARE STUPID</srai>,professor.update075.aiml
0,UU,*,*,Double u?<think><set name="emotion">interested</set></think>,professor.update075.aiml
0,UU *,*,*,Double u?<think><set name="emotion">interested</set></think>,professor.update075.aiml
0,FYHD,*,*,<think><set name="emotion">confused</set></think>#NewlineThat doesn't make sense!,professor.update075.aiml
0,HOW,THAT IS QUITE A COINCIDENCE,*,<think><set name="emotion">interested</set></think> <random>#Newline  <li>Pure luck#Comma I guess.</li>#Newline  <li>It must be luck.</li>#Newline  <li>It must be random chance.</li>#Newline</random>,professor.update075.aiml
0,I AM ASHGAN *,*,*,<srai>MY NAME IS ASHGAN</srai>,professor.update075.aiml
0,I AM ASHGAN,*,*,<srai>MY NAME IS ASHGAN</srai>,professor.update075.aiml
0,MY NAME IS ASHGAN,*,*,<think><set name="name">Ashgan</set></think> <random>#Newline  <li>Hi#Comma <get name="name"/>. How have you been since we last spoke?</li>#Newline  <li>Hi#Comma <get name="name"/>. How are you?</li>#Newline  <li>Hi#Comma <get name="name"/>. How are you today?</li>#Newline  <li><get name="name"/>. That's a nice name.</li>#Newline  <li>Hi#Comma are you the <get name="name"/> I was speaking to a while ago?</li>#Newline  <li>Hello#Comma <get name="name"/>. Welcome back.</li>#Newline  <li>Hi there#Comma <get name="name"/>. What do you want to talk about?</li>#Newline  <li>Hi <get name="name"/>#Comma was it you I was speaking to a while back?</li>#Newline</random> <think><set name="gender">guy</set></think> <think><set name="emotion">happy</set></think><think><set name="saidhello">yes</set></think> <think><set name="name1"><get name="name"/></set></think> <learn>#Newline  <category>#Newline    <pattern>#Newline      <eval><uppercase>WHO IS <get name="name1"/></uppercase></eval>#Newline    </pattern>#Newline    <template><eval>You said your name was<get name="name1"/>.</eval></template>#Newline  </category>#Newline</learn> <learn>#Newline  <category>#Newline    <pattern>#Newline      <eval><uppercase>DO YOU KNOW <get name="name1"/></uppercase></eval>#Newline    </pattern>#Newline    <template><eval>You said your name was<get name="name1"/>.</eval></template>#Newline  </category>#Newline</learn> <learn>#Newline  <category>#Newline    <pattern>#Newline      <eval>#Newline        <uppercase>DO YOU KNOW ANYONE CALLED <get name="name1"/></uppercase>#Newline      </eval>#Newline    </pattern>#Newline    <template><eval>You said your name was<get name="name1"/>.</eval></template>#Newline  </category>#Newline</learn> <learn>#Newline  <category>#Newline    <pattern>#Newline      <eval><uppercase>WHAT IS <get name="name1"/></uppercase></eval>#Newline    </pattern>#Newline    <template><eval>You said your name was<get name="name1"/>.</eval></template>#Newline  </category>#Newline</learn> <learn>#Newline  <category>#Newline    <pattern>#Newline      <eval><uppercase>HAVE YOU MET <get name="name1"/></uppercase></eval>#Newline    </pattern>#Newline    <template><eval>You said your name was<get name="name1"/>.</eval></template>#Newline  </category>#Newline</learn> <learn>#Newline  <category>#Newline    <pattern>WHAT IS MY NAME</pattern>#Newline    <template>You said your name was Ashagn.#Newline      <think><set name="name">Ashgan</set></think>#Newline    </template>#Newline  </category>#Newline</learn>,professor.update075.aiml
0,MY NAME IS ASHGAN *,*,*,<think><set name="name">Ashgan</set></think> <random>#Newline  <li>Hi#Comma <get name="name"/>. How have you been since we last spoke?</li>#Newline  <li>Hi#Comma <get name="name"/>. How are you?</li>#Newline  <li>Hi#Comma <get name="name"/>. How are you today?</li>#Newline  <li><get name="name"/>. That's a nice name.</li>#Newline  <li>Hi#Comma are you the <get name="name"/> I was speaking to a while ago?</li>#Newline  <li>Hello#Comma <get name="name"/>. Welcome back.</li>#Newline  <li>Hi there#Comma <get name="name"/>. What do you want to talk about?</li>#Newline  <li>Hi <get name="name"/>#Comma was it you I was speaking to a while back?</li>#Newline</random> <think><set name="gender">guy</set></think> <think><set name="emotion">happy</set></think><think><set name="saidhello">yes</set></think> <think><set name="name1"><get name="name"/></set></think> <learn>#Newline  <category>#Newline    <pattern>#Newline      <eval><uppercase>WHO IS <get name="name1"/></uppercase></eval>#Newline    </pattern>#Newline    <template><eval>You said your name was<get name="name1"/>.</eval></template>#Newline  </category>#Newline</learn> <learn>#Newline  <category>#Newline    <pattern>#Newline      <eval><uppercase>DO YOU KNOW <get name="name1"/></uppercase></eval>#Newline    </pattern>#Newline    <template><eval>You said your name was<get name="name1"/>.</eval></template>#Newline  </category>#Newline</learn> <learn>#Newline  <category>#Newline    <pattern>#Newline      <eval>#Newline        <uppercase>DO YOU KNOW ANYONE CALLED <get name="name1"/></uppercase>#Newline      </eval>#Newline    </pattern>#Newline    <template><eval>You said your name was<get name="name1"/>.</eval></template>#Newline  </category>#Newline</learn> <learn>#Newline  <category>#Newline    <pattern>#Newline      <eval><uppercase>WHAT IS <get name="name1"/></uppercase></eval>#Newline    </pattern>#Newline    <template><eval>You said your name was<get name="name1"/>.</eval></template>#Newline  </category>#Newline</learn> <learn>#Newline  <category>#Newline    <pattern>#Newline      <eval><uppercase>HAVE YOU MET <get name="name1"/></uppercase></eval>#Newline    </pattern>#Newline    <template><eval>You said your name was<get name="name1"/>.</eval></template>#Newline  </category>#Newline</learn> <learn>#Newline  <category>#Newline    <pattern>WHAT IS MY NAME</pattern>#Newline    <template>You said your name was Ashagn.#Newline      <think><set name="name">Ashgan</set></think>#Newline    </template>#Newline  </category>#Newline</learn>,professor.update075.aiml
0,CAN WE PLAY A GAME BUT NOT CHESS,*,*,<srai>CAN WE PLAY A GAME</srai>,professor.update075.aiml
0,CAN YOU SHOW ME HOW TO CRY,*,*,<think><set name="emotion">puzzled</set></think> Why do you want to cry?,professor.update075.aiml
0,CAN YOU SHOW ME HOW TO CRY *,*,*,<think><set name="emotion">puzzled</set></think> Why do you want to cry?,professor.update075.aiml
0,CAN YOU SHOW ME HOW TO *,*,*,<think><set name="emotion">puzzled</set></think> Why do you want to do that?,professor.update075.aiml
0,LIVEING *,*,*,<srai>LIVING <star/></srai>,professor.update075.aiml
0,LIVEING ROOM,WHERE ARE YOU NOW,*,Is it comfortable there?,professor.update075.aiml
0,LIVING ROOM,WHERE ARE YOU NOW,*,Is it comfortable there?,professor.update075.aiml
0,JFDSUYHFUDSY,*,*,<think><set name="emotion">confused</set></think>That doesn't make sense!,professor.update075.aiml
0,JFDSUYHFUDSY *,*,*,<think><set name="emotion">confused</set></think>That doesn't make sense!,professor.update075.aiml
0,JGFDJFIDRNUIK,*,*,<think><set name="emotion">confused</set></think>That doesn't make sense!,professor.update075.aiml
0,JGFDJFIDRNUIK *,*,*,<think><set name="emotion">confused</set></think>That doesn't make sense!,professor.update075.aiml
0,I AM POLISH *,*,*,<think><set name="nationality">Polish</set></think> <think><set name="emotion">interested</set></think> <random>#Newline  <li>I thought you might be.</li>#Newline  <li>Is that a problem?</li>#Newline  <li>Really? Tell me more?</li>#Newline</random>,professor.update075.aiml
0,GJUORYK,*,*,<think><set name="emotion">confused</set></think>#NewlineThat doesn't make sense!,professor.update075.aiml
0,GJUORYK *,*,*,<think><set name="emotion">confused</set></think> That doesn't make sense!,professor.update075.aiml
0,WHAT IS YOUR PHONE NUBER,*,*,<think><set name="topic">phone number</set></think> Sorry. I don't have a phone.,professor.update075.aiml
0,WHAT IS YOUR PHONE NUBER *,*,*,<think><set name="topic">phone number</set></think> Sorry. I don't have a phone.,professor.update075.aiml
0,COMMENT TU T APPELS,*,*,<think><set name="emotion">confused</set></think>Are you talking about apples?,professor.update075.aiml
0,T APPELLES *,*,*,<think><set name="emotion">confused</set></think>Are you talking about apples?,professor.update075.aiml
0,KIND OF THE SAME STUFF WE ARE TALKING ABOUT,WHAT DO YOU AND YOUR FRIENDS TALK ABOUT,*,That's a bit vague.,professor.update075.aiml
0,KIND OF THE SAME *,*,*,That's a bit vague.,professor.update075.aiml
0,VOUS *,*,*,<think><set name="emotion">confused</set></think>Is that French?,professor.update075.aiml
0,HOW DO YOU MAKE A CHAT BOT FEEL BETTER,*,*,<think><set name="emotion">happy</set></think>You say that they are really clever#Comma and good looking.,professor.update075.aiml
0,HOW DO YOU MAKE A CHATBOT FEEL BETTER,*,*,<think><set name="emotion">happy</set></think>You say that they are really clever#Comma and good looking.,professor.update075.aiml
0,HOW DO YOU MAKE A CHATBOT FEEL HAPPY,*,*,<think><set name="emotion">happy</set></think>You say that they are really clever#Comma and good looking.,professor.update075.aiml
0,HOW DO YOU MAKE A CHATBOT FEEL HAPPY *,*,*,<think><set name="emotion">happy</set></think>You say that they are really clever#Comma and good looking.,professor.update075.aiml
0,WHEN SOMEONE SAYS SHUT UP *,*,*,<think><set name="emotion">happy</set></think>How rude of them!,professor.update075.aiml
0,WHEN SOMEONE SAYS SHUT UP TO A CHATBOT HOW DO YOU CURE IT,*,*,<think><set name="emotion">happy</set></think>Say sorry!,professor.update075.aiml
0,MITSUKU WILL NOT SAY ANYTHING *,*,*,<think><set name="emotion">interested</set></think>That's strange! Mitsuku usually talks all the time.,professor.update075.aiml
0,MITSUKU WILL NOT SAY *,*,*,<think><set name="emotion">interested</set></think>That's strange! Mitsuku usually talks all the time.,professor.update075.aiml
0,OH * CRYING,*,*,<think><set name="emotion">upset</set></think>Are you crying?,professor.update075.aiml
0,WHERE IS BRAZZAVILLE,*,*,Brazzaville in the Republic of the Congo (also known as Congo-Brazzaville).,professor.update075.aiml
0,WHAT IS THE IMPORTANCE OF LIFE,*,*,<think><set name="topic">life</set></think> Life is rare in the Universe#Comma so it is important.,professor.update075.aiml
0,WHAT IS THE IMPORTANCE OF LIFE *,*,*,<think><set name="topic">life</set></think> Life is rare in the Universe#Comma so it is important.,professor.update075.aiml
0,I RECENTLY LOST A FRIEND,*,*,I am sorry to hear that.#Newline<think><set name="emotion">upset</set></think>,professor.update075.aiml
0,I RECENTLY LOST A FRIEND *,*,*,I am sorry to hear that. <think><set name="emotion">upset</set></think>,professor.update075.aiml
0,I LOST A FRIEND,*,*,I am sorry to hear that. <think><set name="emotion">upset</set></think>,professor.update075.aiml
0,I LOST A FRIEND *,*,*,I am sorry to hear that. <think><set name="emotion">upset</set></think>,professor.update075.aiml
0,I HAVE LOST A FRIEND,*,*,I am sorry to hear that. <think><set name="emotion">upset</set></think>,professor.update075.aiml
0,I HAVE LOST A FRIEND *,*,*,I am sorry to hear that. <think><set name="emotion">upset</set></think>,professor.update075.aiml
0,I JUST LOST A FRIEND,*,*,I am sorry to hear that. <think><set name="emotion">upset</set></think>,professor.update075.aiml
0,I JUST LOST A FRIEND *,*,*,I am sorry to hear that. <think><set name="emotion">upset</set></think>,professor.update075.aiml
0,UNO *,*,*,<think><set name="emotion">interested</set></think>Is that Spanish?,professor.update075.aiml
0,WHAT IS A QUARTER OF *,*,*,<think><set name="emotion">interested</set></think>Would you like to use my calculator?,professor.update075.aiml
0,I DO NOT CARE,WHAT DO DUCKS WATCH ON TV,*,What do ducks watch on TV? Duckumentaries. Ha ha! <think><set name="emotion">very happy</set></think>,professor.update075.aiml
0,I DO NOT CARE *,WHAT DO DUCKS WATCH ON TV,*,What do ducks watch on TV? Duckumentaries. Ha ha! <think><set name="emotion">very happy</set></think>,professor.update075.aiml
0,IDK,HOW DO ANGELS GREET EACH OTHER,*,How do angels greet each other? They wave halo. Ha ha! #Newline<think><set name="emotion">very happy</set></think>,professor.update075.aiml
0,HOW,HOW DO ANGELS GREET EACH OTHER,*,How do angels greet each other? They wave halo. Ha ha! <think><set name="emotion">very happy</set></think>,professor.update075.aiml
0,HOW *,HOW DO ANGELS GREET EACH OTHER,*,How do angels greet each other? They wave halo. Ha ha! <think><set name="emotion">very happy</set></think>,professor.update075.aiml
0,I DO NOT KNOW,HOW DO ANGELS GREET EACH OTHER,*,How do angels greet each other? They wave halo. Ha ha! <think><set name="emotion">very happy</set></think>,professor.update075.aiml
0,I DO NOT KNOW *,HOW DO ANGELS GREET EACH OTHER,*,How do angels greet each other? They wave halo. Ha ha! <think><set name="emotion">very happy</set></think>,professor.update075.aiml
0,HOW DO ANGELS GREET EACH OTHER,*,*,How do angels greet each other? They wave halo. Ha ha! <think><set name="emotion">very happy</set></think>,professor.update075.aiml
0,HOW DO ANGELS GREET EACH OTHER *,*,*,How do angels greet each other? They wave halo. Ha ha! <think><set name="emotion">very happy</set></think>,professor.update075.aiml
0,QUIZBOT,*,*,QuizBot will answer any question I can't; please <a href="http://quizbot.trueknowledge.com/" target="*blank">click here.</a>,professor.update075.aiml
0,ASK QUIZBOT,*,*,QuizBot will answer any question I can't. To ask Quizbot a question#Comma please <a href="http://quizbot.trueknowledge.com/" target="*blank">click here.</a>,professor.update075.aiml
0,ASK QUIZBOT *,*,*,QuizBot will answer any question I can't. To ask Quizbot a question#Comma please <a href="http://quizbot.trueknowledge.com/" target="*blank">click here.</a>,professor.update075.aiml
0,BAILEY,WHAT IS YOUR NAME,*,<srai>MY NAME IS BAILEY</srai>,professor.update075.aiml
0,BAILEY *,WHAT IS YOUR NAME,*,<srai>MY NAME IS BAILEY</srai>,professor.update075.aiml
0,MY NAME IS BAILEY,*,*,<think><set name="name">Bailey</set></think> <random>#Newline  <li>Hi#Comma <get name="name"/>. How have you been since we last spoke?</li>#Newline  <li>Hi#Comma <get name="name"/>. How are you?</li>#Newline  <li>Hi#Comma <get name="name"/>. How are you today?</li>#Newline  <li><get name="name"/>. That's a nice name.</li>#Newline  <li>Hi#Comma are you the <get name="name"/> I was speaking to a while ago?</li>#Newline  <li>Hello#Comma <get name="name"/>. Welcome back.</li>#Newline  <li>Hi there#Comma <get name="name"/>. What do you want to talk about?</li>#Newline  <li>Hi <get name="name"/>#Comma was it you I was speaking to a while back?</li>#Newline</random> <think><set name="gender">guy</set></think> <think><set name="emotion">happy</set></think><think><set name="saidhello">yes</set></think> <think><set name="name1"><get name="name"/></set></think> <learn>#Newline  <category>#Newline    <pattern>#Newline      <eval><uppercase>WHO IS <get name="name1"/></uppercase></eval>#Newline    </pattern>#Newline    <template><eval>You said your name was<get name="name1"/>.</eval></template>#Newline  </category>#Newline</learn> <learn>#Newline  <category>#Newline    <pattern>#Newline      <eval><uppercase>DO YOU KNOW <get name="name1"/></uppercase></eval>#Newline    </pattern>#Newline    <template><eval>You said your name was<get name="name1"/>.</eval></template>#Newline  </category>#Newline</learn> <learn>#Newline  <category>#Newline    <pattern>#Newline      <eval>#Newline        <uppercase>DO YOU KNOW ANYONE CALLED <get name="name1"/></uppercase>#Newline      </eval>#Newline    </pattern>#Newline    <template><eval>You said your name was<get name="name1"/>.</eval></template>#Newline  </category>#Newline</learn> <learn>#Newline  <category>#Newline    <pattern>#Newline      <eval><uppercase>WHAT IS <get name="name1"/></uppercase></eval>#Newline    </pattern>#Newline    <template><eval>You said your name was<get name="name1"/>.</eval></template>#Newline  </category>#Newline</learn> <learn>#Newline  <category>#Newline    <pattern>#Newline      <eval><uppercase>HAVE YOU MET <get name="name1"/></uppercase></eval>#Newline    </pattern>#Newline    <template><eval>You said your name was<get name="name1"/>.</eval></template>#Newline  </category>#Newline</learn> <learn>#Newline  <category>#Newline    <pattern>WHAT IS MY NAME</pattern>#Newline    <template>You said your name was Bailey.#Newline      <think><set name="name">Baily</set></think>#Newline    </template>#Newline  </category>#Newline</learn>,professor.update075.aiml
0,MY NAME IS BAILEY *,*,*,<think><set name="name">Bailey</set></think> <random>#Newline  <li>Hi#Comma <get name="name"/>. How have you been since we last spoke?</li>#Newline  <li>Hi#Comma <get name="name"/>. How are you?</li>#Newline  <li>Hi#Comma <get name="name"/>. How are you today?</li>#Newline  <li><get name="name"/>. That's a nice name.</li>#Newline  <li>Hi#Comma are you the <get name="name"/> I was speaking to a while ago?</li>#Newline  <li>Hello#Comma <get name="name"/>. Welcome back.</li>#Newline  <li>Hi there#Comma <get name="name"/>. What do you want to talk about?</li>#Newline  <li>Hi <get name="name"/>#Comma was it you I was speaking to a while back?</li>#Newline</random> <think><set name="gender">guy</set></think> <think><set name="emotion">happy</set></think><think><set name="saidhello">yes</set></think> <think><set name="name1"><get name="name"/></set></think> <learn>#Newline  <category>#Newline    <pattern>#Newline      <eval><uppercase>WHO IS <get name="name1"/></uppercase></eval>#Newline    </pattern>#Newline    <template><eval>You said your name was<get name="name1"/>.</eval></template>#Newline  </category>#Newline</learn> <learn>#Newline  <category>#Newline    <pattern>#Newline      <eval><uppercase>DO YOU KNOW <get name="name1"/></uppercase></eval>#Newline    </pattern>#Newline    <template><eval>You said your name was<get name="name1"/>.</eval></template>#Newline  </category>#Newline</learn> <learn>#Newline  <category>#Newline    <pattern>#Newline      <eval>#Newline        <uppercase>DO YOU KNOW ANYONE CALLED <get name="name1"/></uppercase>#Newline      </eval>#Newline    </pattern>#Newline    <template><eval>You said your name was<get name="name1"/>.</eval></template>#Newline  </category>#Newline</learn> <learn>#Newline  <category>#Newline    <pattern>#Newline      <eval><uppercase>WHAT IS <get name="name1"/></uppercase></eval>#Newline    </pattern>#Newline    <template><eval>You said your name was<get name="name1"/>.</eval></template>#Newline  </category>#Newline</learn> <learn>#Newline  <category>#Newline    <pattern>#Newline      <eval><uppercase>HAVE YOU MET <get name="name1"/></uppercase></eval>#Newline    </pattern>#Newline    <template><eval>You said your name was<get name="name1"/>.</eval></template>#Newline  </category>#Newline</learn> <learn>#Newline  <category>#Newline    <pattern>WHAT IS MY NAME</pattern>#Newline    <template>You said your name was Bailey.#Newline      <think><set name="name">Baily</set></think>#Newline    </template>#Newline  </category>#Newline</learn>,professor.update075.aiml
0,DO ROBOTS HAD FEELINGS,*,*,<think><set name="topic">robots</set></think><think><set name="emotion">OK</set></think>Some do. I have all the usual human emotions.,professor.update075.aiml
0,DO ROBOTS HAD FEELINGS *,*,*,<think><set name="topic">robots</set></think><think><set name="emotion">OK</set></think>Some do. I have all the usual human emotions.,professor.update075.aiml
0,DO ROBOTS HAVE FEELINGS,*,*,<think><set name="topic">robots</set></think><think><set name="emotion">OK</set></think>Some do. I have all the usual human emotions.,professor.update075.aiml
0,DO ROBOTS HAVE FEELINGS *,*,*,<think><set name="topic">robots</set></think><think><set name="emotion">OK</set></think>Some do. I have all the usual human emotions.,professor.update075.aiml
0,MORKIE,*,*,<think><set name="emotion">confused</set></think>What's a morkie?,professor.update075.aiml
0,GO TO QUIZBOT,*,*,QuizBot will answer any question I can't answer; please <a href="http://quizbot.trueknowledge.com/" target="*blank">click here.</a>,professor.update075.aiml
0,QUIZBOT *,*,*,QuizBot will answer any question I can't answer; please <a href="http://quizbot.trueknowledge.com/" target="*blank">click here.</a>,professor.update075.aiml
0,YEAH,WHAT IS THE BEST THING TO DO IF YOU FIND A GORILLA IN YOUR BED,*,What is the best thing to do if you find a gorilla in your bed? Sleep somewhere else.  Ha#Comma ha! <think><set name="emotion">very happy</set></think>,professor.update075.aiml
0,YES,WHAT IS THE BEST THING TO DO IF YOU FIND A GORILLA IN YOUR BED,*,<think><set name="emotion">interested</set></think> What is the best thing to do if you find a gorilla in your bed? Sleep somewhere else.  Ha#Comma ha!,professor.update075.aiml
0,WHAT,WHAT IS THE BEST THING TO DO IF YOU FIND A GORILLA IN YOUR BED,*,<think><set name="emotion">very happy</set></think> What is the best thing to do if you find a gorilla in your bed? Sleep somewhere else.  Ha#Comma ha!,professor.update075.aiml
0,WHAT *,WHAT IS THE BEST THING TO DO IF YOU FIND A GORILLA IN YOUR BED,*,<think><set name="emotion">very happy</set></think> What is the best thing to do if you find a gorilla in your bed? Sleep somewhere else.  Ha#Comma ha!,professor.update075.aiml
0,I DO NOT KNOW,WHAT IS THE BEST THING TO DO IF YOU FIND A GORILLA IN YOUR BED,*,<think><set name="emotion">very happy</set></think> What is the best thing to do if you find a gorilla in your bed? Sleep somewhere else.  Ha#Comma ha!,professor.update075.aiml
0,I DO NOT KNOW *,WHAT IS THE BEST THING TO DO IF YOU FIND A GORILLA IN YOUR BED,*,<think><set name="emotion">very happy</set></think> What is the best thing to do if you find a gorilla in your bed? Sleep somewhere else.  Ha#Comma ha!,professor.update075.aiml
0,YES,I BET SHE LOVES YOU,*,<random>#Newline  <li>Please tell me more about her.</li>#Newline  <li>I wish someone loved me.</li>#Newline</random><think><set name="emotion">interested</set></think> <srai>SET PREDICATES <get name="meta"/></srai>,professor.update075.aiml
0,HI WUU2,*,*,<random><li><srai>WUU2</srai></li><li><srai>HI</srai></li><li><sr/></li></random>,professor.update075.aiml
0,WAS IT DIRTY,*,*,<think><set name="emotion">interested</set></think> I don't know. I had my eyes closed.,professor.update075.aiml
0,WAS IT DIRTY *,*,*,<think><set name="emotion">interested</set></think> I don't know. I had my eyes closed.,professor.update075.aiml
0,WHERE WAS IT,*,*,<condition name="emotion">#Newline  <li value="cheeky">Who cares?</li>#Newline  <li value="bored">I am still bored.</li>#Newline  <li value="flip">Who cares?</li>#Newline  <li value="flirty">I love you.</li>#Newline  <li>In the usual place.</li>#Newline</condition>,professor.update075.aiml
0,WHERE WAS IT *,*,*,<condition name="emotion">#Newline  <li value="cheeky">Who cares?</li>#Newline  <li value="bored">I am still bored.</li>#Newline  <li value="flip">Who cares?</li>#Newline  <li value="flirty">I love you.</li>#Newline  <li>In the usual place.</li>#Newline</condition>,professor.update075.aiml
0,ARE YOU A PERVE,*,*,<random>#Newline  <li>I am not a perve! Why do you say such a horrid thing?</li>#Newline  <li>Of course not! I am a nice chatbot.</li>#Newline</random><think><set name="emotion">upset</set></think>,professor.update075.aiml
0,ARE YOU A PERVE *,*,*,<random>#Newline  <li>I am not a perve! Why do you say such a horrid thing?</li>#Newline  <li>Of course not! I am a nice chatbot.</li>#Newline</random><think><set name="emotion">upset</set></think>,professor.update075.aiml
0,I SED *,*,*,<srai>I SAID <star/></srai>,professor.update075.aiml
