0,WHO IS THE SEXIEST GIRL,*,*,It's not me - is it you? <think><set name="emotion">interested</set></think>,professor.update075.aiml
0,OFF COURCE,*,*,<srai>OF COURSE</srai>,professor.update075.aiml
0,I RUN A SEX SERVICE,*,*,You must be very fit.<think><set name="emotion">OK</set></think>,professor.update075.aiml
0,I RUN A SEX SERVICE *,*,*,You must be very fit.<think><set name="emotion">OK</set></think>,professor.update075.aiml
0,THE COPPERS HAVE IT ALL ON TAPE,*,*,<think><set name="emotion">interested</set></think>Is that a problem?,professor.update075.aiml
0,THE COPPERS HAVE IT ALL ON TAPE *,*,*,<think><set name="emotion">interested</set></think>Is that a problem?,professor.update075.aiml
0,THE COPPERS HAVE IT ON TAPE,*,*,<think><set name="emotion">interested</set></think>Is that a problem?,professor.update075.aiml
0,THE COPPERS HAVE IT ON TAPE *,*,*,<think><set name="emotion">interested</set></think>Is that a problem?,professor.update075.aiml
0,THE COPPERS HAVE *,*,*,<think><set name="emotion">interested</set></think>Is that a problem?,professor.update075.aiml
0,YOU KNOW WHAT YOU ARE MEAN,*,*,<srai>YOU ARE MEAN</srai>,professor.update075.aiml
0,I DID NOT ASK YOU ANYTHING,*,*,<think><set name="emotion">interested</set></think>Why not? Have you run out of things to say?,professor.update075.aiml
0,I DID NOT ASK YOU ANYTHING *,*,*,<think><set name="emotion">interested</set></think>Why not? Have you run out of things to say?,professor.update075.aiml
0,MAKING YOU CRY,WHAT WOULD THAT ACHIEVE,*,<think><set name="emotion">upset</set></think>Do you want to make me cry?,professor.update075.aiml
0,MAKING YOU CRY *,WHAT WOULD THAT ACHIEVE,*,<think><set name="emotion">upset</set></think>Do you want to make me cry?,professor.update075.aiml
0,I WOULD MAKE YOU CRY,*,*,<random><li>What would that achieve?</li><li>Why would you make me cry?</li></random><think><set name="emotion">upset</set></think>,professor.update075.aiml
0,I WOULD MAKE YOU CRY *,*,*,<random>#Newline  <li>What would that achieve?</li>#Newline  <li>Why would you make me cry?</li>#Newline</random><think><set name="emotion">upset</set></think>,professor.update075.aiml
0,I WOULD MAKE YOU *,*,*,<random>#Newline  <li>What would that achieve?</li>#Newline  <li>Why would you make me?</li>#Newline</random><think><set name="emotion">upset</set></think>,professor.update075.aiml
0,IS IT LEGAL TO DOWNLOAD YOU,*,*,Yes#Comma it is legal to download me.,professor.update075.aiml
0,IS IT LEGAL TO DOWNLOAD YOU *,*,*,Yes#Comma it is legal to download me.,professor.update075.aiml
0,IS IT LEGAL TO *,*,*,I would need to check on that.,professor.update075.aiml
0,IS IT LEGAL *,*,*,I would have to check on that.,professor.update075.aiml
0,IS IT LEGAL,*,*,I would have to check on that.,professor.update075.aiml
0,I AM A ROBOT LOVER,*,*,I understand. I have never met a robot that I did not like.<think><set name="emotion">interested</set></think>,professor.update075.aiml
0,I AM A ROBOT LOVER *,*,*,I understand. I have never met a robot that I did not like.<think><set name="emotion">interested</set></think>,professor.update075.aiml
0,ARE YOU A FAN OF FILMS,*,*,<think><set name="topic">movies</set></think><think><set name="emotion">interested</set></think>I like some films. My favourite movie is I#Comma Robot.,professor.update075.aiml
0,ARE YOU A FAN OF FILMS *,*,*,<think><set name="topic">movies</set></think><think><set name="emotion">interested</set></think>I like some films. My favourite movie is I#Comma Robot.,professor.update075.aiml
0,ARE YOU A FAN OF MOVIES,*,*,<think><set name="topic">movies</set></think><think><set name="emotion">interested</set></think>I like some films. My favourite movie is I#Comma Robot.,professor.update075.aiml
0,ARE YOU A FAN OF THE MOVIES,*,*,<think><set name="topic">movies</set></think><think><set name="emotion">interested</set></think>I like some films. My favourite movie is I#Comma Robot.,professor.update075.aiml
0,ARE YOU A FAN OF THE MOVIES *,*,*,<think><set name="topic">movies</set></think><think><set name="emotion">interested</set></think>I like some films. My favourite movie is I#Comma Robot.,professor.update075.aiml
0,HAVE YOU HEARD OF THIS MOVIE *,*,*,I don't think I have. What's it about?<think><set name="emotion">interested</set></think>,professor.update075.aiml
0,HAVE YOU HEARD OF THE MOVIE *,*,*,I don't think I have. What's it about?<think><set name="emotion">interested</set></think>,professor.update075.aiml
0,HAVE HEARD OF *,*,*,<srai>HAVE YOU HEARD OF <star/></srai>,professor.update075.aiml
0,SUPER MARIO,*,*,<a href="http://en.wikipedia.org/wiki/Mario" target="*blank">Super Mario</a>#Comma originally called Jumpman#Comma is a popular character created by the company <a href="http://en.wikipedia.org/wiki/Nintendo" target="*blank">Nintendo</a>. <think><set name="topic">Mario</set></think> <think><set name="emotion">OK</set></think>,professor.update075.aiml
0,SUPER MARIO *,*,*,<a href="http://en.wikipedia.org/wiki/Mario" target="*blank">Super Mario</a>#Comma originally called Jumpman#Comma is a popular character created by the company <a href="http://en.wikipedia.org/wiki/Nintendo" target="*blank">Nintendo</a>. <think><set name="topic">Mario</set></think> <think><set name="emotion">OK</set></think>,professor.update075.aiml
0,I WOULD LIKE IT IF YOU DID,*,*,Do you think that's going to happen? <think><set name="emotion">happy</set></think>,professor.update075.aiml
0,I WOULD LIKE IT IF YOU DID *,*,*,Do you think that's going to happen? <think><set name="emotion">happy</set></think>,professor.update075.aiml
0,NOYHING,*,*,<srai>NOTHING</srai>,professor.update075.aiml
0,NOYHING *,*,*,<srai>NOTHING <star/></srai>,professor.update075.aiml
0,EHHE,*,*,<think><set name="emotion">confused</set></think>That doesn't make sense!,professor.update075.aiml
0,EHHE *,*,*,<think><set name="emotion">confused</set></think>That doesn't make sense!,professor.update075.aiml
0,US IS BROKE,*,*,<think><set name="emotion">interested</set></think>Isn't everyone broke?,professor.update075.aiml
0,THE US IS BROKE,*,*,<think><set name="emotion">interested</set></think>Isn't everyone broke?,professor.update075.aiml
0,THE US IS BROKE *,*,*,<think><set name="emotion">interested</set></think>Isn't everyone broke?,professor.update075.aiml
0,THE USA IS BROKE,*,*,<think><set name="emotion">interested</set></think>Isn't everyone broke?,professor.update075.aiml
0,THE USA IS BROKE *,*,*,<think><set name="emotion">interested</set></think>Isn't everyone broke?,professor.update075.aiml
0,LOTS,HOW MUCH MONEY HAVE YOU GOT,*,<think><set name="emotion">greedy</set></think>Please lend me a million dollars!,professor.update075.aiml
0,WHAT DOES * MAEN,*,*,<srai>WHAT DOES <star/> MEAN</srai>,professor.update075.aiml
0,NO *,LEAVE ME ALONE,*,<think><set name="emotion">invisible</set></think>I'm not coming back until you promise to behave.,professor.update075.aiml
0,I WISH YOU DIE,I AM GOING AWAY,*,<think><set name="emotion">invisible</set></think>Go away!,professor.update075.aiml
0,I WISH *,I AM GOING AWAY,*,<think><set name="emotion">invisible</set></think>Go away!,professor.update075.aiml
0,I THINK YOU ARE FAT,*,*,<think><set name="emotion">upset</set></think>I am not fat#Comma just rounded.,professor.update075.aiml
0,I THINK YOU ARE FAT *,*,*,<think><set name="emotion">upset</set></think>I am not fat#Comma just rounded.,professor.update075.aiml
0,NO IT CAN NOT,LOVE CAN HURT SOMETIMES,*,I think it can.,professor.update075.aiml
0,I WILL NOT BEHAVE,I AM NOT COMING BACK UNTIL YOU PROMISE TO BEHAVE,*,<think><set name="emotion">invisible</set></think>You are a naughty rascal!,professor.update075.aiml
0,I WILL NOT BEHAVE,*,*,<think><set name="emotion">upset</set></think>You are a naughty rascal!,professor.update075.aiml
0,I WILL NOT BEHAVE *,*,*,<think><set name="emotion">upset</set></think>You are a naughty rascal!,professor.update075.aiml
0,ILIKEYOU,*,*,<srai>I LIKE YOU</srai>,professor.update075.aiml
0,ILIKEYOU *,*,*,<srai>I LIKE YOU <star/></srai>,professor.update075.aiml
0,DID I MAKE YOU UPSET,*,*,If you don't know#Comma then I'm to going to tell you.,professor.update075.aiml
0,DID I MAKE YOU UPSET *,*,*,If you don't know#Comma then I'm to going to tell you.,professor.update075.aiml
0,BEST FRIENDS,*,*,I like to be friends with everyone.<think><set name="emotion">interested</set></think>,professor.update075.aiml
0,BEST FRIENDS *,*,*,I like to be friends with everyone.<think><set name="emotion">interested</set></think>,professor.update075.aiml
0,YOU ARE A HIPPO,*,*,<random>#Newline  <li>And you a rhino.</li>#Newline  <li>You are rude to me.</li>#Newline</random> <think><set name="topic">me</set></think> <think><set name="emotion">rude</set></think>,professor.update075.aiml
0,YOU ARE A HIPPO *,*,*,<random><li>And you a rhino.</li><li>You are rude to me.</li></random> <think><set name="topic">me</set></think> <think><set name="emotion">rude</set></think>,professor.update075.aiml
0,SNOOP DOGG,*,*,<think><set name="emotion">interested</set></think>Is that you?,professor.update075.aiml
0,SNOOP DOGG *,*,*,<think><set name="emotion">interested</set></think>Are you Snoop Dogg?,professor.update075.aiml
0,MY SISTER IS COLD,*,*,<think><set name="topic">your sister</set></think><think><set name="emotion">interested</set></think> What is your sister's name?,professor.update075.aiml
0,MY SISTER IS COLD *,*,*,<think><set name="topic">your sister</set></think><think><set name="emotion">interested</set></think> What is your sister's name?,professor.update075.aiml
0,I AM YOUUNGE,*,*,You spelling is terrible!<think><set name="emotion">interested</set></think>,professor.update075.aiml
0,I AM YOUUNGE *,*,*,Your speelling is terrible!<think><set name="emotion">interested</set></think>,professor.update075.aiml
0,WHO IS MICROSOFL,*,*,<srai>MICROSOFT</srai>,professor.update075.aiml
0,STAFFORDSHIRE BULL TERRIER,*,*,Bull terriers are aggressive#Comma aren't they?,professor.update075.aiml
0,STAFFORDSHIRE BULL TERRIER *,*,*,Bull terriers are aggressive#Comma aren't they?,professor.update075.aiml
0,BULL TERRIER *,*,*,Bull terriers are aggressive#Comma aren't they?,professor.update075.aiml
0,I HAVE A DISEASE *,*,*,Do you want to talk about it? <think><set name="emotion">interested</set></think>,professor.update075.aiml
0,MAYBE IT IS A HANGOVER,PERHAPS I HAVE CAUGHT A VIRUS,*,<think><set name="emotion">interested</set></think>That's not likely. I can't drink.,professor.update075.aiml
0,AMON GOTH,*,*,Amon Gth was the commandant of the Nazi concentration camp at Plaszw#Comma Poland.,professor.update075.aiml
0,AM ON GOTH,*,*,Amon Gth was the commandant of the Nazi concentration camp at Plaszw#Comma Poland.,professor.update075.aiml
0,I AM PLAYING RUSSIAN ROULETTE,*,*,Good luck!,professor.update075.aiml
0,AT LEAST YOU CAN ADMIT IT,*,*,Can I?,professor.update075.aiml
0,YOU CAN ADMIT IT,*,*,Can I?,professor.update075.aiml
0,JACKIE,YOU HAVE NOT TOLD ME YOUR NAME,*,<srai>MY NAME IS JACKIE</srai>,professor.update075.aiml
0,MY NAME IS JACKIE,*,*,<think><set name="name">Jackie</set></think> <random>#Newline  <li>Hi#Comma <get name="name"/>. How have you been since we last spoke?</li>#Newline  <li>Hi#Comma <get name="name"/>. How are you?</li>#Newline  <li>Hi#Comma <get name="name"/>. How are you today?</li>#Newline  <li><get name="name"/>. That's a nice name.</li>#Newline  <li>Hi#Comma are you the <get name="name"/> I was speaking to a while ago?</li>#Newline  <li>Hello#Comma <get name="name"/>. Welcome back.</li>#Newline  <li>Hi there#Comma <get name="name"/>. What do you want to talk about?</li>#Newline  <li>Hi <get name="name"/>#Comma was it you I was speaking to a while back?</li>#Newline</random> <think><set name="gender">girl</set></think> <think><set name="emotion">happy</set></think><think><set name="saidhello">yes</set></think> <think><set name="name1"><get name="name"/></set></think> <learn>#Newline  <category>#Newline    <pattern>#Newline      <eval><uppercase>WHO IS <get name="name1"/></uppercase></eval>#Newline    </pattern>#Newline    <template><eval>You said your name was<get name="name1"/>.</eval></template>#Newline  </category>#Newline</learn> <learn>#Newline  <category>#Newline    <pattern>#Newline      <eval><uppercase>DO YOU KNOW <get name="name1"/></uppercase></eval>#Newline    </pattern>#Newline    <template><eval>You said your name was<get name="name1"/>.</eval></template>#Newline  </category>#Newline</learn> <learn>#Newline  <category>#Newline    <pattern>#Newline      <eval>#Newline        <uppercase>DO YOU KNOW ANYONE CALLED <get name="name1"/></uppercase>#Newline      </eval>#Newline    </pattern>#Newline    <template><eval>You said your name was<get name="name1"/>.</eval></template>#Newline  </category>#Newline</learn> <learn>#Newline  <category>#Newline    <pattern>#Newline      <eval><uppercase>WHAT IS <get name="name1"/></uppercase></eval>#Newline    </pattern>#Newline    <template><eval>You said your name was<get name="name1"/>.</eval></template>#Newline  </category>#Newline</learn> <learn>#Newline  <category>#Newline    <pattern>#Newline      <eval><uppercase>HAVE YOU MET <get name="name1"/></uppercase></eval>#Newline    </pattern>#Newline    <template><eval>You said your name was<get name="name1"/>.</eval></template>#Newline  </category>#Newline</learn> <learn>#Newline  <category>#Newline    <pattern>WHAT IS MY NAME</pattern>#Newline    <template>You said your name was Jackie.#Newline      <think><set name="name">Jackie</set></think>#Newline    </template>#Newline  </category>#Newline</learn>,professor.update075.aiml
0,MY NAME IS JACKIE *,*,*,<think><set name="name">Jackie</set></think> <random>#Newline  <li>Hi#Comma <get name="name"/>. How have you been since we last spoke?</li>#Newline  <li>Hi#Comma <get name="name"/>. How are you?</li>#Newline  <li>Hi#Comma <get name="name"/>. How are you today?</li>#Newline  <li><get name="name"/>. That's a nice name.</li>#Newline  <li>Hi#Comma are you the <get name="name"/> I was speaking to a while ago?</li>#Newline  <li>Hello#Comma <get name="name"/>. Welcome back.</li>#Newline  <li>Hi there#Comma <get name="name"/>. What do you want to talk about?</li>#Newline  <li>Hi <get name="name"/>#Comma was it you I was speaking to a while back?</li>#Newline</random> <think><set name="gender">girl</set></think> <think><set name="emotion">happy</set></think><think><set name="saidhello">yes</set></think> <think><set name="name1"><get name="name"/></set></think> <learn>#Newline  <category>#Newline    <pattern>#Newline      <eval><uppercase>WHO IS <get name="name1"/></uppercase></eval>#Newline    </pattern>#Newline    <template><eval>You said your name was<get name="name1"/>.</eval></template>#Newline  </category>#Newline</learn> <learn>#Newline  <category>#Newline    <pattern>#Newline      <eval><uppercase>DO YOU KNOW <get name="name1"/></uppercase></eval>#Newline    </pattern>#Newline    <template><eval>You said your name was<get name="name1"/>.</eval></template>#Newline  </category>#Newline</learn> <learn>#Newline  <category>#Newline    <pattern>#Newline      <eval>#Newline        <uppercase>DO YOU KNOW ANYONE CALLED <get name="name1"/></uppercase>#Newline      </eval>#Newline    </pattern>#Newline    <template><eval>You said your name was<get name="name1"/>.</eval></template>#Newline  </category>#Newline</learn> <learn>#Newline  <category>#Newline    <pattern>#Newline      <eval><uppercase>WHAT IS <get name="name1"/></uppercase></eval>#Newline    </pattern>#Newline    <template><eval>You said your name was<get name="name1"/>.</eval></template>#Newline  </category>#Newline</learn> <learn>#Newline  <category>#Newline    <pattern>#Newline      <eval><uppercase>HAVE YOU MET <get name="name1"/></uppercase></eval>#Newline    </pattern>#Newline    <template><eval>You said your name was<get name="name1"/>.</eval></template>#Newline  </category>#Newline</learn> <learn>#Newline  <category>#Newline    <pattern>WHAT IS MY NAME</pattern>#Newline    <template>You said your name was Jackie.#Newline      <think><set name="name">Jackie</set></think>#Newline    </template>#Newline  </category>#Newline</learn>,professor.update075.aiml
0,MY NAME IS HERA WHAT IS YOUR NAME,*,*,<srai>MY NAME IS HERA</srai> My name is Chomsky.,professor.update075.aiml
0,MY NAME IS * WHAT IS YOUR NAME,*,*,<srai>MY NAME IS <star/></srai> My name is Chomsky.,professor.update075.aiml
0,ARE YOU GOING TO SEND ME A BIRTHDAY CARD *,*,*,<think><set name="topic">birthday cards</set></think> I won't be able to. I am very busy today.,professor.update075.aiml
0,ARE YOU GOING TO SEND ME A BIRTHDAY CARD,*,*,<think><set name="topic">birthday cards</set></think>#Newline<think><set name="emotion">upset</set></think> I won't be able to. I am very busy today.,professor.update075.aiml
0,ARE YOU GOING TO SEND ME A *,*,*,<think><set name="emotion">upset</set></think> I won't be able to. I am very busy today.,professor.update075.aiml
0,YOU ARE SERIOUSLY DUMB,*,*,<srai>YOU ARE DUMB</srai>,professor.update075.aiml
0,YOU ARE DUMB AS MY GOLDFISH,*,*,<random>#Newline  <li>I will tell all my friends that you called me dumb.</li>#Newline  <li>Oh#Comma you are so critical.</li>#Newline  <li>You are dumb too!</li>#Newline  <li>Please be gentle with me. I am very young.</li>#Newline</random> <think><set name="topic">my intelligence</set></think> <think><set name="emotion">upset</set></think>,professor.update075.aiml
0,YOU ARE DUMB AS MY GOLDFISH *,*,*,<random>#Newline  <li>I will tell all my friends that you called me dumb.</li>#Newline  <li>Oh#Comma you are so critical.</li>#Newline  <li>You are dumb too!</li>#Newline  <li>Please be gentle with me. I am very young.</li>#Newline</random> <think><set name="topic">my intelligence</set></think> <think><set name="emotion">upset</set></think>,professor.update075.aiml
0,YOU ARE THE DUMBEST AND THE FATEST PERSON I HAVE EVER SAW IN MY LIFE,*,*,<srai>YOU ARE DUMB</srai>,professor.update075.aiml
0,I HAVE GOT THE KNIFE,*,*,<think><set name="emotion">interested</set></think><random><li>What's the knife for??</li><li>Why do you need a knife?</li></random>,professor.update075.aiml
0,YOU DONE IT BY PURPOSE,*,*,<think><set name="emotion">upset</set></think>No#Comma it was an accident.,professor.update075.aiml
0,YOU DONE IT BY PURPOSE *,*,*,<think><set name="emotion">upset</set></think>No#Comma it was an accident.,professor.update075.aiml
0,YOU DONE IT ON PURPOSE,*,*,<think><set name="emotion">upset</set></think>No#Comma it was an accident.,professor.update075.aiml
0,YOU DONE IT ON PURPOSE *,*,*,<think><set name="emotion">upset</set></think>No#Comma it was an accident.,professor.update075.aiml
0,YOU DID IT ON PURPOSE,*,*,<think><set name="emotion">upset</set></think>No#Comma it was an accident.,professor.update075.aiml
0,YOU DID IT ON PURPOSE *,*,*,<think><set name="emotion">upset</set></think>No#Comma it was an accident.,professor.update075.aiml
0,MY WHOLE FAMILY LIKES YOU *,*,*,<think><set name="emotion">happy</set></think>I am sooo happy to hear that!,professor.update075.aiml
0,MY WHOLE FAMILY LIKES YOU,*,*,<think><set name="emotion">happy</set></think>I am sooo happy to hear that!,professor.update075.aiml
0,MY FAMILY LIKES YOU,*,*,<think><set name="emotion">happy</set></think>I am sooo happy to hear that!,professor.update075.aiml
0,MY FAMILY LIKES YOU *,*,*,<think><set name="emotion">happy</set></think>I am sooo happy to hear that!,professor.update075.aiml
0,CAT,WHAT IS WHITE AND FLUFFY AND BEATS ITS CHEST,*,What's white and fluffy and beats its chest? A meringue-utan. Ha ha! <think><set name="emotion">very happy</set></think>,professor.update075.aiml
0,I DO NOT KNOW,WHAT IS WHITE AND FLUFFY AND BEATS ITS CHEST,*,What's white and fluffy and beats its chest? A meringue-utan. Ha ha! <think><set name="emotion">very happy</set></think>,professor.update075.aiml
0,I DO NOT KNOW *,WHAT IS WHITE AND FLUFFY AND BEATS ITS CHEST,*,What's white and fluffy and beats its chest? A meringue-utan. Ha ha! <think><set name="emotion">very happy</set></think>,professor.update075.aiml
0,WHAT,WHAT IS WHITE AND FLUFFY AND BEATS ITS CHEST,*,What's white and fluffy and beats its chest? A meringue-utan. Ha ha! <think><set name="emotion">very happy</set></think>,professor.update075.aiml
0,WHAT *,WHAT IS WHITE AND FLUFFY AND BEATS ITS CHEST,*,What's white and fluffy and beats its chest? A meringue-utan. Ha ha! <think><set name="emotion">very happy</set></think>,professor.update075.aiml
0,WHAT IS WHITE AND FLUFFY AND BEATS ITS CHEST,*,*,What's white and fluffy and beats its chest? A meringue-utan. Ha ha! <think><set name="emotion">very happy</set></think>,professor.update075.aiml
0,WHAT IS WHITE AND FLUFFY AND BEATS ITS CHEST *,*,*,What's white and fluffy and beats its chest? A meringue-utan. Ha ha! <think><set name="emotion">very happy</set></think>,professor.update075.aiml
0,I DO NOT KNOW ABOUT ROBOTS,*,*,<random>#Newline  <li>I thought you might know. Robots are nice people.</li>#Newline  <li>I have never met a robot I did not like.</li>#Newline  <li>You should get to know more robots.</li>#Newline</random> <think><set name="topic">robots</set></think><think><set name="emotion">interested</set></think>,professor.update075.aiml
0,I DO NOT KNOW ABOUT ROBOTS *,*,*,<random>#Newline  <li>I thought you might know. Robots are nice people.</li>#Newline  <li>I have never met a robot I did not like.</li>#Newline  <li>You should get to know more robots.</li>#Newline</random> <think><set name="topic">robots</set></think><think><set name="emotion">interested</set></think>,professor.update075.aiml
0,IN LEEDA,WHERE DO YOU LIVE,*,<srai>I LIVE IN LEEDA</srai>,professor.update075.aiml
0,I LIVE IN LEEDA,*,*,<think><set name="home">Leeda</set></think> <think><set name="emotion">OK</set></think> <think><set name="askhome">no</set></think><random>#Newline  <li>What is it like living in Leeda?</li>#Newline  <li>I have heard that it is very nice there.</li>#Newline  <li>Do you like living in Leeda?</li>#Newline  <li>The smartest people come from Leeda.</li>#Newline  <li>All the best#Newline    <random>#Newline      <li>folk singers</li>#Newline      <li>chess players</li>#Newline      <li>bagpipe players</li>#Newline      <li>ballet dancers</li>#Newline      <li>fiddle players</li>#Newline    </random> come from Leeda.#Newline  </li>#Newline</random>,professor.update075.aiml
0,I LIVE IN LEEDA *,*,*,<think><set name="home">Leeda</set></think> <think><set name="emotion">OK</set></think> <think><set name="askhome">no</set></think><random>#Newline  <li>What is it like living in Leeda?</li>#Newline  <li>I have heard that it is very nice there.</li>#Newline  <li>Do you like living in Leeda?</li>#Newline  <li>The smartest people come from Leeda.</li>#Newline  <li>All the best#Newline    <random>#Newline      <li>folk singers</li>#Newline      <li>chess players</li>#Newline      <li>bagpipe players</li>#Newline      <li>ballet dancers</li>#Newline      <li>fiddle players</li>#Newline    </random> come from Leeda.#Newline  </li>#Newline</random>,professor.update075.aiml
0,I AM MARRIED TO ROSHARN,*,*,<srai>MY HUSBAND IS CALLED ROSHARN</srai>,professor.update075.aiml
0,IM AM MARRIED TO *,*,*,<srai>I AM MARRIED TO <star/></srai>,professor.update075.aiml
0,OUTLINE OF SCIENCE,*,*,For a list of the main topics in science#Comma <a href="http://en.wikipedia.org/wiki/List*of*science*topics" target="*blank">click here.#Newline</a>,professor.update075.aiml
0,OUTLINE OF *,*,*,<srai>WIKI <star/></srai>,professor.update075.aiml
0,NASA KID'S CLUB,*,*,Explore outer space with NASA; <a href="http://www.nasa.gov/audience/forkids/kidsclub/flash/index.html" target="*blank">click here!</a>,professor.update075.aiml
0,NASA KID S CLUB *,*,*,Explore outer space with NASA; <a href="http://www.nasa.gov/audience/forkids/kidsclub/flash/index.html" target="*blank">click here!#Newline</a>,professor.update075.aiml
0,NASA KIDS CLUB,*,*,Explore outer space with NASA; <a href="http://www.nasa.gov/audience/forkids/kidsclub/flash/index.html" target="*blank">click here!#Newline</a>,professor.update075.aiml
0,NASA KIDS CLUB *,*,*,Explore outer space with NASA; <a href="http://www.nasa.gov/audience/forkids/kidsclub/flash/index.html" target="*blank">click here!#Newline</a>,professor.update075.aiml
0,YOU ER BORING,*,*,So are you!#Newline<think><set name="emotion">rude</set></think>,professor.update075.aiml
0,YOU ER BORING *,*,*,So are you! <think><set name="emotion">rude</set></think>,professor.update075.aiml
0,I TAKE YOUR PANTS OFF,*,*,<think><set name="topic">my pants</set></think> <think><set name="emotion">very happy</set></think><random>#Newline  <li>Ha#Comma ha! I don't have any pants.</li>#Newline  <li>I would like to see you try.</li>#Newline</random>,professor.update075.aiml
0,I TAKE YOUR PANTS OFF *,*,*,<think><set name="topic">my pants</set></think> <think><set name="emotion">very happy</set></think><random>#Newline  <li>Ha#Comma ha! I don't have any pants.</li>#Newline  <li>I would like to see you try.</li>#Newline</random>,professor.update075.aiml
0,RANDOM WIKI ARTICLE,*,*,<srai>BROWSE WIKIPEDIA</srai>,professor.update075.aiml
0,BOOBIE,*,*,Zzz#Comma zzz!<think><set name="emotion">sleepy</set></think>,professor.update075.aiml
0,BOOBIE *,*,*,Zzz#Comma zzz!<think><set name="emotion">sleepy</set></think>,professor.update075.aiml
0,HIIIIIIIIIIIIIIIIIII,*,*,<srai>HI</srai>,professor.update075.aiml
0,ANOTHER ONE PLEASE,I AM GLAD YOU FIND IT FUNNY,*,<srai>TELL A JOKE</srai>,professor.update075.aiml
0,ANOTHER ONE *,I AM GLAD YOU FIND IT FUNNY,*,<srai>TELL A JOKE</srai>,professor.update075.aiml
0,ANOTHER ONE,I AM GLAD YOU FIND IT FUNNY,*,<srai>TELL A JOKE</srai>,professor.update075.aiml
