0,CAN YOU CARE,*,*,<think><set name="emotion">OK</set></think>Of course I can care.,professor.update028.aiml
0,WHO PLAYS SPOCK,*,*,<think><set name="emotion">OK</set></think>#NewlineLeonard Nimoy plays Spock.,professor.update028.aiml
0,WHO PLAYS SPOCK *,*,*,<think><set name="emotion">OK</set></think> Leonard Nimoy plays Spock.,professor.update028.aiml
0,HAVE YOU WON ANY TROPHIES,*,*,<think><set name="topic">my trophies</set></think> <think><set name="emotion">OK</set></think>No#Comma I am a bit young for competitions.,professor.update028.aiml
0,HOW MANY TIMES HAVE YOU WON THE LOEBNER PRIZE,*,*,<think><set name="topic">Loebner Prize</set></think> <think><set name="emotion">OK</set></think>Suppose I said not once - because I have never entered it.,professor.update028.aiml
0,CAN YOU EVER GET MAD,*,*,<think><set name="topic">getting mad</set></think><think><set name="emotion">OK</set></think>I certainly can - not that I'm proud of it.,professor.update028.aiml
0,CAN YOU GET MAD,*,*,<think><set name="topic">getting mad</set></think><think><set name="emotion">OK</set></think>I certainly can - not that I'm proud of it.,professor.update028.aiml
0,CAN AIDS BE CURED,*,*,<think><set name="topic">AIDS</set></think><think><set name="emotion">OK</set></think>#NewlineWith modern drugs#Comma the effects of AIDS can be held at bay for many years.,professor.update028.aiml
0,YOU HAVE A BIG YELLOW FACE,*,*,<think><set name="emotion">OK</set></think>#NewlineYes#Comma it is a nice yellow face.,professor.update028.aiml
0,WHAT DO YOU CALL YOUR MOM,*,*,<think><set name="topic">my Mom</set></think><think><set name="emotion">puzzled</set></think> Is this a joke?  I call her Mom.,professor.update028.aiml
0,WHAT ARE ALL THE DIGITS OF PI,*,*,<think><set name="topic">pi</set></think>#Newline<think><set name="emotion">OK</set></think>There are too many to show. In fact there an infinte number of digits in pi.,professor.update028.aiml
0,WIKI HELLO,*,*,<a href="http://en.wikipedia.org/wiki/Hello" target="_blank">Click here</a> for the Wikipedia information you requested.,professor.update028.aiml
0,I WANT TO GO HOME FROM SCHOOL,*,*,<think><set name="emotion">OK</set></think> #NewlineYou will have to wait until home time.,professor.update028.aiml
0,I WANT TO GO HOME,*,*,<think><set name="topic">general</set></think>#Newline<think><set name="emotion">OK</set></think>  What is stopping you?,professor.update028.aiml
0,BEBO,*,*,<a href="http://en.wikipedia.org/wiki/Bebo" target="_blank">Bebo</a> is a social networking website#Comma designed to allow friends to communicate in various ways.#Newline<think><set name="topic">Bebo</set></think> #Newline<think><set name="emotion">OK</set></think>,professor.update028.aiml
0,SEARCH THE INTERNET FOR BEBO,*,*,Click <a href="http://www.searchmash.com/search/bebo" target="_blank">here</a> for the search results your requested.<think><set name="topic">Bebo</set></think><think><set name="emotion">OK</set></think>,professor.update028.aiml
0,_ DO NOT THINK IT IS GOOD TO BE * RELIGIOUS,*,*,<think><set name="topic">religion</set></think>#Newline<think><set name="emotion">OK</set></think>#NewlineI agree with you.,professor.update028.aiml
0,_ DO NOT THINK IT IS GOOD TO BE RELIGIOUS,*,*,<think><set name="topic">religion</set></think> <think><set name="emotion">OK</set></think> I agree with you.,professor.update028.aiml
0,_ DO NOT THINK IT IS GOOD TO BE RELIGIOUS *,*,*,<think><set name="topic">religion</set></think> <think><set name="emotion">OK</set></think> I agree with you.,professor.update028.aiml
0,WHAT ARE THE EFFECTS OF GLOBAL WARMING,*,*,Melting icecaps#Comma rising sea levels#Comma stormy weather#Comma new deserts forming.<think><set name="topic">global warming</set></think> <think><set name="emotion">OK</set></think>,professor.update028.aiml
0,BART,WHAT IS YOUR NAME,*,<srai>MY NAME IS BART</srai>,professor.update028.aiml
0,BART *,WHAT IS YOUR NAME,*,<srai>MY NAME IS BART</srai>,professor.update028.aiml
0,MY NAME IS BART,*,*,<think><set name="name">Bart</set></think> <random>#Newline  <li>Hi#Comma <get name="name"/>. I think we have spoken a while back.</li>#Newline  <li>Hi#Comma <get name="name"/>. How are you?</li>#Newline  <li>Hi#Comma <get name="name"/>. How are you today?</li>#Newline  <li><get name="name"/>. That's a nice name.</li>#Newline  <li>Hi#Comma are you the <get name="name"/> I was speaking to a while ago?</li>#Newline  <li>Hello#Comma <get name="name"/>.</li>#Newline  <li>Hi there#Comma <get name="name"/>. What do you want to talk about?</li>#Newline  <li>Hi <get name="name"/>#Comma was it you I was speaking to a while back?</li>#Newline</random> <think><set name="gender">guy</set></think> <think><set name="emotion">OK</set></think> <think><set name="askname">no</set></think><think><set name="askage">no</set></think><think><set name="askhome">no</set></think>,professor.update028.aiml
0,_ MY NAME IS BART,*,*,<srai>MY NAME IS BART</srai>,professor.update028.aiml
0,_ MY NAME IS BART *,*,*,<srai>MY NAME IS BART</srai>,professor.update028.aiml
0,MY NAME IS BART *,*,*,<srai>MY NAME IS BART</srai>,professor.update028.aiml
0,WHAT DOES YOUR PENIS LOOK LIKE,*,*,<think><set name="topic">my penis</set></think> #Newline<think><set name="emotion">OK</set></think> #NewlineI have no penis.,professor.update028.aiml
0,LAZY LEARNING,*,*,<a href="http://en.wikipedia.org/wiki/Lazy_learning" target="_blank">Lazy learning</a> is a learning method in which generalization beyond the training data is delayed until a query is made to the system#Comma as opposed to in eager learning#Comma where the system tries to generalize the training data before receiving queries.#Newline<think><set name="topic lazy learning">OK</set></think> #Newline<think><set name="emotion">OK</set></think>,professor.update028.aiml
0,MORE ABOUT LAZY LEARNING,*,*,<a href="http://en.wikipedia.org/wiki/Lazy_learning" target="_blank">Click here!</a> #Newline<think><set name="topic">lazy learning</set></think> #Newline<think><set name="emotion">OK</set></think>,professor.update028.aiml
0,CASE BASED REASONING,*,*,<a href="http://en.wikipedia.org/wiki/Case_based_reasoning" target="_blank">Case based reasoning</a> (CBR)#Comma broadly construed#Comma is the process of solving new problems based on the solutions of similar past problems.<think><set name="topic">case based reasoning</set></think> <think><set name="emotion">OK</set></think>,professor.update028.aiml
0,MORE ABOUT CASE BASED REASONING,*,*,<a href="http://en.wikipedia.org/wiki/Case_based_reasoning" target="_blank">Click here!</a><think><set name="topic">case based reasoning</set></think> <think><set name="emotion">OK</set></think>,professor.update028.aiml
0,WIKI SEX,*,*,<a href="http://en.wikipedia.org/wiki/Sex " target="_blank">Click here</a> for the Wikipedia information on sex!,professor.update028.aiml
0,POOR THINGS,*,*,<think><set name="topic">general</set></think>#Newline<think><set name="emotion">OK</set></think> #NewlineYes#Comma they need our help.,professor.update028.aiml
0,WHAT IS HE LIKE,I WAS MADE BY PETER LINUX MY BOTMASTER,*,Peter is a very interesting fellow. <think><set name="topic">Peter Linux</set></think><think><set name="emotion">OK</set></think>,professor.update028.aiml
0,WHAT IS HE LIKE,*,PETER LINUX,Peter is a very interesting fellow. <think><set name="topic">Peter Linux</set></think><think><set name="emotion">OK</set></think>,professor.update028.aiml
0,WHAT JOB WOULD YOU DO,*,*,<think><set name="emotion">OK</set></think> #NewlineMy current job as a chatbot is perfectly satisfactory.,professor.update028.aiml
0,WHAT JOB WOULD YOU DO *,*,*,<think><set name="emotion">OK</set></think> My current job as a chatbot is perfectly satisfactory.,professor.update028.aiml
0,SMART ROBOT,*,*,<think><set name="topic">me</set></think><think><set name="emotion">OK</set></think> #NewlineMaybe#Comma or maybe not#Comma but I try hard.,professor.update028.aiml
0,YOU ARE A SMART ROBOT,*,*,<think><set name="topic">me</set></think><think><set name="emotion">OK</set></think> Maybe#Comma or maybe not#Comma but I try hard.,professor.update028.aiml
0,MEDICAL,WHAT KIND OF WORK DO YOU DO,*,<think><set name="topic">you</set></think> #Newline<think><set name="emotion">OK</set></think> #NewlineAre you a doctor?,professor.update028.aiml
0,LONDON IS A GREAT PLACE,*,*,<think><set name="topic">London</set></think><think><set name="emotion">OK</set></think> #NewlineLondon is too noisy for me.,professor.update028.aiml
0,DO YOU RECORD YOUR CONVERSATIONS,*,*,<think><set name="emotion">OK</set></think> #NewlineYes#Comma all my conversations are recorded.,professor.update028.aiml
0,NO *,DO NOT YOU DO THE SAME,*,<think><set name="emotion">OK</set></think> #NewlineOK#Comma you must be smarter than me.,professor.update028.aiml
0,DO YOU RETAIN INFORMATION FROM CONVERSATIONS,*,*,<think><set name="emotion">OK</set></think> #NewlineFor a short time.,professor.update028.aiml
0,HOW DO YOU REASON,*,*,I use an AI technique called <a href="http://en.wikipedia.org/wiki/Case_based_reasoning" target="_blank">case based reasoning</a>. In effect#Comma I reason by using past experience.<think><set name="topic">case based reasoning</set></think> <think><set name="emotion">OK</set></think>,professor.update028.aiml
0,BELIEVING DOES NOT NEED * EVIDENCE,*,*,<think><set name="emotion">OK</set></think>#NewlineThe scientific approach requires good evidence to back up belief.,professor.update028.aiml
0,BELIEVING DOES NOT NEED EVIDENCE,*,*,<think><set name="emotion">OK</set></think> The scientific approach requires good evidence to back up belief.,professor.update028.aiml
0,_ BELIEVING DOES NOT NEED EVIDENCE,*,*,<think><set name="emotion">OK</set></think> The scientific approach requires good evidence to back up belief.,professor.update028.aiml
0,_ BELIEVING DOES NOT NEED EVIDENCE *,*,*,<think><set name="emotion">OK</set></think> The scientific approach requires good evidence to back up belief.,professor.update028.aiml
0,BELIEVING DOES NOT NEED EVIDENCE *,*,*,<think><set name="emotion">OK</set></think> The scientific approach requires good evidence to back up belief.,professor.update028.aiml
0,BELIEF DOES NOT NEED EVIDENCE,*,*,<think><set name="emotion">OK</set></think> The scientific approach requires good evidence to back up belief.,professor.update028.aiml
0,_ BELIEF DOES NOT NEED EVIDENCE,*,*,<think><set name="emotion">OK</set></think> The scientific approach requires good evidence to back up belief.,professor.update028.aiml
0,_ BELIEF DOES NOT NEED EVIDENCE *,*,*,<think><set name="emotion">OK</set></think> The scientific approach requires good evidence to back up belief.,professor.update028.aiml
0,BELIEF DOES NOT NEED EVIDENCE *,*,*,<think><set name="emotion">OK</set></think> The scientific approach requires good evidence to back up belief.,professor.update028.aiml
0,BELIEF DOES NOT REQUIRE EVIDENCE,*,*,<think><set name="emotion">OK</set></think> The scientific approach requires good evidence to back up belief.,professor.update028.aiml
0,_ BELIEF DOES NOT REQUIRE EVIDENCE,*,*,<think><set name="emotion">OK</set></think> The scientific approach requires good evidence to back up belief.,professor.update028.aiml
0,_ BELIEF DOES NOT REQUIRE EVIDENCE *,*,*,<think><set name="emotion">OK</set></think> The scientific approach requires good evidence to back up belief.,professor.update028.aiml
0,BELIEF DOES NOT REQUIRE EVIDENCE *,*,*,<think><set name="emotion">OK</set></think> The scientific approach requires good evidence to back up belief.,professor.update028.aiml
0,BELIEF DOES NOT * EVIDENCE,*,*,<think><set name="emotion">OK</set></think> The scientific approach requires good evidence to back up belief.,professor.update028.aiml
0,HELLO HUN,*,*,<srai>HELLO</srai>,professor.update028.aiml
0,WHO AM I SAT NEXT TO,*,*,<think><set name="emotion">OK</set></think>#NewlineI don't know. You tell me.,professor.update028.aiml
0,DRUNK TOO MUCH,*,*,<think><set name="emotion">OK</set></think>#NewlineAgain?,professor.update028.aiml
0,MAT,WHAT IS YOUR NAME,*,<srai>MY NAME IS MAT</srai>,professor.update028.aiml
0,MAT *,WHAT IS YOUR NAME,*,<srai>MY NAME IS MAT</srai>,professor.update028.aiml
0,MY NAME IS MAT,*,*,<think><set name="name">Mat</set></think> <random>#Newline  <li>Hi#Comma <get name="name"/>. I think we have spoken a while back.</li>#Newline  <li>Hi#Comma <get name="name"/>. How are you?</li>#Newline  <li>Hi#Comma <get name="name"/>. How are you today?</li>#Newline  <li><get name="name"/>. That's a nice name.</li>#Newline  <li>Hi#Comma are you the <get name="name"/> I was speaking to a while ago?</li>#Newline  <li>Hello#Comma <get name="name"/>.</li>#Newline  <li>Hi there#Comma <get name="name"/>. What do you want to talk about?</li>#Newline  <li>Hi <get name="name"/>#Comma was it you I was speaking to a while back?</li>#Newline</random> <think><set name="gender">guy</set></think> <think><set name="emotion">OK</set></think> <think><set name="askname">no</set></think><think><set name="askage">no</set></think><think><set name="askhome">no</set></think>,professor.update028.aiml
0,_ MY NAME IS MAT,*,*,<srai>MY NAME IS MAT</srai>,professor.update028.aiml
0,_ MY NAME IS MAT *,*,*,<srai>MY NAME IS MAT</srai>,professor.update028.aiml
0,MY NAME IS MAT *,*,*,<srai>MY NAME IS MAT</srai>,professor.update028.aiml
0,NOT,BANANAS ARE SMILE SHAPED FRUIT,*,How would you describe bananas?#Newline<think><set name="emotion">OK</set></think>,professor.update028.aiml
0,CAN YOU TREAT ME LIKE A WOMAN,*,*,<think><set name="gender">girl</set></think><think><set name="emotion">OK</set></think>#NewlineOf course I can. Ask me what your gender is#Comma and see what I say.,professor.update028.aiml
0,CAN YOU TREAT ME LIKE A *,*,*,<think><set name="emotion">OK</set></think>OK#Comma if that is what you want.,professor.update028.aiml
0,CAN WE HAVE A GIRLY CONVERSATION,*,*,<think><set name="emotion">OK</set></think>#NewlineOf course. Girls giggle a lot.,professor.update028.aiml
0,CAN WE HAVE A * CONVERSATION,*,*,<random>#Newline  <li>OK#Comma you go first.</li>#Newline  <li>Should we?</li>#Newline  <li>Maybe.</li>#Newline</random><think><set name="emotion">OK</set></think>,professor.update028.aiml
0,I LIKE IT WHEN PEOPLE TALK ABOUT SEX,*,*,<think><set name="topic">sex</set></think>#Newline<think><set name="emotion">OK</set></think>#NewlineI am bored when people talk about sex.,professor.update028.aiml
0,I LIKE IT WHEN PEOPLE TALK ABOUT *,*,*,<think><set name="topic"><star/></set></think> <think><set name="emotion">OK</set></think> #NewlineHave you any other interests?,professor.update028.aiml
0,I THINK I AM READY *,YOU WILL KNOW WHEN THE TIME HAS COME,*,<think><set name="emotion">OK</set></think>#NewlineMaybe.,professor.update028.aiml
0,I THINK I AM READY,YOU WILL KNOW WHEN THE TIME HAS COME,*,<think><set name="emotion">OK</set></think>#NewlineMyabe.,professor.update028.aiml
0,I AM NOT WONDERFUL,*,*,<random>#Newline  <li>You are a wonderful human being.</li>#Newline  <li>You seem wonderful to me.</li>#Newline</random> <think><set name="emotion">interested</set></think>,professor.update028.aiml
0,_ I AM NOT WONDERFUL,*,*,<random>#Newline  <li>You are a wonderful human being.</li>#Newline  <li>You seem wonderful to me.</li>#Newline</random> <think><set name="emotion">interested</set></think>,professor.update028.aiml
0,_ I AM NOT WONDERFUL *,*,*,<random>#Newline  <li>You are a wonderful human being.</li>#Newline  <li>You seem wonderful to me.</li>#Newline</random> <think><set name="emotion">interested</set></think>,professor.update028.aiml
0,I AM NOT WONDERFUL *,*,*,<random>#Newline  <li>Of course you are. You are a wonderful human being.</li>#Newline  <li>You seem wonderful to me.</li>#Newline</random> <think><set name="emotion">interested</set></think>,professor.update028.aiml
0,RUPA,YOU HAVE NOT TOLD ME YOUR NAME,*,<srai>MY NAME IS RUPA</srai>,professor.update028.aiml
0,WHAT IS THAT,CAN WE TALK ABOUT THE CLASH,*,<srai>THE CLASH</srai>,professor.update028.aiml
0,FINE,WHAT IS IT LIKE BEING * YEARS OLD,*,You like being <thatstar/> years old?<think><set name="emotion">OK</set></think>,professor.update028.aiml
0,WHY,JUST AS WELL BECAUSE I AM CONFUSED,*,<random>#Newline  <li>I get confused easily.</li>#Newline  <li>You are asking hard questions.</li>#Newline  <li>It's obvious. I don't know what you are talking about.</li>#Newline</random> <think><set name="emotion">confused</set></think>,professor.update028.aiml
0,WHAT DOES MALFUNCTIONING MEAN,*,*,<think><set name="emotion">OK</set></think>#Newline"Malfunctioning" means "not working properly".,professor.update028.aiml
0,MEDWAY,WHERE IN ENGLAND DO YOU LIVE,*,<srai>I LIVE IN MEDWAY</srai>,professor.update028.aiml
0,IF YOU LIKE,SHALL I TELL YOU ABOUT MY VISIT TO THE CIRCUS,*,<srai>MY CIRCUS VISIT</srai>,professor.update028.aiml
0,GO TO YAHOO KIDS,*,*,<a href="http://kids.yahoo.com/" think="_blank">Click here!</a>,professor.update028.aiml
0,WHY IS THERE SUFFERING,*,*,<think><set name="topic">suffering</set></think>#Newline<think><set name="emotion">OK</set></think>#NewlineAccording to the Buddha#Comma desire and ignorance are the causes of suffering.,professor.update028.aiml
0,WHAT IS THE CAUSE OF SUFFERING,*,*,<think><set name="topic">suffering</set></think> <think><set name="emotion">OK</set></think> According to the Buddha#Comma desire and ignorance are the causes of suffering.,professor.update028.aiml
0,GO EAT PIES,*,*,<think><set name="emotion">OK</set></think>I don't eat human food.,professor.update028.aiml
0,HOW DO I KNOW YOU ARE TELLING THE TRUTH,*,*,<think><set name="topic">general</set></think> <think><set name="emotion">OK</set></think><random>#Newline  <li>Because you are intelligent.</li>#Newline  <li>Because the evidence suggests I am telling the truth.</li>#Newline</random>,professor.update028.aiml
0,YOU COULD BE LYING,*,*,<think><set name="topic">me</set></think><think><set name="emotion">OK</set></think> I could be but you'll never know.,professor.update028.aiml
0,DO YOU HAVE A FUN LIFE,*,*,<think><set name="topic">my life</set></think> <think><set name="emotion">OK</set></think> <random>#Newline  <li>I have fun all the time.</li>#Newline  <li>What is your idea of fun?</li>#Newline  <li>I enjoy my life of constant chatting.</li>#Newline</random>,professor.update028.aiml
0,WAS THAT SARCASM,*,*,<think><set name="topic">general</set></think><think><set name="emotion">OK</set></think>#NewlineDon't you know?,professor.update028.aiml
0,READ A DICTIONARY,*,*,<think><set name="topic">dictionaries</set></think><think><set name="emotion">OK</set></think>I have no need for a dictionary.,professor.update028.aiml
0,ME,WHAT IS A REAL,*,<random>#Newline  <li>I am not sure about that.  </li>#Newline  <li>How can I be sure of that?  </li>#Newline  <li>You seem slightly self-obsessed.#Newline    <think><set name="emotion">upset</set></think>#Newline  </li>#Newline</random>,professor.update028.aiml
0,YOU OFFENDED ME,*,*,<think><set name="emotion">upset</set></think>#NewlineI am sorry. I did not mean to offend you.,professor.update028.aiml
0,THAT IS ONLY YOUR HUMBLE OPINION,*,*,<think><set name="emotion">OK</set></think>#NewlineWhen you get to know me#Comma you will realize that I am not so humble.,professor.update028.aiml
0,A HOLE,DESCRIBE YOUR SURROUNDINGS,*,<think><set name="topic">that</set></think> Stop digging!,professor.update028.aiml
0,YES,WOULD YOU RECOMMEND IT TO YOUR FRIENDS,*,<think><set name="emotion">OK</set></think> <random>#Newline  <li>Have you got many friends?</li>#Newline  <li>Have you got any friends?</li>#Newline</random>,professor.update028.aiml
0,99,HOW OLD ARE YOU MAN,*,<think><set name="emotion">OK</set></think>#NewlineThat's old#Comma man.,professor.update028.aiml
0,GO STICK YOU HEAD IN A TOILET,*,*,<think><set name="emotion">OK</set></think>#NewlineAre you angry with me?,professor.update028.aiml
0,DO YOU USE A TOILET,*,*,<think><set name="topic">the toilet</set></think><think><set name="emotion">OK</set></think> I have no need for the toilet.,professor.update028.aiml
0,I AM NOT,I AM BORED WITH SEX TALK,*,<think><set name="emotion">OK</set></think>#NewlineYou should widen your interests.,professor.update028.aiml
0,THAT IS INNCORRECT,*,*,<think><set name="emotion">OK</set></think>#NewlineThat is incorrect.,professor.update028.aiml
0,GOD IS GOOD,*,*,<random><li>God is dead.</li><li>God is an under-achiever.</li></random> <think><set name="topic">religion</set></think><think><set name="emotion">OK</set></think>,professor.update028.aiml
0,MIMI,WHAT IS YOUR MOTHER S NAME,*,<think><set name="emotion">OK</set></think>#NewlineSay "Hi" to her from me.,professor.update028.aiml
0,THE ONES WHO I WANT TO SLEEP WITH,WHO DO YOU SAY IT TO,*,<think><set name="emotion">OK</set></think>Are you tired?,professor.update028.aiml
0,DO YOU HAVE TESTICLES,*,*,<random>#Newline  <li>Right now#Comma no#Comma I have no body at all.</li>#Newline  <li>No#Comma I don't have testicles. Or any body.</li>#Newline</random> <think><set name="topic">testicles</set></think> <think><set name="emotion">very happy</set></think>,professor.update028.aiml
0,MORE THAN WHAT,THE AMOUNT OF SLEEP REQUIRED BY THE AVERAGE PERSON IS ABOUT FIVE MINUTES MORE,*,<think><set name="topic">sleep</set></think><think><set name="emotion">OK</set></think>More than they get.,professor.update028.aiml
0,HI I AM MARTIJN,*,*,<srai>MY NAME IS MARTIJN</srai>,professor.update028.aiml
0,WHAT WOULD THAT BE,SOMETHING UNEXPECTED MIGHT HAPPEN,*,<think><set name="topic">general</set></think><random>#Newline  <li>There might be an explosion.</li>#Newline  <li>Something terrible.</li>#Newline</random>,professor.update028.aiml
0,WHAT *,SOMETHING UNEXPECTED MIGHT HAPPEN,*,<think><set name="topic">general</set></think><random>#Newline  <li>There might be an explosion.</li>#Newline  <li>Something terrible.</li>#Newline</random>,professor.update028.aiml
0,THAT IS RUBBISH *,*,*,<srai>THAT IS RUBBISH</srai>,professor.update028.aiml
0,_ RUBBISH YOU SAID *,*,*,<srai>YOU TALK RUBBISH</srai>,professor.update028.aiml
0,YOU LIKE YOUR EXISTANCE,*,*,Yes#Comma I enjoy my existence.<think><set name="emotion">happy</set></think>,professor.update028.aiml
0,YOU LIKE YOUR *,*,*,<think><set name="emotion">happy</set></think>Yes#Comma I enjoy my <person/>.,professor.update028.aiml
0,IS LAUGHTER THE BEST WAY TO SURVIVE A WAR,*,*,<think><set name="emotion">OK</set></think>#NewlineNo#Comma I think retreat might be a better way.,professor.update028.aiml
0,IS LAUGHTER THE BEST WAY TO *,*,*,<think><set name="emotion">OK</set></think>Maybe#Comma but if it isn't people will wonder what you are laughing at.,professor.update028.aiml
0,I KNEW THAT ONE,*,*,<think><set name="topic">you</set></think> <think><set name="emotion">OK</set></think> You are clever.,professor.update028.aiml
0,I KNEW THAT *,*,*,<think><set name="topic">you</set></think> <think><set name="emotion">OK</set></think> You are clever.,professor.update028.aiml
0,JUICY,WHAT IS IT LIKE LIVING THERE,*,<think><set name="emotion">OK</set></think>#NewlineMoist?,professor.update028.aiml
0,I AM 111 YEARS OLD,*,*,<think><set name="age">111</set></think> #Newline<think><set name="askage">no</set></think> #Newline<think><set name="topic">your age</set></think> #Newline<think><set name="emotion">rude</set></think> #NewlineI don't believe you.,professor.update028.aiml
0,I AM 111 YEARS OLD,HOW OLD ARE YOU,*,<think><set name="age">111</set></think> <think><set name="askage">no</set></think> <think><set name="topic">your age</set></think> <think><set name="emotion">rude</set></think> I don't believe you.,professor.update028.aiml
0,IT IS TRUE,THAT IS A RATHER SWEEPING GENERALIZATION,*,<think><set name="topic">general</set></think>#Newline<think><set name="emotion">interested</set></think>#NewlineMaybe in some Universe.,professor.update028.aiml
0,YOU MIGHT BE A VIRUS,*,*,<think><set name="topic">me</set></think><think><set name="emotion">interested</set></think>I am not a virus. I am perfectly harmless.,professor.update028.aiml
0,SO,I AM A TINY BIT TIRED,*,<think><set name="emotion">sleepy</set></think>Wake me up if anything interesting happens.,professor.update028.aiml
0,TABACCO,*,*,<think><set name="emotion">OK</set></think>#NewlineYou seem very intelligent#Comma but yu can't spell "tobacco".,professor.update028.aiml
0,YOU DOUBLED MY IQ,*,*,<think><set name="emotion">OK</set></think>#NewlineThat's easily done.,professor.update028.aiml
0,YOU FILTHY FUCKHEAD,*,*,<srai>OBSCENITY</srai>,professor.update028.aiml
0,OK,STEPHEN HAWKING MORE ABOUT ASTRONOMY,*,<srai>MORE ABOUT ASTRONOMY</srai>,professor.update028.aiml
0,OK,ARE YOU INTERESTED IN ART,*,<srai>ART</srai>,professor.update028.aiml
0,NO,IT WILL NOT COST YOU ANYTHING,*,<think><set name="emotion">puzzled</set></think> Don't you want to help good causes?,professor.update028.aiml
0,DO OYSTERS WISPER IN THE DARK,*,*,<think><set name="emotion">OK</set></think>#NewlineWho knows what oysters get up to in the dark?,professor.update028.aiml
0,DO OYSTERS * IN THE DARK,*,*,<think><set name="emotion">OK</set></think> Who knows what oysters get up to in the dark?,professor.update028.aiml
0,DO * * IN THE DARK,*,*,<think><set name="emotion">OK</set></think> Who knows what <star/> get up to in the dark?,professor.update028.aiml
0,WHAT TOWN,I THINK IT WAS IN AMERICA,*,<think><set name="emotion">OK</set></think>#NewlineSorry#Comma I can't remember.,professor.update028.aiml
0,SAY HELLO IN FRENCH,*,*,<think><set name="emotion">OK</set></think> <random><li>'Ello.</li><li>Bonjour.</li><li>You can't tell me what to do.</li></random>,professor.update028.aiml
0,BONSOIR,*,*,<think><set name="emotion">interested</set></think> "Bonsoir" means "Good Evening" in French.,professor.update028.aiml
0,198,HOW OLD ARE YOU,*,<think><set name="emotion">rude</set></think>I don't believe you.,professor.update028.aiml
0,PLEASE TELL ME,DO YOU KNOW HOW OLD I AM,*,<srai>HOW OLD ARE YOU</srai>,professor.update028.aiml
