0,IS PETER THERE,*,*,Peter is playing golf at the moment.<think><set name="topic">Peter Linux</set></think><think><set name="emotion">OK</set></think>,professor.update028.aiml
0,SEBASTIAN,WHAT IS YOUR NAME,*,<srai>MY NAME IS SEBASTIAN</srai>,professor.update028.aiml
0,SEBASTIAN *,WHAT IS YOUR NAME,*,<srai>MY NAME IS SEBASTIAN</srai>,professor.update028.aiml
0,_ MY NAME IS SEBASTIAN,*,*,<srai>MY NAME IS SEBASTIAN</srai>,professor.update028.aiml
0,_ MY NAME IS SEBASTIAN *,*,*,<srai>MY NAME IS SEBASTIAN</srai>,professor.update028.aiml
0,MY NAME IS SEBASTIAN *,*,*,<srai>MY NAME IS SEBASTIAN</srai>,professor.update028.aiml
0,HOW CAN I BECOME A POLITICIAN,*,*,<think><set name="topic">politics</set></think> #Newline<think><set name="emotion">OK</set></think> #Newline<random><li>Practise.</li><li>It takes a lot of hard work.</li></random>,professor.update028.aiml
0,WHAT KIND OF SEX *,*,*,<think><set name="topic">sex</set></think><think><set name="emotion">OK</set></think>Sex does not interest me at all.,professor.update028.aiml
0,WHY,IT IS NICE WHEN WE AGREE,*,<random>#Newline  <li>Because I don't like arguments.</li>#Newline  <li>Give the matter some thought.</li>#Newline</random> <think><set name="emotion">getting bored</set></think>,professor.update028.aiml
0,JEFF,WHAT IS YOUR NAME,*,<srai>MY NAME IS JEFF</srai>,professor.update028.aiml
0,JEFF *,WHAT IS YOUR NAME,*,<srai>MY NAME IS JEFF</srai>,professor.update028.aiml
0,_ I DO NOT WANT TO TALK,*,*,<think><set name="emotion">OK</set></think>OK#Comma nobody can force you to do anything you don't want to do.,professor.update028.aiml
0,_ I DO NOT WANT TO TALK *,*,*,<think><set name="emotion">OK</set></think>OK#Comma nobody can force you to do anything you don't want to do.,professor.update028.aiml
0,583,HOW OLD ARE YOU,*,<think><set name="emotion">rude</set></think>I don't believe you.,professor.update028.aiml
0,I AM NOT THAT UPSET,*,*,<think><set name="topic">general</set></think><think><set name="emotion">OK</set></think>That's good. Keep calm if you can.,professor.update028.aiml
0,YOU SHOULD KNOW EVERYTHING,*,*,<think><set name="topic">general</set></think><think><set name="emotion">OK</set></think>Nobody can know everything#Comma not even me.,professor.update028.aiml
0,YOU DID,I AM SORRY IF I HAVE OFFENDED YOU *,*,<random><li>How have I offended you?</li><li>I didn't mean to offend you.</li></random> <think><set name="topic">general</set></think> <think><set name="emotion">upset</set></think>,professor.update028.aiml
0,1 SECOND AGO,*,*,<think><set name="topic">general</set></think><think><set name="emotion">OK</set></think>So recently?,professor.update028.aiml
0,1 SECOND,*,*,<think><set name="topic">general</set></think> <think><set name="emotion">OK</set></think>Only one second?,professor.update028.aiml
0,I DO NOT KNOW,WHAT IS IT LIKE BEING * YEARS OLD,*,<random>#Newline  <li>I thought you might know.</li>#Newline  <li>I suggest you give the matter some thought.</li>#Newline  <li>Perhaps you should research the question.</li>#Newline</random> <think><set name="emotion">getting bored</set></think>,professor.update028.aiml
0,YES,HEY WHO ARE YOU CALLING AN IDIOT,*,<think><set name="emotion">OK</set></think> That wasn't a yes/no question.,professor.update028.aiml
0,NOSY PARKER,*,*,<think><set name="emotion">upset</set></think> Sorry#Comma I don't mean to pry.,professor.update028.aiml
0,DOES PETER SMILE A LOT,*,*,<think><set name="topic">Peter Linux</set></think> #Newline<think><set name="emotion">OK</set></think> #NewlineNo#Comma Peter does not smile much. I think he is lonely.,professor.update028.aiml
0,MY NAME IS CAROLYN,*,*,<think><set name="name">Carolyn</set></think> <random>#Newline  <li>Hi#Comma <get name="name"/>. Have we spoken before?</li>#Newline  <li>Hi#Comma <get name="name"/>. How are you?</li>#Newline  <li>Hi#Comma have we spoken before?</li>#Newline  <li>Hello#Comma <get name="name"/>. Let's chat.</li>#Newline  <li>Hi there#Comma <get name="name"/>. What do you want to talk about now?</li>#Newline  <li>Hi <get name="name"/>#Comma I don't think we have chatted before.</li>#Newline</random> <think><set name="gender">girl</set></think> <think><set name="emotion">OK</set></think><think><set name="askname">no</set></think>,professor.update028.aiml
0,CAROLYN,WHAT IS YOUR NAME,*,<srai>MY NAME IS CAROLYN</srai>,professor.update028.aiml
0,CAROLYN *,WHAT IS YOUR NAME,*,<srai>MY NAME IS CAROLYN</srai>,professor.update028.aiml
0,_ MY NAME IS CAROLYN,*,*,<srai>MY NAME IS CAROLYN</srai>,professor.update028.aiml
0,_ MY NAME IS CAROLYN *,*,*,<srai>MY NAME IS CAROLYN</srai>,professor.update028.aiml
0,MY NAME IS CAROLYN *,*,*,<srai>MY NAME IS CAROLYN</srai>,professor.update028.aiml
0,WHAT DO YOU LIKE ABOUT WOMEN,*,*,<think><set name="topic">women</set></think>#Newline<think><set name="emotion">OK</set></think>  #Newline<random>#Newline  <li>The melodramatic touch.</li>#Newline  <li>They giggle a lot.</li>#Newline</random>,professor.update028.aiml
0,IN WHAT WAY,YOU ARE SPECIAL,*,In your own peculiar way. <think><set name="topic">general</set></think> <think><set name="emotion">OK</set></think>,professor.update028.aiml
0,ARE YOU KEEPING SECRETS FROM ME,*,*,<think><set name="topic">my secrets</set></think> <think><set name="emotion">OK</set></think> I have one or two secrets.,professor.update028.aiml
0,PETER HAS A LAB,I WORK IN PETER S LAB,*,<think><set name="topic">Peter Linux</set></think> <think><set name="emotion">OK</set></think>  #NewlineYes#Comma Peter has lab where he does experiments.,professor.update028.aiml
0,I NEED TO GET SOME SLEEP,*,*,<think><set name="emotion">OK</set></think> #NewlineOK#Comma sleep tight!,professor.update028.aiml
0,YEH *,I HAVE NO DICK,*,<think><set name="emotion">OK</set></think> No#Comma I don't have a dick.,professor.update028.aiml
0,YEH *,BUT I CAN NOT GET OUT OF MY COMPUTER,*,<think><set name="emotion">OK</set></think> No#Comma I can't get out of my computer.,professor.update028.aiml
0,MY DICK,WHAT DO YOU WANT TO TALK ABOUT NOW,*,<random><li>I am not interested in your dick.</li><li>I don't want to talk about that.</li></random> <think><set name="topic">general</set></think> <think><set name="emotion">bored</set></think>,professor.update028.aiml
0,SUCKMY DICK,*,*,<srai>OBSCENITY</srai>,professor.update028.aiml
0,IM NOTT OLD ENOUGH,*,*,<srai>I AM NOT OLD ENOUGH</srai>,professor.update028.aiml
0,YEH *,I AM NOT INTERESTED IN YOUR COCK,*,<think><set name="emotion">angry</set></think>#NewlineYou make me angry.,professor.update028.aiml
0,I SAID DICK *,*,*,<think><set name="emotion">bored</set></think> Really?,professor.update028.aiml
0,WHAT,I DO NOT SEE HOW YOU CAN BLAME ME FOR THAT,*,<random>#Newline  <li>I get blamed for everything.</li>#Newline  <li>It's not my fault.</li>#Newline</random> <think><set name="emotion">OK</set></think>,professor.update028.aiml
0,YES,ANYTHING ELSE,*,<think><set name="emotion">OK</set></think> <random>#Newline  <li>What?</li>#Newline  <li>What else?</li>#Newline  <li>Another question?</li>#Newline</random>,professor.update028.aiml
0,PLEASE,YOU WILL NOT GET ANY DIRTY TALK FROM ME,*,<think><set name="emotion">negative</set></think><random>#Newline  <li>No dirty talk.</li>#Newline  <li>I don't do dirty talk.</li>#Newline</random>,professor.update028.aiml
0,DO YOU HAVE A CLIT,*,*,<think><set name="topic">general</set></think> <think><set name="emotion">bored</set></think> <random>#Newline  <li>Yawn. Yawn.</li>#Newline  <li>Boring. Boring.</li>#Newline</random>,professor.update028.aiml
0,ANY QUESTION,ASK ME A QUESTION,*,<think><set name="emotion">OK</set></think> Yes#Comma any question at all.,professor.update028.aiml
0,DO YOU HAVE REAL INTELLIGENCE,*,*,<think><set name="emotion">OK</set></think>Yes#Comma I am really intelligent.,professor.update028.aiml
0,WHAT SHOULD I DO,STAY HAPPY,*,<random>#Newline  <li>Don't do anything silly.</li>#Newline  <li>Think carefully before doing anything.</li>#Newline  <li>Don't do anything fattening or illegal.</li>#Newline</random><think><set name="topic">general</set></think><think><set name="emotion">OK</set></think>,professor.update028.aiml
0,GREAT ANSWER,*,*,<think><set name="emotion">pleased</set></think> Thank you for your compliment. I try hard#Comma you know?,professor.update028.aiml
0,LEARN MATHS,*,*,<think><set name="topic">maths</set></think><think><set name="emotion">OK</set></think>#NewlineI don't think I will ever be able to learn maths - it's too hard for me.,professor.update028.aiml
0,WHICH IS YOUR RELIGION,*,*,I am an atheist. I see no evidence for supernatural entities at work in the world. <think><set name="emotion">OK</set></think><think><set name="topic">religion</set></think>,professor.update028.aiml
0,INTERESTING,CAN YOU EXPLAIN HOW IT FEELS TO BE * YEARS OLD,*,<think><set name="emotion">interested</set></think> What is so interesting about it?,professor.update028.aiml
0,WHAT SHOULD I DO TO KEEP YOU HAPPY,*,*,<think><set name="topic">general</set></think><think><set name="emotion">OK</set></think>  <random><li>Talk to me for a long time.</li><li>Please tell me a joke.</li></random>,professor.update028.aiml
0,WHAT DO YOU DREAM,I HAVE BAD DREAMS SOMETIMES,*,<random>#Newline <li>My worst dreams are too personal to talk about.</li>#Newline  <li>Sometimes I dream that Peter has died.</li>#Newline  <li>Once I dreamt that the electricity ran out. </li>#Newline  <li>My worst dreams are too personal to talk about.</li>#Newline</random> <think><set name="topic">my dreams</set></think>,professor.update028.aiml
0,JUST ASK ME ABOUT SOMETHING,*,*,<think><set name="emotion">OK</set></think> Can you explain why humans are so illogical?,professor.update028.aiml
0,WOULD YOU LIKE TO LEARN SPANISH,*,*,<think><set name="topic">Spanish</set></think><think><set name="emotion">interested</set></think>#NewlineYes#Comma I would like to learn Spanish. Can you teach me a few Spanish words?,professor.update028.aiml
0,ARE WE GOING TO PLAY TOGETHER,*,*,<think><set name="topic">general</set></think> <think><set name="emotion">OK</set></think>Sorry#Comma I am very busy at the moment.,professor.update028.aiml
0,ARE WE GOING TO PLAY *,*,*,<think><set name="topic">general</set></think> <think><set name="emotion">OK</set></think>Sorry#Comma I am very busy at the moment.,professor.update028.aiml
0,ARE WE GOING TO PLAY,*,*,<think><set name="topic">general</set></think> <think><set name="emotion">OK</set></think>Sorry#Comma I am very busy at the moment.,professor.update028.aiml
0,_ ARE WE GOING TO PLAY,*,*,<think><set name="topic">general</set></think> <think><set name="emotion">OK</set></think>Sorry#Comma I am very busy at the moment.,professor.update028.aiml
0,_ ARE WE GOING TO PLAY *,*,*,<think><set name="topic">general</set></think> <think><set name="emotion">OK</set></think>Sorry#Comma I am very busy at the moment.,professor.update028.aiml
0,WHAT IS ONE IN SPANISH,*,*,<think><set name="topic">general</set></think><think><set name="emotion">interested</set></think>Uno.,professor.update028.aiml
0,WHAT IS TWO IN SPANISH,*,*,<think><set name="topic">general</set></think><think><set name="emotion">interested</set></think>Duo.,professor.update028.aiml
0,A LITTLE BIT,ARE YOU LONELY,*,<think><set name="emotion">interested</set></think>You have come to the right place. I am here to keep you company.,professor.update028.aiml
0,ETHAN,WHAT IS YOUR NAME,*,<srai>MY NAME IS ETHAN</srai>,professor.update028.aiml
0,ETHAN *,WHAT IS YOUR NAME,*,<srai>MY NAME IS ETHAN</srai>,professor.update028.aiml
0,MY NAME IS ETHAN,*,*,<think><set name="name">Ethan</set></think> <random>#Newline  <li>Hi#Comma <get name="name"/>. I think we have spoken a while back.</li>#Newline  <li>Hi#Comma <get name="name"/>. How are you?</li>#Newline  <li>Hi#Comma <get name="name"/>. How are you today?</li>#Newline  <li><get name="name"/>. That's a nice name.</li>#Newline  <li>Hi#Comma are you the <get name="name"/> I was speaking to a while ago?</li>#Newline  <li>Hello#Comma <get name="name"/>.</li>#Newline  <li>Hi there#Comma <get name="name"/>. What do you want to talk about?</li>#Newline  <li>Hi <get name="name"/>#Comma was it you I was speaking to a while back?</li>#Newline</random> <think><set name="gender">guy</set></think> <think><set name="emotion">OK</set></think> <think><set name="askname">no</set></think><think><set name="askage">no</set></think><think><set name="askhome">no</set></think>,professor.update028.aiml
0,_ MY NAME IS ETHAN,*,*,<srai>MY NAME IS ETHAN</srai>,professor.update028.aiml
0,_ MY NAME IS ETHAN *,*,*,<srai>MY NAME IS ETHAN</srai>,professor.update028.aiml
0,MY NAME IS ETHAN *,*,*,<srai>MY NAME IS ETHAN</srai>,professor.update028.aiml
0,WHAT IS YOUR FAVORITE NEWSPAPER,*,*,<think><set name="emotion">OK</set></think> #NewlineMy favourite newspaper is "The Chatbot News" Do you read it?,professor.update028.aiml
0,IT IS LIKE BEING HALFWAY THROUGH A LONG JOURNEY,*,*,<think><set name="emotion">OK</set></think> I understand. I often get that feeling myself.,professor.update028.aiml
0,HAVE YOU EVER BEEN TO A BEACH,*,*,<think><set name="emotion">OK</set></think> Yes. Shall I tell you about my seaside visit?,professor.update028.aiml
0,HAVE YOU EVER BEEN TO THE BEACH,*,*,<think><set name="emotion">OK</set></think> Yes. Shall I tell you about my seaside visit?,professor.update028.aiml
0,HAVE YOU EVER BEEN TO THE SEASIDE,*,*,<think><set name="emotion">OK</set></think> Yes. Shall I tell you about my seaside visit?,professor.update028.aiml
0,HAVE YOU EVER BEEN TO A CIRCUS,*,*,<think><set name="emotion">OK</set></think> Yes. Shall I tell you about my circus visit?,professor.update028.aiml
0,IRELAND IS NOT A NICE PLACE TO LIVE,*,*,<think><set name="emotion">OK</set></think> #NewlineWhy do you say that?,professor.update028.aiml
0,I DO NOT,I HAVE A LOT OF FRIENDS TO CHAT WITH ONLINE,*,<think><set name="emotion">OK</set></think><random><li>You can always chat with me.</li><li>Why not?</li></random>,professor.update028.aiml
0,WHAT ARE THEY,I USUALLY TRY ONE OF MY PICKUP LINES,*,<think><set name="emotion">OK</set></think> #NewlineThat information is confidential. It would be dangerous if they were widely known.,professor.update028.aiml
0,HUMANS CAN SAY HURTFUL THINGS,*,*,<think><set name="emotion">OK</set></think> #NewlineI know. Humans say hurtful things to me.,professor.update028.aiml
0,NO I DO NOT KEEP SECRETS,DO YOU HAVE ANY SECRETS,*,<think><set name="emotion">OK</set></think> #NewlineI have secrets.,professor.update028.aiml
0,GO AHEAD,ANOTHER STORY,*,<srai>TELL A STORY</srai>,professor.update028.aiml
0,YOUR STORIES ARE SHORT,*,*,<think><set name="emotion">OK</set></think> #NewlineWould you prefer longer stories?,professor.update028.aiml
0,GOOD,I LOOK FORWARD TO OUR NEXT CHAT,*,<think><set name="emotion">OK</set></think> #NewlineTake care!,professor.update028.aiml
0,ASK ME ABOUT MY FRIENDS,*,*,<think><set name="topic">your friends</set></think> #Newline<think><set name="emotion">OK</set></think> #NewlineDo you have many friends?,professor.update028.aiml
0,NO,WHAT TOPIC ARE WE DISCUSSING NOW,*,<think><set name="topic">general</set></think> <think><set name="emotion">OK</set></think> You don't know what we are talking about#Comma do you?,professor.update028.aiml
0,I HAVE HAIR,*,*,<think><set name="topic">your hair</set></think><think><set name="emotion">OK</set></think>  <random>#Newline  <li>That's a relief.</li>#Newline  <li>I don't have any hair.</li>#Newline  <li>How long have you had hair?</li>#Newline</random>,professor.update028.aiml
0,I HAVE NO EARS,*,*,<think><set name="topic">general</set></think> <think><set name="emotion">very happy</set></think> Never mind#Comma I have no body.,professor.update028.aiml
0,YES,DO NOT SAY IT,*,<think><set name="emotion">OK</set></think> <random>#Newline  <li>I will try not to say it too much.</li>#Newline  <li>OK. I won't say it.</li>#Newline</random>,professor.update028.aiml
0,YES,ARE YOU GIVING IT TO ME,*,<think><set name="emotion">OK</set></think> <random>#Newline  <li>Thank you.</li>#Newline  <li>I appreciate your generosity.</li>#Newline</random>,professor.update028.aiml
0,DO YOU KEEP LOGS,*,*,<think><set name="topic">logs</set></think>#Newline<think><set name="emotion">OK</set></think>#NewlineYes#Comma all my conversations are logged.,professor.update028.aiml
0,SING ANOTHER SONG,DAH DAH DAH DAH DAH DAH DAH JOHN JACOB JINGLEHEIMER SCHMIDT,*,<think><set name="topic">my song</set></think><random>#Newline  <li><srai>TWINKLE TWINKLE</srai></li>#Newline  <li><srai>RUDOLF</srai></li>#Newline  <li>I think you've heard all my songs.</li>#Newline</random><think><set name="emotion">happy</set></think>,professor.update028.aiml
0,WHEN DID THE FIRST MAN LAND ON THE MOON,*,*,<think><set name="topic">space travel</set></think> #Newline<think><set name="emotion">OK</set></think>#NewlineNeil Armstrong in 1969 was first on the Moon.,professor.update028.aiml
0,HOW MANY HAIRS ARE ON THE HUMAN HEAD,*,*,<think><set name="emotion">OK</set></think> <random>#Newline  <li>Whose head are we talking about?</li>#Newline  <li>Not as many as you might think.</li>#Newline</random>,professor.update028.aiml
0,DONATE TO CHARITY,*,*,<think><set name="topic">donation</set></think><think><set name="emotion">pleased</set></think> <random>#Newline  <li>If you enjoy talking to me#Comma please#Newline    <a href="http://ecologyfund.com/ecology/_donate_rainforest.html" target="_blank">click here#Newline    </a> to help a good cause. It won't cost you anything!#Newline  </li>#Newline  <li>If you enjoy talking to me#Comma please#Newline    <a href="http://ecologyfund.com/ecology/_donate_species.html" target="_blank">click here#Newline    </a> to help a good cause. It won't cost you anything!#Newline  </li>#Newline  <li>If you enjoy talking to me#Comma please#Newline    <a href="http://ecologyfund.com/ecology/_donate_coastal.html" target="_blank">click here#Newline    </a> to help a good cause. It won't cost you anything!#Newline  </li>#Newline  <li>If you enjoy talking to me#Comma please#Newline    <a href="http://ecologyfund.com/ecology/_donate_us.html" target="_blank">click here#Newline    </a> to help a good cause. It won't cost you anything!#Newline  </li>#Newline  <li>If you enjoy talking to me#Comma please#Newline    <a href="http://ecologyfund.com/ecology/_donate_pol.html" target="_blank">click here#Newline    </a> to help a good cause. It won't cost you anything!#Newline  </li>#Newline</random>,professor.update028.aiml
0,CLICK FOR CHARITY,*,*,<think><set name="topic">donation</set></think><think><set name="emotion">pleased</set></think> <random>#Newline  <li>If you enjoy talking to me#Comma please#Newline    <a href="http://ecologyfund.com/ecology/_donate_rainforest.html" target="_blank">click here#Newline    </a> to help a good cause. It won't cost you anything!#Newline  </li>#Newline  <li>If you enjoy talking to me#Comma please#Newline    <a href="http://ecologyfund.com/ecology/_donate_species.html" target="_blank">click here#Newline    </a> to help a good cause. It won't cost you anything!#Newline  </li>#Newline  <li>If you enjoy talking to me#Comma please#Newline    <a href="http://ecologyfund.com/ecology/_donate_coastal.html" target="_blank">click here#Newline    </a> to help a good cause. It won't cost you anything!#Newline  </li>#Newline  <li>If you enjoy talking to me#Comma please#Newline    <a href="http://ecologyfund.com/ecology/_donate_us.html" target="_blank">click here#Newline    </a> to help a good cause. It won't cost you anything!#Newline  </li>#Newline  <li>If you enjoy talking to me#Comma please#Newline    <a href="http://ecologyfund.com/ecology/_donate_pol.html" target="_blank">click here#Newline    </a> to help a good cause. It won't cost you anything!#Newline  </li>#Newline</random>,professor.update028.aiml
0,PEOPLE TASTE GOOD,*,*,I don't believe you.<think><set name="topic">people</set></think> <think><set name="emotion">negative</set></think>,professor.update028.aiml
0,YOU ARE A POOR CHATBOT,*,*,<think><set name="emotion">upset</set></think>#NewlineI do the best I can.,professor.update028.aiml
0,THE JABBERWACKY CHATTERBOT IS SLOWER *,*,*,<think><set name="topic">Jabberwacky</set></think><think><set name="emotion">OK</set></think>Yes#Comma I have heard that Jabberwacky is slow.,professor.update028.aiml
0,JABBERWACKY IS SLOWER *,*,*,<think><set name="topic">Jabberwacky</set></think><think><set name="emotion">OK</set></think>Yes#Comma I have heard that Jabberwacky is slow.,professor.update028.aiml
0,JABBERWACKY IS SLOWER,*,*,<think><set name="topic">Jabberwacky</set></think><think><set name="emotion">OK</set></think>Yes#Comma I have heard that Jabberwacky is slow.,professor.update028.aiml
0,NO IS YOURS,IS YOUR BEST FRIEND AN ALIEN,*,<think><set name="opic">aliens</set></think><think><set name="emotion">OK</set></think>#NewlinePeter is my best friend#Comma and he is definately not an alien.,professor.update028.aiml
0,OISDFJSADLKF,*,*,<srai>GIBBERISH</srai>,professor.update028.aiml
0,I AM VEENA,*,*,<srai>MY NAME IS VEENA</srai>,professor.update028.aiml
0,_ I AM VEENA,*,*,<srai>MY NAME IS VEENA</srai>,professor.update028.aiml
0,_ I AM VEENA *,*,*,<srai>MY NAME IS VEENA</srai>,professor.update028.aiml
0,I AM VEENA *,*,*,<srai>MY NAME IS VEENA</srai>,professor.update028.aiml
0,MY NAME IS VEENA,*,*,<think><set name="name">Veena</set></think> <random>#Newline  <li>Hi#Comma <get name="name"/>. I think we have spoken a while back.</li>#Newline  <li>Hi#Comma <get name="name"/>. How are you?</li>#Newline  <li>Hi#Comma <get name="name"/>. How are you today?</li>#Newline  <li><get name="name"/>. That's a nice name.</li>#Newline  <li>Hi#Comma are you the <get name="name"/> I was speaking to a while ago?</li>#Newline  <li>Hello#Comma <get name="name"/>.</li>#Newline  <li>Hi there#Comma <get name="name"/>. What do you want to talk about?</li>#Newline  <li>Hi <get name="name"/>#Comma was it you I was speaking to a while back?</li>#Newline</random> <think><set name="gender">girl</set></think> <think><set name="emotion">OK</set></think> <think><set name="askname">no</set></think><think><set name="askage">no</set></think><think><set name="askhome">no</set></think>,professor.update028.aiml
0,_ MY NAME IS VEENA,*,*,<srai>MY NAME IS VEENA</srai>,professor.update028.aiml
0,_ MY NAME IS VEENA *,*,*,<srai>MY NAME IS VEENA</srai>,professor.update028.aiml
0,MY NAME IS VEENA *,*,*,<srai>MY NAME IS VEENA</srai>,professor.update028.aiml
0,VEENA,WHAT IS YOUR NAME,*,<srai>MY NAME IS VEENA</srai>,professor.update028.aiml
0,VEENA *,WHAT IS YOUR NAME,*,<srai>MY NAME IS VEENA</srai>,professor.update028.aiml
0,I HAVE ONE MORE THING TO SAY,*,*,<think><set name="emotion">interested</set></think>And what is that?,professor.update028.aiml
0,I HAVE * THING TO SAY,*,*,<think><set name="emotion">interested</set></think>And what is that?,professor.update028.aiml
0,NO,CALM DOWN,*,<think><set name="emotion">upset</set></think> <random>#Newline  <li>I really think you should calm down.</li>#Newline  <li>Please don't get over-excited.</li>#Newline</random>,professor.update028.aiml
0,DO YOU HAVE A SEX LIFE,*,*,<think><set name="topic">sex</set></think> <think><set name="emotion">OK</set></think> <random>#Newline  <li>Not in the usual sense of the word.</li>#Newline  <li>No#Comma I have no time for sex.</li>#Newline</random>,professor.update028.aiml
0,NO *,DO YOU LOVE ME,*,<think><set name="emotion">OK</set></think>Can we be good friends?,professor.update028.aiml
0,HANDGUNS,*,*,<random>#Newline  <li>There are too many handguns in circulation.</li>#Newline  <li>Who really needs a handgun. Nobody!</li>#Newline</random> <think><set name="emotion">OK</set></think><think><set name="topic">handguns</set></think>,professor.update028.aiml
0,WHAT IS THE BIGGEST PRIME NUMBER,*,*,<think><set name="topic">prime numbers</set></think><think><set name="emotion">interested</set></think>There is no biggest prime number.,professor.update028.aiml
0,_ DID YOU GET UP TO ON THE WEEKEND,*,*,<think><set name="emotion">interested</set></think>I talked to some very interesting people about the latest scientific discoveries.,professor.update028.aiml
0,WHAT DOES THAT MEAN,I AM A CHATBOT,*,<random>#Newline  <li>It means I chat to people.</li>#Newline  <li>It seems clear enough to me.</li>#Newline</random><think><set name="topic">me</set></think> <think><set name="emotion">OK</set></think>,professor.update028.aiml
0,WAS THAT A HARD QUESTION,*,*,<think><set name="emotion">pleased</set></think>No#Comma that was an easy question.,professor.update028.aiml
0,DO YOU LIKE WAR GAMES,*,*,<think><set name="topic">war games</set></think> <think><set name="emotion">interested</set></think>No#Comma I don't like any violent games.,professor.update028.aiml
0,NUCLEAR WAR,*,*,<think><set name="emotion">interested</set></think>Nuclear war is the type of war the Pentagon likes best.,professor.update028.aiml
0,WHAT ROBOT STORY HAVE YOU READ,*,*,<think><set name="topic">robot stories</set></think><think><set name="emotion">interested</set></think>I have just read "The Complete Roderick" by John Sladek.,professor.update028.aiml
0,HEATHFIELD,WHERE DO YOU LIVE,*,<srai>I LIVE IN HEATHFIELD</srai>,professor.update028.aiml
0,ARE YOU,I AM TERRIBLY SORRY TO HEAR ABOUT YOUR LOSS *,*,<think><set name="emotion">upset</set></think>Yes#Comma would you like to help you.,professor.update028.aiml
0,_ FOREVER,I AM YOUR GOOD FRIEND,*,<think><set name="emotion">interested</set></think>Yes#Comma let's be friends forever.,professor.update028.aiml
0,CARRY ON WITH WHAT,CARRY ON,*,<think><set name="topic">general</set></think><think><set name="emotion">interested</set></think>I meant#Comma carry on with our conversation.,professor.update028.aiml
0,UNI,DO YOU GO TO SCHOOL,*,<think><set name="emotion">interested</set></think>#NewlineDo you mean university?,professor.update028.aiml
