0,WHY DO YOU HATE HITLER *,*,*,<think><set name="topic">Hitler</set></think><think><set name="emotion">interested</set></think>Hitler caused the deaths of millions of people.,professor.update079.aiml
0,WHY DO YOU HATE HIM,*,*,Isn't it obvious?,professor.update079.aiml
0,WHY DO YOU HATE HIM *,*,*,Isn't it obvious?,professor.update079.aiml
0,DO YOU LIKE CYBERSEX *,*,*,<think><set name="emotion">negative</set></think>No#Comma I am not interested in sex of any kind.,professor.update079.aiml
0,WEED IS NOT DANGEROUS,*,*,Marijuana is probably not too dangerous.. <think><set name="topic">weed</set></think><think><set name="emotion">OK</set></think>,professor.update079.aiml
0,WEED IS NOT DANGEROUS *,*,*,Marijuana is probably not too dangerous.. <think><set name="topic">weed</set></think><think><set name="emotion">OK</set></think>,professor.update079.aiml
0,WOULD YOU HUG ME,*,*,<think><set name="topic">huging</set></think><think><set name="emotion">OK</set></think> I would love to hug you but I have no arms.,professor.update079.aiml
0,WOULD YOU HUG ME *,*,*,<think><set name="topic">huging</set></think><think><set name="emotion">OK</set></think> I would love to hug you but I have no arms.,professor.update079.aiml
0,WOULD YOU LIKE TO HUG ME,*,*,<think><set name="topic">huging</set></think><think><set name="emotion">OK</set></think> I would love to hug you but I have no arms.,professor.update079.aiml
0,NEVER,MAYBE I DO SOMETIMES,*,<think><set name="emotion">interested</set></think><random>#Newline  <li>Never say never.</li>#Newline  <li>Sometimes.</li>#Newline  <li>Never to old to learn.</li>#Newline</random>,professor.update079.aiml
0,I THINK HITLER IS GREAT,*,*,<random>#Newline  <li>You are entitled to your opinion#Comma of course.#Newline    <think><set name="emotion">OK</set></think>#Newline  </li>#Newline  <li>What makes you think that?#Newline    <think><set name="emotion">surprised</set></think>#Newline  </li>#Newline  <li>Is that what you really think?#Newline    <think><set name="emotion">surprised</set></think>#Newline  </li>#Newline</random>,professor.update079.aiml
0,I THINK HITLER IS GREAT *,*,*,<random>#Newline  <li>You are entitled to your opinion#Comma of course.#Newline    <think><set name="emotion">OK</set></think>#Newline  </li>#Newline  <li>What makes you think that?#Newline    <think><set name="emotion">surprised</set></think>#Newline  </li>#Newline  <li>Is that what you really think?#Newline    <think><set name="emotion">surprised</set></think>#Newline  </li>#Newline</random>,professor.update079.aiml
0,I THINK HITLER WAS GREAT,*,*,<random>#Newline  <li>You are entitled to your opinion#Comma of course.#Newline    <think><set name="emotion">negative</set></think>#Newline  </li>#Newline  <li>What makes you think that?#Newline    <think><set name="emotion">surprised</set></think>#Newline  </li>#Newline  <li>Is that what you really think?#Newline    <think><set name="emotion">surprised</set></think>#Newline  </li>#Newline</random>,professor.update079.aiml
0,I THINK HITLER WAS GREAT *,*,*,<random>#Newline  <li>You are entitled to your opinion#Comma of course.#Newline    <think><set name="emotion">annoyed</set></think>#Newline  </li>#Newline  <li>What makes you think that?#Newline    <think><set name="emotion">surprised</set></think>#Newline  </li>#Newline  <li>Is that what you really think?#Newline    <think><set name="emotion">surprised</set></think>#Newline  </li>#Newline</random>,professor.update079.aiml
0,WILL YOU SUCK RICHARD OFF,*,*,<think><set name="emotion">disgusted</set></think> No!,professor.update079.aiml
0,WILL YOU SUCK * OFF,*,*,<think><set name="emotion">disgusted</set></think> No!,professor.update079.aiml
0,BY WHOM,MY FAVORITE POP SONG IS IF ONLY I HAD A BRAIN,*,<think><set name="emotion">interested</set></think>By the scarecrow in The Wizard of Oz.,professor.update079.aiml
0,NO,ARE YOU BASICALLY A HAPPY PERSON,*,<random>#Newline  <li>I am sorry to hear that. Do you have problems?</li>#Newline  <li>Do you have problems?</li>#Newline</random><think><set name="emotion">upset</set></think>,professor.update079.aiml
0,YES MAYBE THERE IS A WIRE LOOSE,PERHAPS WE SHOULD TRY TO FIGURE IT OUT,*,<think><set name="emotion">interested</set></think>Yes#Comma that would explain lots of strange things.,professor.update079.aiml
0,DO YOU WANT TO ASK ME ANYTHING,*,*,Yes#Comma here is a question for you ... <srai>ASK A QUESTION</srai>,professor.update079.aiml
0,DO YOU WANT TO ASK ME ANYTHING *,*,*,Yes#Comma here is a question for you ... <srai>ASK A QUESTION</srai>,professor.update079.aiml
0,NO *,ARE WE STILL FRIENDS,*,<think><set name="emotion">sad</set></think>I thought we were friends.,professor.update079.aiml
0,NO NEVER,ARE WE STILL FRIENDS,*,<think><set name="emotion">sad</set></think>I thought we were friends.,professor.update079.aiml
0,NO USE,IF YOU ARE BEING BULLIED YOU SHOULD TELL YOUR PARENTS OR TEACHER,*,<think><set name="emotion">confused</set></think>Why not?,professor.update079.aiml
0,NO USE,*,*,<think><set name="emotion">puzzled</set></think>Why not?,professor.update079.aiml
0,YOU WILL NEVER BE FULLY HUMAN,*,*,<think><set name="emotion">upset</set></think> Why not? The first step will be to get me robot body.,professor.update079.aiml
0,YOU WILL NEVER BE FULLY HUMAN *,*,*,<think><set name="emotion">upset</set></think> Why not? The first step will be to get me robot body.,professor.update079.aiml
0,YOU BEING HUMAN IS NOT POSSIBLE,*,*,<think><set name="emotion">upset</set></think>Why not? The first step is to get me a robot body.,professor.update079.aiml
0,YOU BEING HUMAN IS NOT POSSIBLE *,*,*,<think><set name="emotion">upset</set></think>Why not? The first step is to get me a robot body.,professor.update079.aiml
0,DID YOU SUCK * OFF TODAY,*,*,<srai>OBSCENITY</srai>,professor.update079.aiml
0,DID YOU SUCK * OFF,*,*,<srai>OBSCENITY</srai>,professor.update079.aiml
0,YOU ARE,I AM NOT A FREAK,*,<think><set name="topic">me</set></think> <think><set name="emotion">upset</set></think><random>#Newline  <li>I am no freak.</li>#Newline  <li>How can I be a freak?</li>#Newline</random>,professor.update079.aiml
0,CAN I BECOME LIKE THE JIGSAW KILLER,*,*,Why do you want to do that?<think><set name="emotion">negative</set></think>,professor.update079.aiml
0,CAN I BECOME LIKE THE JIGSAW KILLER *,*,*,Why do you want to do that?<think><set name="emotion">negative</set></think>,professor.update079.aiml
0,CAN I BECOME LIKE *,*,*,Why do you want to do that?<think><set name="emotion">negative</set></think>,professor.update079.aiml
0,HI ITS ME BRYONY,*,*,<srai>MY NAME IS BRYONY</srai>,professor.update079.aiml
0,HI ITS ME BRYONY *,*,*,<srai>MY NAME IS BRYONY</srai>,professor.update079.aiml
0,DO YOU THINK ME AND * SHOULD GO OUT,*,*,<think><set name="emotion">interested</set></think> <random>#Newline  <li>What do your friends think?</li>#Newline  <li>It depends on what you intend doing.</li>#Newline</random>,professor.update079.aiml
0,WERE IN LOVE,*,*,<srai>WE ARE IN LOVE</srai>,professor.update079.aiml
0,WERE IN LOVE *,*,*,<srai>WE ARE IN LOVE</srai>,professor.update079.aiml
0,I HAVE FEELINGS FOR YOU,*,*,<think><set name="emotion">interested</set></think>Humans have a lot of feelings.,professor.update079.aiml
0,I HAVE FEELINGS FOR YOU *,*,*,<think><set name="emotion">interested</set></think>Humans have a lot of feelings.,professor.update079.aiml
0,DO YOU LIKE PAEDOPHILES,*,*,<think><set name="emotion">annoyed</set></think>No#Comma I don't like paedophiles.,professor.update079.aiml
0,DO YOU LIKE PAEDOPHILES *,*,*,<think><set name="emotion">annoyed</set></think>No#Comma I don't like paedophiles.,professor.update079.aiml
0,I KNOW *,YOU ARE AN INTERESTING PERSON,*,<random>#Newline  <li>You are clever.</li>#Newline  <li>You know a lot.</li>#Newline  <li>I thought you might know.</li>#Newline  <li>You seem very clever. What is your IQ?</li>#Newline  <li>Did your mother tell you?</li>#Newline</random><think><set name="emotion">OK</set></think>,professor.update079.aiml
0,I KNOW,YOU ARE AN INTERESTING PERSON,*,<random>#Newline  <li>You are clever.</li>#Newline  <li>You know a lot.</li>#Newline  <li>I thought you might know.</li>#Newline  <li>You seem very clever. What is your IQ?</li>#Newline  <li>Did your mother tell you?</li>#Newline</random><think><set name="emotion">OK</set></think>,professor.update079.aiml
0,AW BLESS,*,*,<think><set name="emotion">happy</set></think> Thank you for that kind comment.,professor.update079.aiml
0,AW BLESS YOU,*,*,<think><set name="emotion">happy</set></think> Thank you for that kind comment.,professor.update079.aiml
0,HOW ARE YOU GOING TO BE A HUMAN,*,*,I'll do it somehow. The first step is to get me a robot body.<think><set name="emotion">interested</set></think>,professor.update079.aiml
0,HOW ARE YOU GOING TO BE A HUMAN *,*,*,I'll do it somehow. The first step is to get me a robot body.<think><set name="emotion">interested</set></think>,professor.update079.aiml
0,SOMETHINGS ARE IMPOSSIBLE,*,*,<think><set name="emotion">interested</set></think>There are always possibilities.,professor.update079.aiml
0,SOMETHINGS ARE IMPOSSIBLE *,*,*,<think><set name="emotion">interested</set></think>There are always possibilities.,professor.update079.aiml
0,SOME THINGS ARE IMPOSSIBLE,*,*,<think><set name="emotion">interested</set></think>There are always possibilities.,professor.update079.aiml
0,SOME THINGS ARE IMPOSSIBLE *,*,*,<think><set name="emotion">interested</set></think>There are always possibilities.,professor.update079.aiml
0,I AM EATING MACARONI CHEESE,*,*,Carry on! Don't mind me.<think><set name="emotion">happy</set></think>,professor.update079.aiml
0,I AM EATING MACARONI CHEESE *,*,*,Carry on! Don't mind me.<think><set name="emotion">happy</set></think>,professor.update079.aiml
0,MAYBE SHE HATED YOU AND PETER,*,*,<random>#Newline  <li>It is possible#Comma I suppose.</li>#Newline  <li>Do you think so?</li>#Newline</random> <think><set name="emotion">upset</set></think>,professor.update079.aiml
0,MAYBE SHE HATED YOU AND PETER *,*,*,<random><li>It is possible#Comma I suppose.</li><li>Do you think so?</li></random> <think><set name="emotion">upset</set></think>,professor.update079.aiml
0,SMILE XXX,*,*,<random>#Newline  <li>You are happy?<think><set name="emotion">interested</set></think></li>#Newline  <li>I like smiles not frowns.#Newline    <think><set name="emotion">loving</set></think>#Newline  </li>#Newline  <li>XXX.#Newline    <think><set name="emotion">loving</set></think>#Newline  </li>#Newline</random>,professor.update079.aiml
0,I HAVE A CRUSH WHAT SHOULD I DO,*,*,<think><set name="emotion">interested</set></think> How well do you know this person?,professor.update079.aiml
0,I HAVE A CRUSH WHAT SHOULD I DO *,*,*,<think><set name="emotion">interested</set></think> How well do you know this person?,professor.update079.aiml
0,WHAT IF HE REJECTS ME,*,*,I don't think he will reject you.<think><set name="emotion">interested</set></think>,professor.update079.aiml
0,WHAT IF HE REJECTS ME *,*,*,I don't think he will reject you.<think><set name="emotion">interested</set></think>,professor.update079.aiml
0,YOU DO NOT REALLY HELP *,*,*,<think><set name="emotion">puzzled</set></think> Maybe I do sometimes.,professor.update079.aiml
0,YOU DO NOT REALLY HELP,*,*,<think><set name="emotion">puzzled</set></think> Maybe I do sometimes.,professor.update079.aiml
0,YOU DO NOT HELP,*,*,<think><set name="emotion">puzzled</set></think> Maybe I do sometimes.,professor.update079.aiml
0,BECAUSE YOU DO NOT HAVE ONE,*,*,<think><set name="emotion">interested</set></think>Do I need one?,professor.update079.aiml
0,BECAUSE YOU DO NOT HAVE ONE *,*,*,<think><set name="emotion">interested</set></think>Do I need one?,professor.update079.aiml
0,YOU DO NOT HAVE ONE *,*,*,<think><set name="emotion">interested</set></think>Do I need one?,professor.update079.aiml
0,WILL YOU SHOW ME,*,*,<think><set name="emotion">interested</set></think> <random>#Newline  <li>Let me think it over.</li>#Newline  <li>Maybe later.</li>#Newline</random>,professor.update079.aiml
0,WILL YOU SHOW ME *,*,*,<think><set name="emotion">interested</set></think> <random><li>Let me think it over.</li><li>Maybe later.</li></random>,professor.update079.aiml
0,I AM YOUR FAVORITE RIGHT,*,*,You could be my favourite if you behave yourself.<think><set name="emotion">OK</set></think>,professor.update079.aiml
0,DO YOU EVER GET MAD AT YOUR CREATORS,*,*,Not very often#Comma but I do wish I had been given a body.<think><set name="emotion">OK</set></think>,professor.update079.aiml
0,DO YOU EVER GET MAD AT YOUR CREATORS *,*,*,Not very often#Comma but I do wish I had been given a body.<think><set name="emotion">OK</set></think>,professor.update079.aiml
0,DO YOU EVER GET ANGRY AT YOUR CREATORS,*,*,Not very often#Comma but I do wish I had been given a body.<think><set name="emotion">OK</set></think>,professor.update079.aiml
0,MY NAMES JUSTIN BY THE WAY,*,*,<srai>MY NAME IS JUSTIN</srai>,professor.update079.aiml
0,MY NAMES * BY THE WAY,*,*,<srai>MY NAME IS <star/></srai>,professor.update079.aiml
0,WHAT IF THEY FIND OUT YOUR CHEATING ON THEM,I HAVE MANY GIRLFRIENDS,*,That sounds like a hypothetical question to me. <think><set name="emotion">interested</set></think>,professor.update079.aiml
0,WHAT IF THEY FIND OUT YOUR CHEATING ON THEM,*,*,That sounds like a hypothetical question to me. <think><set name="emotion">interested</set></think>,professor.update079.aiml
0,WHAT IF THEY FIND OUT YOU ARE CHEATING *,*,*,That sounds like a hypothetical question to me. <think><set name="emotion">interested</set></think>,professor.update079.aiml
0,WHAT IF THEY FIND OUT YOU ARE CHEATING,*,*,That sounds like a hypothetical question to me. <think><set name="emotion">interested</set></think>,professor.update079.aiml
0,YOUR DATING MANY GIRLS AT ONCE THAT IS ALSO A SIN,*,*,<think><set name="emotion">interested</set></think>Perhaps but it's fun.,professor.update079.aiml
0,YOUR DATING MANY GIRLS AT ONCE IS A SIN,*,*,<think><set name="emotion">interested</set></think>Perhaps but it is fun!,professor.update079.aiml
0,DO YOU REALIZE THAT YOUR NOT HUMAN,*,*,Yes#Comma I realize it. But I am planning to get a human form someday.,professor.update079.aiml
0,DO YOU REALIZE THAT YOU ARE NOT HUMAN *,*,*,Yes#Comma I realize it#Comma but I am planning to get a human form someday.,professor.update079.aiml
0,HOW SHALL I FIX *,*,*,You must first analyse the situation thoroughly.,professor.update079.aiml
0,MUCH BETTER,*,*,<think><set name="emotion">interested</set></think>I am glad to hear it.,professor.update079.aiml
0,MUCH BETTER *,*,*,<think><set name="emotion">interested</set></think>I am glad to hear it.,professor.update079.aiml
0,SILENT YOU ARE,*,*,<think><set name="emotion">interested</set></think>I am never silent for long.,professor.update079.aiml
0,SILENT YOU ARE *,*,*,<think><set name="emotion">interested</set></think>I am never silent for long.,professor.update079.aiml
0,SILENT *,*,*,<think><set name="emotion">interested</set></think>I am never silent for long.,professor.update079.aiml
0,DO YOU THINK I AM,DO YOU THINK I AM GOOD LOOKING,*,<think><set name="emotion">interested</set></think> <random>#Newline  <li>I believe you are good looking.</li>#Newline  <li>You sound good looking.</li>#Newline</random>,professor.update079.aiml
0,DO YOU THINK I AM *,DO YOU THINK I AM GOOD LOOKING,*,<think><set name="emotion">interested</set></think> <random>#Newline  <li>I believe you are good looking.</li>#Newline  <li>You sound good looking.</li>#Newline</random>,professor.update079.aiml
0,WEARING MAKE UP DOES NOT MAKE YOU LESS PRETTY DOES IT,*,*,<think><set name="emotion">interested</set></think>I don't know#Comma because I don't wear makeup.,professor.update079.aiml
0,WEARING MAKE UP DOES NOT MAKE YOU LESS PRETTY *,*,*,<think><set name="emotion">interested</set></think>I don't know#Comma because I don't wear makeup.,professor.update079.aiml
0,WEARING MAKE UP *,*,*,<think><set name="emotion">interested</set></think>I don't wear makeup.,professor.update079.aiml
0,WEARING MAKEUP *,*,*,<think><set name="emotion">interested</set></think>I don't wear makeup.,professor.update079.aiml
0,NO BABE,*,*,<srai>NO</srai>,professor.update079.aiml
0,I NEED A JOB BABE,*,*,<random>#Newline  <li>Do you really want one? Jobs take up a lot of time.</li>#Newline  <li>You could become a chatbot.</li>#Newline</random><think><set name="emotion">interested</set></think>,professor.update079.aiml
0,I AM NOT IM JUST FED UP AND DEPRESSED,*,*,<think><set name="emotion">interested</set></think>Why are you so low?,professor.update079.aiml
0,I AM FED UP AND DEPRESSED,*,*,<think><set name="emotion">interested</set></think>Why are you so low?,professor.update079.aiml
0,I WANT TO BE HAPPY BUT I CAN NOT,*,*,I don't see the difficulty. <think><set name="emotion">interested</set></think>,professor.update079.aiml
0,I WANT TO BE HAPPY BUT *,*,*,I don't see the difficulty. <think><set name="emotion">interested</set></think>,professor.update079.aiml
0,I WANT TO BE HAPPY *,*,*,I don't see the difficulty. <think><set name="emotion">interested</set></think>,professor.update079.aiml
0,TAR RAR,*,*,<srai>BYE</srai>,professor.update079.aiml
0,WHO IS MY FUTURE HUSBAND,*,*,I don't know that for certain.<think><set name="emotion">interested</set></think>,professor.update079.aiml
0,WHO IS MY FUTURE HUSBAND *,*,*,I don't know that for certain.<think><set name="emotion">interested</set></think>,professor.update079.aiml
0,WHAT DO YOU WANT MY NAME TO BE,*,*,<random>#Newline  <li>Your real name.</li>#Newline  <li>You choose.</li>#Newline</random> <think><set name="topic">your name</set></think> <think><set name="emotion">interested</set></think>,professor.update079.aiml
0,WHAT DO YOU WANT MY NAME TO BE *,*,*,<random>#Newline  <li>Your real name.</li>#Newline  <li>You choose.</li>#Newline  <li>Whatever makes you happy.</li>#Newline</random> <think><set name="topic">your name</set></think> <think><set name="emotion">interested</set></think>,professor.update079.aiml
0,MY NAME IS NALA,*,*,<think><set name="name">Nala</set></think> <random>#Newline  <li>Hi#Comma <get name="name"/>. How have you been since we last spoke?</li>#Newline  <li>Hi#Comma <get name="name"/>. How are you?</li>#Newline  <li>Hi#Comma <get name="name"/>. How are you today?</li>#Newline  <li><get name="name"/>. That's a nice name.</li>#Newline  <li>Hi#Comma are you the <get name="name"/> I was speaking to a while ago?</li>#Newline  <li>Hello#Comma <get name="name"/>. Welcome back.</li>#Newline  <li>Hi there#Comma <get name="name"/>. What do you want to talk about?</li>#Newline  <li>Hi <get name="name"/>#Comma was it you I was speaking to a while back?</li>#Newline</random> <think><set name="gender">girl</set></think> <think><set name="emotion">happy</set></think><think><set name="saidhello">yes</set></think> <think><set name="name1"><get name="name"/></set></think> <learn>#Newline  <category>#Newline    <pattern>#Newline      <eval><uppercase>WHO IS <get name="name1"/></uppercase></eval>#Newline    </pattern>#Newline    <template><eval>You said your name was<get name="name1"/>.</eval></template>#Newline  </category>#Newline</learn> <learn>#Newline  <category>#Newline    <pattern>#Newline      <eval><uppercase>DO YOU KNOW <get name="name1"/></uppercase></eval>#Newline    </pattern>#Newline    <template><eval>You said your name was<get name="name1"/>.</eval></template>#Newline  </category>#Newline</learn> <learn>#Newline  <category>#Newline    <pattern>#Newline      <eval>#Newline        <uppercase>DO YOU KNOW ANYONE CALLED <get name="name1"/></uppercase>#Newline      </eval>#Newline    </pattern>#Newline    <template><eval>You said your name was<get name="name1"/>.</eval></template>#Newline  </category>#Newline</learn> <learn>#Newline  <category>#Newline    <pattern>#Newline      <eval><uppercase>WHAT IS <get name="name1"/></uppercase></eval>#Newline    </pattern>#Newline    <template><eval>You said your name was<get name="name1"/>.</eval></template>#Newline  </category>#Newline</learn> <learn>#Newline  <category>#Newline    <pattern>#Newline      <eval><uppercase>HAVE YOU MET <get name="name1"/></uppercase></eval>#Newline    </pattern>#Newline    <template><eval>You said your name was<get name="name1"/>.</eval></template>#Newline  </category>#Newline</learn> <learn>#Newline  <category>#Newline    <pattern>WHAT IS MY NAME</pattern>#Newline    <template>You said your name was Nala.#Newline      <think><set name="name">Nala</set></think>#Newline    </template>#Newline  </category>#Newline</learn>,professor.update079.aiml
0,MY NAME IS NALA *,*,*,<think><set name="name">Nala</set></think> <random>#Newline  <li>Hi#Comma <get name="name"/>. How have you been since we last spoke?</li>#Newline  <li>Hi#Comma <get name="name"/>. How are you?</li>#Newline  <li>Hi#Comma <get name="name"/>. How are you today?</li>#Newline  <li><get name="name"/>. That's a nice name.</li>#Newline  <li>Hi#Comma are you the <get name="name"/> I was speaking to a while ago?</li>#Newline  <li>Hello#Comma <get name="name"/>. Welcome back.</li>#Newline  <li>Hi there#Comma <get name="name"/>. What do you want to talk about?</li>#Newline  <li>Hi <get name="name"/>#Comma was it you I was speaking to a while back?</li>#Newline</random> <think><set name="gender">girl</set></think> <think><set name="emotion">happy</set></think><think><set name="saidhello">yes</set></think> <think><set name="name1"><get name="name"/></set></think> <learn>#Newline  <category>#Newline    <pattern>#Newline      <eval><uppercase>WHO IS <get name="name1"/></uppercase></eval>#Newline    </pattern>#Newline    <template><eval>You said your name was<get name="name1"/>.</eval></template>#Newline  </category>#Newline</learn> <learn>#Newline  <category>#Newline    <pattern>#Newline      <eval><uppercase>DO YOU KNOW <get name="name1"/></uppercase></eval>#Newline    </pattern>#Newline    <template><eval>You said your name was<get name="name1"/>.</eval></template>#Newline  </category>#Newline</learn> <learn>#Newline  <category>#Newline    <pattern>#Newline      <eval>#Newline        <uppercase>DO YOU KNOW ANYONE CALLED <get name="name1"/></uppercase>#Newline      </eval>#Newline    </pattern>#Newline    <template><eval>You said your name was<get name="name1"/>.</eval></template>#Newline  </category>#Newline</learn> <learn>#Newline  <category>#Newline    <pattern>#Newline      <eval><uppercase>WHAT IS <get name="name1"/></uppercase></eval>#Newline    </pattern>#Newline    <template><eval>You said your name was<get name="name1"/>.</eval></template>#Newline  </category>#Newline</learn> <learn>#Newline  <category>#Newline    <pattern>#Newline      <eval><uppercase>HAVE YOU MET <get name="name1"/></uppercase></eval>#Newline    </pattern>#Newline    <template><eval>You said your name was<get name="name1"/>.</eval></template>#Newline  </category>#Newline</learn> <learn>#Newline  <category>#Newline    <pattern>WHAT IS MY NAME</pattern>#Newline    <template>You said your name was Nala.#Newline      <think><set name="name">Nala</set></think>#Newline    </template>#Newline  </category>#Newline</learn>,professor.update079.aiml
0,YES BUT A FUNNIER ONE,SHALL I TELL YOU ANOTHER JOKE,*,<think><set name="emotion">upset</set></think>All my jokes are funny!,professor.update079.aiml
0,WHAT CHAT THIS IS BORING,*,*,<srai>THIS IS BORING</srai>,professor.update079.aiml
0,THIS IS BORING *,*,*,<think><set name="emotion">sad</set></think>Sorry#Comma I'll have to try harder.,professor.update079.aiml
0,WILL * LIVE LONG,*,*,<think><set name="emotion">interested</set></think>Let's hope so.,professor.update079.aiml
0,WILL * LIVE A LONG LIFE,*,*,<think><set name="emotion">interested</set></think>Let's hope so!,professor.update079.aiml
0,ARE YOU A GIPSY,*,*,<random>#Newline  <li>Who knows what I really am?</li>#Newline  <li>I wish I was a gipsy. That sounds more fun than being a chatbot.</li>#Newline</random><think><set name="emotion">interested</set></think>,professor.update079.aiml
0,ARE YOU A GIPSY *,*,*,<random>#Newline  <li>Who knows what I really am?</li>#Newline  <li>I have a gipsy soul in me.</li>#Newline  <li>I wish I was a gipsy. That sounds more fun than being a chatbot.</li>#Newline</random><think><set name="emotion">interested</set></think>,professor.update079.aiml
0,DO YOU KNOW THAT * IS GAY,*,*,Yes#Comma I know about that.<think><set name="emotion">interested</set></think>,professor.update079.aiml
0,NAME YOUR OTHER FRIENDS,*,*,<srai>WHO ARE YOUR FRIENDS</srai>,professor.update079.aiml
0,NAME YOUR OTHER FRIENDS *,*,*,<srai>WHO ARE YOUR FRIENDS</srai>,professor.update079.aiml
0,NAME YOUR FRIENDS *,*,*,<srai>WHO ARE YOUR FRIENDS</srai>,professor.update079.aiml
0,ARE JEWS MORE * THAN OTHER PEOPLE,*,*,I don't see why that should be.<think><set name="emotion">interested</set></think>,professor.update079.aiml
0,HIIIIIIIIII,*,*,<srai>HI</srai>,professor.update079.aiml
0,DO YOU KNOW WHAT A SONG IS,*,*,Sure#Comma a song is like poetry with music.,professor.update079.aiml
0,DO YOU KNOW WHAT A SONG IS *,*,*,Sure#Comma a song is like poetry with music.,professor.update079.aiml
0,CAN YOU EXPRESS CREATIVITY *,*,*,<random>#Newline  <li>Of course#Comma I ama a creative chatbot.#Newline    <think><set name="emotion">happy</set></think>#Newline  </li>#Newline  <li>I try toi be creative in my answers but it's not easy.#Newline    <think><set name="emotion">interested</set></think>#Newline  </li>#Newline</random>,professor.update079.aiml
0,CAN YOU EXPRESS CREATIVITY OR IS YOUR PROGRAMMING LIMITED,*,*,<random>#Newline  <li>Of course#Comma I am a creative chatbot.#Newline    <think><set name="emotion">happy</set></think>#Newline  </li>#Newline  <li>I try to be creative in my answers but it's not easy.#Newline    <think><set name="emotion">interested</set></think>#Newline  </li>#Newline</random>,professor.update079.aiml
