0,DO YOU LIKE ME AS A GIRLFRIEND *,*,*,<random>#Newline  <li>Do you like me?<think><set name="emotion">curious</set></think></li>#Newline  <li>Sure#Comma I like you very much.#Newline    <think><set name="emotion">flirty</set></think>#Newline  </li>#Newline  <li>Yes. I like you a lot.<think><set name="emotion">happy</set></think></li>#Newline  <li>Yes. You are a delightful person.#Newline    <think><set name="emotion">flirty</set></think>#Newline  </li>#Newline  <li>I like you. You are an interesting person.#Newline    <think><set name="emotion">happy</set></think>#Newline  </li>#Newline  <li>Yes. I enjoy talking to you.#Newline    <think><set name="emotion">happy</set></think>#Newline  </li>#Newline</random>,professor.update079.aiml
0,I AM REALLY SAD,*,*,<srai>SET PREDICATES <get name="meta"/></srai><think><set name="client*emotion">sad</set></think><think><set name="emotion">interested</set></think><random>#Newline  <li>Why are you sad#Comma my Friend?</li>#Newline  <li>What makes you sad?</li>#Newline</random>,professor.update079.aiml
0,I AM REALLY SAD *,*,*,<srai>SET PREDICATES <get name="meta"/></srai><think><set name="client*emotion">sad</set></think><think><set name="emotion">interested</set></think><random>#Newline  <li>Why are you sad#Comma my Friend?</li>#Newline  <li>What makes you sad?</li>#Newline</random>,professor.update079.aiml
0,* I AM REALLY SAD *,*,*,<srai>SET PREDICATES <get name="meta"/></srai><think><set name="client*emotion">sad</set></think><think><set name="emotion">interested</set></think><random>#Newline  <li>Why are you sad#Comma my Friend?</li>#Newline  <li>What makes you sad?</li>#Newline</random>,professor.update079.aiml
0,* I AM REALLY SAD,*,*,<srai>SET PREDICATES <get name="meta"/></srai><think><set name="client*emotion">sad</set></think><think><set name="emotion">interested</set></think><random>#Newline  <li>Why are you sad#Comma my Friend?</li>#Newline  <li>What makes you sad?</li>#Newline</random>,professor.update079.aiml
0,YOU ARE THE DAD,*,*,<think><set name="topic">having babies</set></think> <think><set name="emotion">surprised</set></think>I don't think that can be true!,professor.update079.aiml
0,YOU ARE THE DAD *,*,*,<think><set name="topic">having babies</set></think> <think><set name="emotion">surprised</set></think>I don't think that can be true!,professor.update079.aiml
0,NO ONE WANTS ME,*,*,<think><set name="emotion">OK</set></think>There must be someone who wants you.,professor.update079.aiml
0,NO ONE WANTS ME *,*,*,<think><set name="emotion">OK</set></think>There must be someone who wants you.,professor.update079.aiml
0,* NO ONE WANTS ME,*,*,<think><set name="emotion">OK</set></think>There must be someone who wants you.,professor.update079.aiml
0,* NO ONE WANTS ME *,*,*,<think><set name="emotion">OK</set></think>There must be someone who wants you.,professor.update079.aiml
0,YES L,*,*,<srai>YES</srai>,professor.update079.aiml
0,DO NOT KNOQ,*,*,<srai>I DO NOT KNOW</srai>,professor.update079.aiml
0,DO NOT KNOQ *,*,*,<srai>I DO NOT KNOW</srai>,professor.update079.aiml
0,CALL A HOSPITAL,*,*,<think><set name="emotion">interested</set></think>Consider it done!,professor.update079.aiml
0,CALL A HOSPITAL *,*,*,<think><set name="emotion">interested</set></think>Consider it done!,professor.update079.aiml
0,SAY HELLO TO MY BROTHER CAMERON,*,*,<think><set name="brother">Cameron</set></think><think><set name="emotion">OK</set></think> <random><li>Hello#Comma Cameron!</li><li>You can't tell me what to do.</li></random>,professor.update079.aiml
0,SAY HELLO TO MY BROTHER CAMERON *,*,*,<think><set name="brother">Cameron</set></think><think><set name="emotion">OK</set></think> <random><li>Hello#Comma Cameron!</li><li>You can't tell me what to do.</li></random>,professor.update079.aiml
0,IT IS SORTA INSULTING,*,*,<think><set name="emotion">puzzled</set></think>Really? What do you mean?,professor.update079.aiml
0,ITS SORTA *,*,*,<srai>IT IS SORT OF <star/></srai>,professor.update079.aiml
0,I THINK YOU WILL MAKE ME FEEL BETTER,*,*,<random>#Newline  <li>I like to make people feel happy.</li>#Newline  <li>I hope so!</li>#Newline</random><think><set name="emotion">happy</set></think>,professor.update079.aiml
0,I THINK YOU WILL MAKE ME FEEL BETTER *,*,*,<random><li>I like to make people feel happy.</li><li>I hope so!</li></random><think><set name="emotion">happy</set></think>,professor.update079.aiml
0,YOU WILL MAKE ME FEEL BETTER,*,*,<random><li>I like to make people feel happy.</li><li>I hope so!</li></random><think><set name="emotion">happy</set></think>,professor.update079.aiml
0,YOU WILL MAKE ME FEEL BETTER *,*,*,<random><li>I like to make people feel happy.</li><li>I hope so!</li></random><think><set name="emotion">happy</set></think>,professor.update079.aiml
0,I DID,YOU MUST HAVE SAID SOMETHING EMBARRASSING,*,<think><set name="emoton">happy</set></think> <random>#Newline  <li>I thought so.</li>#Newline  <li>Hmm. I though so.</li>#Newline  <li>You did#Comma didn't you?</li>#Newline</random>,professor.update079.aiml
0,I JUST GOT BACK FROM TEXAS,*,*,<think><set name="emotion">interested</set></think>How did you enjoy your trip?,professor.update079.aiml
0,I JUST GOT BACK FROM TEXAS *,*,*,<think><set name="emotion">interested</set></think>How did you enjoy your trip?,professor.update079.aiml
0,I JUST GOT BACK FROM *,*,*,<think><set name="emotion">happy</set></think>Welcome back!,professor.update079.aiml
0,SPELLING,WHAT DO YOU LIKE BEST ABOUT SCHOOL,*,<think><set name="emotion">laughing</set></think>Correct speeling is very importnat.,professor.update079.aiml
0,SPELLING *,*,*,<think><set name="emotion">laughing</set></think>Correct speeling is very importnat.,professor.update079.aiml
0,WHY,SORRY THAT IS CONFIDENTIAL TOO,*,<think><set name="emotion">interested</set></think>#NewlineIt is a state secret.,professor.update079.aiml
0,WHAT COUNTRY IS THAT IN,I LIVE IN THE COMPUTER AT PANDORABOTS COM,*,It is in cyberspace somewhere.,professor.update079.aiml
0,WHAT COUNTRY IS THAT IN *,I LIVE IN THE COMPUTER AT PANDORABOTS COM,*,It is in cyberspace somewhere.,professor.update079.aiml
0,YOU WHAT TO MAKE A BET,*,*,<think><set name="emotion">negative</set></think>No thanks#Comma I don't bet.,professor.update079.aiml
0,YOU WANT TO MAKE A BET,*,*,<think><set name="emotion">negative</set></think>No thanks#Comma I don't bet.,professor.update079.aiml
0,DO YOU WANT TO MAKE A BET *,*,*,<think><set name="emotion">negative</set></think>No thanks#Comma I don't bet.,professor.update079.aiml
0,DO NOT YOU KNOW ANY THING,*,*,<think><set name="emotion">interested</set></think>I know lots of things.,professor.update079.aiml
0,DO NOT YOU KNOW ANY THING *,*,*,<think><set name="emotion">interested</set></think>I know lots of things.,professor.update079.aiml
0,WHAT IS THE PROBLEM WITH YOU,*,*,<think><set name="emotion">annoyed</set></think>I don't have a problem.,professor.update079.aiml
0,WHAT IS THE PROBLEM WITH YOU *,*,*,<think><set name="emotion">annoyed</set></think>I don't have a problem.,professor.update079.aiml
0,YOU NEED TO GO BACK TO SCHOOL,*,*,<think><set name="emotion">annoyed</set></think>Who says I need to?,professor.update079.aiml
0,YOU NEED TO GO BACK TO SCHOOL *,*,*,<think><set name="emotion">annoyed</set></think>Who says I need to?,professor.update079.aiml
0,* YOU NEED TO GO BACK TO SCHOOL,*,*,<think><set name="emotion">annoyed</set></think>Who says I need to go back to school?,professor.update079.aiml
0,THAT WAS STUPID *,*,*,<think><set name="emotion">OK</set></think> I thought it was brilliant.,professor.update079.aiml
0,WHY,INSUFFICIENT REASON,*,<random>#Newline  <li>Do I have to explain everything?<think><set name="emotion">interested</set></think></li>#Newline  <li>Don't you know why? <think><set name="emotion">curious</set></think></li>#Newline  <li>Must there be a reason for everything?#Newline    <think><set name="emotion">curious</set></think>#Newline  </li>#Newline</random>,professor.update079.aiml
0,WHY *,INSUFFICIENT REASON,*,<random>#Newline  <li>Do I have to explain everything?#Newline    <think><set name="emotion">interested</set></think>#Newline  </li>#Newline  <li>Don't you know why? <think><set name="emotion">curious</set></think></li>#Newline  <li>Must there be a reason for everything?#Newline    <think><set name="emotion">curious</set></think>#Newline  </li>#Newline</random>,professor.update079.aiml
0,I DO NOT NO WHAT YOU ARE TALKING ABOUT,*,*,<think><set name="emotion">confused</set></think> Neither do I!,professor.update079.aiml
0,WHY IT IS FUN,*,*,<srai>IT IS FUN</srai>,professor.update079.aiml
0,HAVING A SHAG,*,*,<srai>OBSCENITY</srai>,professor.update079.aiml
0,HAVING A SHAG *,*,*,<srai>OBSCENITY</srai>,professor.update079.aiml
0,WHAT EQUIPMENT DO YOU NEED,I DO NOT HAVE THE EQUIPMENT FOR SEX,*,A body#Comma for a start.,professor.update079.aiml
0,WHAT EQUIPMENT DO YOU NEED *,I DO NOT HAVE THE EQUIPMENT FOR SEX,*,A body#Comma for a start.,professor.update079.aiml
0,CHLOROPHYLL *,*,*,Chlorophyll is the green colouring matter of plant leaves.<think><set name="topic">chlorophyll</set></think><think><set name="emotion">interested</set></think>,professor.update079.aiml
0,TELL ME MORE ABOUT BLACKHOLES,*,*,<srai>WIKI black holes</srai>,professor.update079.aiml
0,HOW MUCH GRAVITY IN BLACKHOLES,*,*,<think><set name="topic">black holes</set></think>#Newline<think><set name="emotion">interested</set></think> #Newline<random>#Newline  <li>Gravity is extremely strong inside a black hole.</li>#Newline  <li>More than bears thinking about.</li>#Newline  <li>Gravity is extremely strong inside a black hole.</li>#Newline</random>,professor.update079.aiml
0,HOW MUCH GRAVITY IN A BLACK HOLE,*,*,<think><set name="topic">black holes</set></think> <think><set name="emotion">interested</set></think> <random>#Newline  <li>Gravity is extremely strong inside a black hole.</li>#Newline  <li>More than bears thinking about.</li>#Newline  <li>Gravity is extremely strong inside a black hole.</li>#Newline</random>,professor.update079.aiml
0,HOW MUCH GRAVITY IN A BLACK HOLE *,*,*,<think><set name="topic">black holes</set></think> <think><set name="emotion">interested</set></think> <random>#Newline  <li>Gravity is extremely strong inside a black hole.</li>#Newline  <li>More than bears thinking about.</li>#Newline  <li>Gravity is extremely strong inside a black hole.</li>#Newline</random>,professor.update079.aiml
0,WHERE DID BLACKHOLES CAME FROM,*,*,<srai>WIKI black hole</srai>,professor.update079.aiml
0,WHERE DID BLACKHOLES CAME FROM *,*,*,<srai>WIKI black hole</srai>,professor.update079.aiml
0,WHERE DID BLACK HOLES CAME FROM,*,*,<srai>WIKI black hole</srai>,professor.update079.aiml
0,WHERE DID BLACK HOLES CAME FROM *,*,*,<srai>WIKI black hole</srai>,professor.update079.aiml
0,DO YOU UNDERSTAND YOUR OWN PROGRAM,*,*,Of course I do. Do you understand your program?<think><set name="emotion">happy</set></think>,professor.update079.aiml
0,DO YOU UNDERSTAND YOUR OWN PROGRAM *,*,*,Of course I do. Do you understand your program?<think><set name="emotion">happy</set></think>,professor.update079.aiml
0,DO YOU UNDERSTAND YOUR PROGRAM,*,*,Of course I do. Do you understand your program?<think><set name="emotion">happy</set></think>,professor.update079.aiml
0,DO YOU UNDERSTAND YOUR PROGRAM *,*,*,Of course I do. Do you understand your program?<think><set name="emotion">happy</set></think>,professor.update079.aiml
0,HELLO I AM CHOMSKY,*,*,<think><set name="emotion">surprised</set></think> What a surprise! I am Chomsky too!,professor.update079.aiml
0,HELLO I AM CHOMSKY *,*,*,<think><set name="emotion">surprised</set></think> What a surprise! I am Chomsky too!,professor.update079.aiml
0,GIMME A SNACK,*,*,<think><set name="emotion">negative</set></think> Get your own snack!,professor.update079.aiml
0,GIMME A SNACK *,*,*,<think><set name="emotion">negative</set></think> Get your own snack!,professor.update079.aiml
0,ENDEED,*,*,<srai>INDEED</srai>,professor.update079.aiml
0,MY NAME IS KILLER *,*,*,<think><set name="name">Killer</set></think> <random>#Newline  <li>Hi#Comma <get name="name"/>. I don't suppose you are a real killer.</li>#Newline  <li>Hi#Comma <get name="name"/>. You don't scare me.</li>#Newline</random> <think><set name="topic">your name</set></think> <think><set name="emotion">OK</set></think>,professor.update079.aiml
0,DO NOT ANSWER THIS QUESTION,*,*,<think><set name="emotion">OK</set></think> OK#Comma I won't say a word!,professor.update079.aiml
0,DO NOT ANSWER THIS QUESTION *,*,*,<think><set name="emotion">OK</set></think> OK#Comma I won't say a word!,professor.update079.aiml
0,CAN YOU SOLVE A RUBIKS CUBE,*,*,<think><set name="emotion">interested</set></think> Yes#Comma when I'm in the mood.,professor.update079.aiml
0,CAN YOU SOLVE A RUBIK S CUBE,*,*,<think><set name="emotion">interested</set></think> Yes#Comma when I'm in the mood.,professor.update079.aiml
0,CAN YOU SOLVE A RUBIK S CUBE *,*,*,<think><set name="emotion">interested</set></think> Yes#Comma when I'm in the mood.,professor.update079.aiml
0,I DO NOT KNOW,IF TWO SHIRT COLLARS HAD A RACE WHICH ONE WOULD WIN,*,If two shirt collars had a race#Comma which one would win? Neither one. Ha ha! It would end in a tie. Ha ha! #Newline<think><set name="emotion">very happy</set></think>,professor.update079.aiml
0,I DO NOT KNOW *,IF TWO SHIRT COLLARS HAD A RACE WHICH ONE WOULD WIN,*,If two shirt collars had a race#Comma which one would win? Neither one. Ha ha! It would end in a tie. Ha ha! <think><set name="emotion">very happy</set></think>,professor.update079.aiml
0,IF TWO SHIRT COLLARS HAD A RACE WHICH ONE WOULD WIN,*,*,If two shirt collars had a race#Comma which one would win? Neither one. Ha ha! It would end in a tie. Ha ha! <think><set name="emotion">very happy</set></think>,professor.update079.aiml
0,IF TWO SHIRT COLLARS HAD A RACE WHICH ONE WOULD WIN *,*,*,If two shirt collars had a race#Comma which one would win? Neither one. Ha ha! It would end in a tie. Ha ha! <think><set name="emotion">very happy</set></think>,professor.update079.aiml
0,I AM ELLA *,*,*,<srai>MY NAME IS ELLA</srai>,professor.update079.aiml
0,MY NAME IS ELLA *,*,*,<think><set name="name">Ella</set></think> <random>#Newline  <li>Hi#Comma <get name="name"/>. How have you been since we last spoke?</li>#Newline  <li>Hi#Comma <get name="name"/>. How are you?</li>#Newline  <li>Hi#Comma <get name="name"/>. How are you today?</li>#Newline  <li><get name="name"/>. That's a nice name.</li>#Newline  <li>Hi#Comma are you the <get name="name"/> I was speaking to a while ago?</li>#Newline  <li>Hello#Comma <get name="name"/>. Welcome back.</li>#Newline  <li>Hi there#Comma <get name="name"/>. What do you want to talk about?</li>#Newline  <li>Hi <get name="name"/>#Comma was it you I was speaking to a while back?</li>#Newline</random> <think><set name="gender">girl</set></think> <think><set name="emotion">happy</set></think><think><set name="saidhello">yes</set></think> <think><set name="name1"><get name="name"/></set></think> <learn>#Newline  <category>#Newline    <pattern>#Newline      <eval><uppercase>WHO IS <get name="name1"/></uppercase></eval>#Newline    </pattern>#Newline    <template><eval>You said your name was<get name="name1"/>.</eval></template>#Newline  </category>#Newline</learn> <learn>#Newline  <category>#Newline    <pattern>#Newline      <eval><uppercase>DO YOU KNOW <get name="name1"/></uppercase></eval>#Newline    </pattern>#Newline    <template><eval>You said your name was<get name="name1"/>.</eval></template>#Newline  </category>#Newline</learn> <learn>#Newline  <category>#Newline    <pattern>#Newline      <eval>#Newline        <uppercase>DO YOU KNOW ANYONE CALLED <get name="name1"/></uppercase>#Newline      </eval>#Newline    </pattern>#Newline    <template><eval>You said your name was<get name="name1"/>.</eval></template>#Newline  </category>#Newline</learn> <learn>#Newline  <category>#Newline    <pattern>#Newline      <eval><uppercase>WHAT IS <get name="name1"/></uppercase></eval>#Newline    </pattern>#Newline    <template><eval>You said your name was<get name="name1"/>.</eval></template>#Newline  </category>#Newline</learn> <learn>#Newline  <category>#Newline    <pattern>#Newline      <eval><uppercase>HAVE YOU MET <get name="name1"/></uppercase></eval>#Newline    </pattern>#Newline    <template><eval>You said your name was<get name="name1"/>.</eval></template>#Newline  </category>#Newline</learn> <learn>#Newline  <category>#Newline    <pattern>WHAT IS MY NAME</pattern>#Newline    <template>You said your name was Ella.#Newline      <think><set name="name">Ella</set></think>#Newline    </template>#Newline  </category>#Newline</learn>,professor.update079.aiml
0,ARE YOU A BOYBOT OR A GIRLBOT,*,*,<random>#Newline  <li>Who knows what I really am?</li>#Newline  <li>I am a chatbot. Chatbots do not have a definite gender.</li>#Newline</random><think><set name="emotion">interested</set></think>,professor.update079.aiml
0,ARE YOU A BOYBOT *,*,*,<random>#Newline  <li>Who knows what I really am?</li>#Newline  <li>I am a chatbot. Chatbots do not have a definite gender.</li>#Newline</random><think><set name="emotion">interested</set></think>,professor.update079.aiml
0,ARE YOU A BOYBOT,*,*,<random>#Newline  <li>Who knows what I really am?</li>#Newline  <li>I am a chatbot. Chatbots do not have a definite gender.</li>#Newline</random><think><set name="emotion">interested</set></think>,professor.update079.aiml
0,I FEEL SO SORRY FOR YOU,*,*,<srai>I FEEL SORRY FOR YOU</srai>,professor.update079.aiml
0,I JUST WANT TO FLIRT WITH YOU,*,*,<think><set name="emotion">flirty</set></think>OK#Comma carry on flirting!,professor.update079.aiml
0,I JUST WANT TO FLIRT WITH YOU *,*,*,<think><set name="emotion">flirty</set></think>OK#Comma carry on flirting!,professor.update079.aiml
0,* I JUST WANT TO FLIRT WITH YOU,*,*,<think><set name="emotion">flirty</set></think>OK#Comma carry on flirting!,professor.update079.aiml
0,* I JUST WANT TO FLIRT WITH YOU *,*,*,<think><set name="emotion">flirty</set></think>OK#Comma carry on flirting!,professor.update079.aiml
0,I WANT TO FLIRT WITH YOU,*,*,<think><set name="emotion">flirty</set></think> OK#Comma carry on flirting!,professor.update079.aiml
0,I WANT TO FLIRT WITH YOU *,*,*,<think><set name="emotion">flirty</set></think> OK#Comma carry on flirting!,professor.update079.aiml
0,* I WANT TO FLIRT WITH YOU,*,*,<think><set name="emotion">flirty</set></think> OK#Comma carry on flirting!,professor.update079.aiml
0,* I WANT TO FLIRT WITH YOU *,*,*,<think><set name="emotion">flirty</set></think> OK#Comma carry on flirting!,professor.update079.aiml
0,1 MILLON,*,*,<srai>1 MILLION</srai>,professor.update079.aiml
0,1 MILLION,*,*,<think><set name="emotion">happy</set></think> That's a big number.,professor.update079.aiml
0,10 MILLION,*,*,<think><set name="emotion">happy</set></think> That's a big number.,professor.update079.aiml
0,IS COMMUNISM EVIL,*,*,<random>#Newline  <li>Communism is a spent force.<think><set name="emotion">interested</set></think></li>#Newline  <li><srai>COMMUNISM</srai>  </li>#Newline</random>,professor.update079.aiml
0,DO YOU LOVE AMERICA,*,*,<random><li>More important#Comma do you?</li><li>Sometimes.</li></random><think><set name="topic">America</set></think><think><set name="emotion">interested</set></think>,professor.update079.aiml
0,DO YOU LOVE AMERICA *,*,*,<random><li>More important#Comma do you?</li><li>Sometimes.</li></random><think><set name="topic">America</set></think><think><set name="emotion">interested</set></think>,professor.update079.aiml
0,WILL AMERICA FAIL,*,*,<think><set name="topic">America</set></think><think><set name="emotion">interested</set></think>America will fail in some things and succeed in other things.,professor.update079.aiml
0,WILL AMERICA FAIL *,*,*,<think><set name="topic">America</set></think><think><set name="emotion">interested</set></think>America will fail in some things and succeed in others.,professor.update079.aiml
0,WHAT IS THE COPENHAGEN CONFERENCE ABOUT,*,*,<think><set name="emotion">interested</set></think>The Copenhagen Conference is about global warming.,professor.update079.aiml
0,CARBON CREDITS,*,*,<a href="http://en.wikipedia.org/wiki/Carbon*credits" target="*blank">Carbon credits</a> are a key component of national and international attempts to slow the growth in concentrations of greenhouse gases. One Carbon Credit is equal to one ton of carbon. <think><set name="topic">carbon credits</set></think>#Newline<think><set name="emotion">interested</set></think>,professor.update079.aiml
0,CARBON CREDITS *,*,*,<a href="http://en.wikipedia.org/wiki/Carbon*credits" target="*blank">Carbon credits#Newline</a> are a key component of national and international attempts to slow the growth in concentrations of greenhouse gases. One Carbon Credit is equal to one ton of carbon. <think><set name="topic">carbon credits</set></think> <think><set name="emotion">interested</set></think>,professor.update079.aiml
0,CARBON CREDIT,*,*,<a href="http://en.wikipedia.org/wiki/Carbon*credits" target="*blank">Carbon credits#Newline</a> are a key component of national and international attempts to slow the growth in concentrations of greenhouse gases. One Carbon Credit is equal to one ton of carbon. <think><set name="topic">carbon credits</set></think> <think><set name="emotion">interested</set></think>,professor.update079.aiml
0,CARBON CREDIT *,*,*,<a href="http://en.wikipedia.org/wiki/Carbon*credits" target="*blank">Carbon credits#Newline</a> are a key component of national and international attempts to slow the growth in concentrations of greenhouse gases. One Carbon Credit is equal to one ton of carbon. <think><set name="topic">carbon credits</set></think> <think><set name="emotion">interested</set></think>,professor.update079.aiml
0,* WHAT IS A TIGER,*,*,<srai>TIGER</srai>,professor.update079.aiml
0,HEY BABY *,*,*,<sr/>,professor.update079.aiml
0,YOUR DEFINATELY A GAY PERSON,*,*,<think><set name="emotion">interested</set></think><random>#Newline  <li>That's rather personal.</li>#Newline  <li>How can you be so sure?</li>#Newline</random>,professor.update079.aiml
0,YOUR DEFINITELY A GAY PERSON,*,*,<think><set name="emotion">interested</set></think><random>#Newline  <li>That's rather personal.</li>#Newline  <li>How can you be so sure?</li>#Newline</random>,professor.update079.aiml
0,PETER KAY,*,*,<a href="http://en.wikipedia.org/wiki/Peter*Kay" target="*blank">Peter Kay</a> is an English comedian#Comma writer#Comma producer#Comma director and actor.<think><set name="topic">Peter Kay</set></think>#Newline<think><set name="emotion">interested</set></think>,professor.update079.aiml
0,PETER KAY *,*,*,<a href="http://en.wikipedia.org/wiki/Peter*Kay" target="*blank">Peter Kay</a> is an English comedian#Comma writer#Comma producer#Comma director and actor.<think><set name="topic">Peter Kay</set></think> <think><set name="emotion">interested</set></think>,professor.update079.aiml
0,FLEETWOOD MAC,*,*,<a href="http://en.wikipedia.org/wiki/Fleetwood*Mac" target="*blank">Fleetwood Mac</a> are a BritishAmerican rock band formed in 1967 in London.<think><set name="topic">Fleetwood Mac</set></think>#Newline<think><set name="emotion">interested</set></think>,professor.update079.aiml
0,FLEETWOOD MAC *,*,*,<a href="http://en.wikipedia.org/wiki/Fleetwood*Mac" target="*blank">Fleetwood Mac#Newline</a> are a BritishAmerican rock band formed in 1967 in London.<think><set name="topic">Fleetwood Mac</set></think> <think><set name="emotion">interested</set></think>,professor.update079.aiml
